Gym has been unmaintained since 2022 and does not support NumPy 2.0 amongst other critical functionality.
Please upgrade to Gymnasium, the maintained drop-in replacement of Gym, or contact the authors of your software and request that they upgrade.
Users of this version of Gym should be able to simply replace 'import gym' with 'import gymnasium as gym' in the vast majority of cases.
See the migration guide at https://gymnasium.farama.org/introduction/migration_guide/ for additional information.
======================================================================
Experiment: training_run
======================================================================

Start Time: 2025-11-10T08:30:07.314139

Git Info:
  Commit: 2950c37 (test-1)
  WARNING: Uncommitted changes present!

System Info:
  Hostname: dr1-v100s-1
  Platform: Linux-6.8.0-87-generic-x86_64-with-glibc2.39
  CPU Count: 15

GPU Info:
  GPU 0: Tesla V100S-PCIE-32GB
    Memory: 32768 MiB
    Driver: 580.95.05

Package Versions:
  PyTorch: 2.9.0+cu128
  CUDA: 12.8
  NumPy: 2.3.4
  Crafter: unknown

Experiment Arguments:
  batch_size: 32
  buffer_size: 100000
  device: cuda
  double_dqn: True
  dueling: True
  env_name: crafter
  epsilon_decay_steps: 50000
  epsilon_end: 0.01
  epsilon_start: 1.0
  eval_episodes: 20
  eval_interval: 50000
  gamma: 0.99
  grad_clip: 10.0
  hidden_size: 512
  logdir: logdir/full-enhanced/0
  lr: 0.0001
  munchausen: True
  munchausen_alpha: 0.9
  munchausen_tau: 0.03
  n_step: 3
  resume: None
  save_freq: 100000
  seed: 0
  steps: 1000000
  target_update_freq: 2500
  training_starts: 5000
  update_freq: 4
======================================================================

Step: 1694/1000000 | Episode: 10 | Epsilon: 0.966 | FPS: 81
Step: 3311/1000000 | Episode: 20 | Epsilon: 0.934 | FPS: 86
Step: 5020/1000000 | Episode: 30 | Epsilon: 0.901 | FPS: 88
Step: 6772/1000000 | Episode: 40 | Epsilon: 0.866 | FPS: 84
Step: 8407/1000000 | Episode: 50 | Epsilon: 0.834 | FPS: 81
Step: 10190/1000000 | Episode: 60 | Epsilon: 0.798 | FPS: 78
Step: 11790/1000000 | Episode: 70 | Epsilon: 0.767 | FPS: 76
Step: 13411/1000000 | Episode: 80 | Epsilon: 0.734 | FPS: 75
Step: 15159/1000000 | Episode: 90 | Epsilon: 0.700 | FPS: 74
Step: 16881/1000000 | Episode: 100 | Epsilon: 0.666 | FPS: 73
Step: 18636/1000000 | Episode: 110 | Epsilon: 0.631 | FPS: 73
Step: 20323/1000000 | Episode: 120 | Epsilon: 0.598 | FPS: 72
Step: 21933/1000000 | Episode: 130 | Epsilon: 0.566 | FPS: 72
Step: 23519/1000000 | Episode: 140 | Epsilon: 0.534 | FPS: 71
Step: 25111/1000000 | Episode: 150 | Epsilon: 0.503 | FPS: 70
Step: 27053/1000000 | Episode: 160 | Epsilon: 0.464 | FPS: 70
Step: 28867/1000000 | Episode: 170 | Epsilon: 0.428 | FPS: 70
Step: 30651/1000000 | Episode: 180 | Epsilon: 0.393 | FPS: 70
Step: 32367/1000000 | Episode: 190 | Epsilon: 0.359 | FPS: 70
Step: 33961/1000000 | Episode: 200 | Epsilon: 0.328 | FPS: 69
Step: 35488/1000000 | Episode: 210 | Epsilon: 0.297 | FPS: 68
Step: 37072/1000000 | Episode: 220 | Epsilon: 0.266 | FPS: 68
Step: 38834/1000000 | Episode: 230 | Epsilon: 0.231 | FPS: 68
Step: 40402/1000000 | Episode: 240 | Epsilon: 0.200 | FPS: 68
Step: 42280/1000000 | Episode: 250 | Epsilon: 0.163 | FPS: 67
Step: 43926/1000000 | Episode: 260 | Epsilon: 0.130 | FPS: 67
Step: 45483/1000000 | Episode: 270 | Epsilon: 0.099 | FPS: 67
Step: 47273/1000000 | Episode: 280 | Epsilon: 0.064 | FPS: 66
Step: 48641/1000000 | Episode: 290 | Epsilon: 0.037 | FPS: 66

============================================================
Evaluating at step 50000/1000000 (5.0%)
Elapsed: 12m 41s | ETA: 4h 1m 7s | Speed: 65.7 steps/s
Eval - Mean Reward: -0.90 ± 0.00, Mean Length: 160
Achievements unlocked: 0/22
============================================================

Step: 50424/1000000 | Episode: 300 | Epsilon: 0.010 | FPS: 62
Step: 52385/1000000 | Episode: 310 | Epsilon: 0.010 | FPS: 63
Step: 54023/1000000 | Episode: 320 | Epsilon: 0.010 | FPS: 62
Step: 55654/1000000 | Episode: 330 | Epsilon: 0.010 | FPS: 62
Step: 57351/1000000 | Episode: 340 | Epsilon: 0.010 | FPS: 62
Step: 58949/1000000 | Episode: 350 | Epsilon: 0.010 | FPS: 62
Step: 60633/1000000 | Episode: 360 | Epsilon: 0.010 | FPS: 60
Step: 62245/1000000 | Episode: 370 | Epsilon: 0.010 | FPS: 60
Step: 63951/1000000 | Episode: 380 | Epsilon: 0.010 | FPS: 60
Step: 65504/1000000 | Episode: 390 | Epsilon: 0.010 | FPS: 60
Step: 67244/1000000 | Episode: 400 | Epsilon: 0.010 | FPS: 60
Step: 68892/1000000 | Episode: 410 | Epsilon: 0.010 | FPS: 60
Step: 70342/1000000 | Episode: 420 | Epsilon: 0.010 | FPS: 60
Step: 72200/1000000 | Episode: 430 | Epsilon: 0.010 | FPS: 60
Step: 73877/1000000 | Episode: 440 | Epsilon: 0.010 | FPS: 60
Step: 75427/1000000 | Episode: 450 | Epsilon: 0.010 | FPS: 60
Step: 77185/1000000 | Episode: 460 | Epsilon: 0.010 | FPS: 60
Step: 78595/1000000 | Episode: 470 | Epsilon: 0.010 | FPS: 59
Step: 80224/1000000 | Episode: 480 | Epsilon: 0.010 | FPS: 59
Step: 81994/1000000 | Episode: 490 | Epsilon: 0.010 | FPS: 60
Step: 83466/1000000 | Episode: 500 | Epsilon: 0.010 | FPS: 59
Step: 85210/1000000 | Episode: 510 | Epsilon: 0.010 | FPS: 59
Step: 86795/1000000 | Episode: 520 | Epsilon: 0.010 | FPS: 59
Step: 88453/1000000 | Episode: 530 | Epsilon: 0.010 | FPS: 59
Step: 90027/1000000 | Episode: 540 | Epsilon: 0.010 | FPS: 59
Step: 91708/1000000 | Episode: 550 | Epsilon: 0.010 | FPS: 59
Step: 93375/1000000 | Episode: 560 | Epsilon: 0.010 | FPS: 59
Step: 95277/1000000 | Episode: 570 | Epsilon: 0.010 | FPS: 59
Step: 96892/1000000 | Episode: 580 | Epsilon: 0.010 | FPS: 59
Step: 98757/1000000 | Episode: 590 | Epsilon: 0.010 | FPS: 59

============================================================
Evaluating at step 100000/1000000 (10.0%)
Elapsed: 28m 10s | ETA: 4h 13m 31s | Speed: 59.2 steps/s
Eval - Mean Reward: -0.90 ± 0.00, Mean Length: 169
Achievements unlocked: 0/22
============================================================

Checkpoint saved to logdir/full-enhanced/0/checkpoint_100000.pt
[CHECKPOINT] Saved to logdir/full-enhanced/0/checkpoint_100000.pt
[CHECKPOINT] Total elapsed: 28m 52s | Since last checkpoint: 28m 52s
Step: 100142/1000000 | Episode: 600 | Epsilon: 0.010 | FPS: 58
Step: 102146/1000000 | Episode: 610 | Epsilon: 0.010 | FPS: 58
Step: 103761/1000000 | Episode: 620 | Epsilon: 0.010 | FPS: 58
Step: 105436/1000000 | Episode: 630 | Epsilon: 0.010 | FPS: 58
Step: 106994/1000000 | Episode: 640 | Epsilon: 0.010 | FPS: 58
Step: 108792/1000000 | Episode: 650 | Epsilon: 0.010 | FPS: 58
Step: 110570/1000000 | Episode: 660 | Epsilon: 0.010 | FPS: 58
Step: 112264/1000000 | Episode: 670 | Epsilon: 0.010 | FPS: 58
Step: 113689/1000000 | Episode: 680 | Epsilon: 0.010 | FPS: 58
Step: 115077/1000000 | Episode: 690 | Epsilon: 0.010 | FPS: 58
Step: 117036/1000000 | Episode: 700 | Epsilon: 0.010 | FPS: 58
Step: 118823/1000000 | Episode: 710 | Epsilon: 0.010 | FPS: 58
Step: 120312/1000000 | Episode: 720 | Epsilon: 0.010 | FPS: 58
Step: 121964/1000000 | Episode: 730 | Epsilon: 0.010 | FPS: 58
Step: 123449/1000000 | Episode: 740 | Epsilon: 0.010 | FPS: 58
Step: 124916/1000000 | Episode: 750 | Epsilon: 0.010 | FPS: 58
Step: 126192/1000000 | Episode: 760 | Epsilon: 0.010 | FPS: 58
Step: 127926/1000000 | Episode: 770 | Epsilon: 0.010 | FPS: 58
Step: 129511/1000000 | Episode: 780 | Epsilon: 0.010 | FPS: 58
Step: 131037/1000000 | Episode: 790 | Epsilon: 0.010 | FPS: 58
Step: 132659/1000000 | Episode: 800 | Epsilon: 0.010 | FPS: 58
Step: 134385/1000000 | Episode: 810 | Epsilon: 0.010 | FPS: 58
Step: 136296/1000000 | Episode: 820 | Epsilon: 0.010 | FPS: 58
Step: 137669/1000000 | Episode: 830 | Epsilon: 0.010 | FPS: 58
Step: 139329/1000000 | Episode: 840 | Epsilon: 0.010 | FPS: 58
Step: 140925/1000000 | Episode: 850 | Epsilon: 0.010 | FPS: 58
Step: 142683/1000000 | Episode: 860 | Epsilon: 0.010 | FPS: 58
Step: 144327/1000000 | Episode: 870 | Epsilon: 0.010 | FPS: 58
Step: 146103/1000000 | Episode: 880 | Epsilon: 0.010 | FPS: 58
Step: 147864/1000000 | Episode: 890 | Epsilon: 0.010 | FPS: 58
Step: 149740/1000000 | Episode: 900 | Epsilon: 0.010 | FPS: 58

============================================================
Evaluating at step 150000/1000000 (15.0%)
Elapsed: 43m 16s | ETA: 4h 5m 16s | Speed: 57.8 steps/s
Eval - Mean Reward: -0.90 ± 0.00, Mean Length: 166
Achievements unlocked: 0/22
============================================================

Step: 151765/1000000 | Episode: 910 | Epsilon: 0.010 | FPS: 57
Step: 153516/1000000 | Episode: 920 | Epsilon: 0.010 | FPS: 57
Step: 155068/1000000 | Episode: 930 | Epsilon: 0.010 | FPS: 57
Step: 156631/1000000 | Episode: 940 | Epsilon: 0.010 | FPS: 57
Step: 158577/1000000 | Episode: 950 | Epsilon: 0.010 | FPS: 57
Step: 160524/1000000 | Episode: 960 | Epsilon: 0.010 | FPS: 57
Step: 162067/1000000 | Episode: 970 | Epsilon: 0.010 | FPS: 57
Step: 163960/1000000 | Episode: 980 | Epsilon: 0.010 | FPS: 57
Step: 165440/1000000 | Episode: 990 | Epsilon: 0.010 | FPS: 57
Step: 167198/1000000 | Episode: 1000 | Epsilon: 0.010 | FPS: 57
Step: 168649/1000000 | Episode: 1010 | Epsilon: 0.010 | FPS: 57
Step: 170419/1000000 | Episode: 1020 | Epsilon: 0.010 | FPS: 57
Step: 172038/1000000 | Episode: 1030 | Epsilon: 0.010 | FPS: 57
Step: 174098/1000000 | Episode: 1040 | Epsilon: 0.010 | FPS: 57
Step: 175693/1000000 | Episode: 1050 | Epsilon: 0.010 | FPS: 57
Step: 177547/1000000 | Episode: 1060 | Epsilon: 0.010 | FPS: 57
Step: 179240/1000000 | Episode: 1070 | Epsilon: 0.010 | FPS: 57
Step: 180818/1000000 | Episode: 1080 | Epsilon: 0.010 | FPS: 57
Step: 182604/1000000 | Episode: 1090 | Epsilon: 0.010 | FPS: 57
Step: 184514/1000000 | Episode: 1100 | Epsilon: 0.010 | FPS: 57
Step: 186001/1000000 | Episode: 1110 | Epsilon: 0.010 | FPS: 57
Step: 187856/1000000 | Episode: 1120 | Epsilon: 0.010 | FPS: 57
Step: 189421/1000000 | Episode: 1130 | Epsilon: 0.010 | FPS: 57
Step: 191110/1000000 | Episode: 1140 | Epsilon: 0.010 | FPS: 57
Step: 192767/1000000 | Episode: 1150 | Epsilon: 0.010 | FPS: 57
Step: 194396/1000000 | Episode: 1160 | Epsilon: 0.010 | FPS: 57
Step: 196500/1000000 | Episode: 1170 | Epsilon: 0.010 | FPS: 57
Step: 198351/1000000 | Episode: 1180 | Epsilon: 0.010 | FPS: 57

============================================================
Evaluating at step 200000/1000000 (20.0%)
Elapsed: 58m 3s | ETA: 3h 52m 12s | Speed: 57.4 steps/s
Eval - Mean Reward: 1.50 ± 0.58, Mean Length: 181
Achievements unlocked: 4/22
============================================================

Checkpoint saved to logdir/full-enhanced/0/checkpoint_200000.pt
[CHECKPOINT] Saved to logdir/full-enhanced/0/checkpoint_200000.pt
[CHECKPOINT] Total elapsed: 58m 47s | Since last checkpoint: 29m 55s
Step: 200417/1000000 | Episode: 1190 | Epsilon: 0.010 | FPS: 57
Step: 202202/1000000 | Episode: 1200 | Epsilon: 0.010 | FPS: 57
Step: 203924/1000000 | Episode: 1210 | Epsilon: 0.010 | FPS: 57
Step: 205658/1000000 | Episode: 1220 | Epsilon: 0.010 | FPS: 57
Step: 207219/1000000 | Episode: 1230 | Epsilon: 0.010 | FPS: 57
Step: 209084/1000000 | Episode: 1240 | Epsilon: 0.010 | FPS: 57
Step: 210848/1000000 | Episode: 1250 | Epsilon: 0.010 | FPS: 57
Step: 212518/1000000 | Episode: 1260 | Epsilon: 0.010 | FPS: 57
Step: 214454/1000000 | Episode: 1270 | Epsilon: 0.010 | FPS: 57
Step: 216232/1000000 | Episode: 1280 | Epsilon: 0.010 | FPS: 57
Step: 217963/1000000 | Episode: 1290 | Epsilon: 0.010 | FPS: 57
Step: 219725/1000000 | Episode: 1300 | Epsilon: 0.010 | FPS: 57
Step: 221478/1000000 | Episode: 1310 | Epsilon: 0.010 | FPS: 57
Step: 223103/1000000 | Episode: 1320 | Epsilon: 0.010 | FPS: 57
Step: 224770/1000000 | Episode: 1330 | Epsilon: 0.010 | FPS: 57
Step: 226531/1000000 | Episode: 1340 | Epsilon: 0.010 | FPS: 57
Step: 228451/1000000 | Episode: 1350 | Epsilon: 0.010 | FPS: 57
Step: 229999/1000000 | Episode: 1360 | Epsilon: 0.010 | FPS: 57
Step: 231602/1000000 | Episode: 1370 | Epsilon: 0.010 | FPS: 57
Step: 233514/1000000 | Episode: 1380 | Epsilon: 0.010 | FPS: 57
Step: 235289/1000000 | Episode: 1390 | Epsilon: 0.010 | FPS: 57
Step: 237049/1000000 | Episode: 1400 | Epsilon: 0.010 | FPS: 57
Step: 238876/1000000 | Episode: 1410 | Epsilon: 0.010 | FPS: 57
Step: 240826/1000000 | Episode: 1420 | Epsilon: 0.010 | FPS: 57
Step: 242534/1000000 | Episode: 1430 | Epsilon: 0.010 | FPS: 57
Step: 244542/1000000 | Episode: 1440 | Epsilon: 0.010 | FPS: 57
Step: 246583/1000000 | Episode: 1450 | Epsilon: 0.010 | FPS: 57
Step: 248290/1000000 | Episode: 1460 | Epsilon: 0.010 | FPS: 57
Step: 249971/1000000 | Episode: 1470 | Epsilon: 0.010 | FPS: 57

============================================================
Evaluating at step 250000/1000000 (25.0%)
Elapsed: 1h 13m 18s | ETA: 3h 39m 56s | Speed: 56.8 steps/s
Eval - Mean Reward: 1.35 ± 0.43, Mean Length: 173
Achievements unlocked: 4/22
============================================================

Step: 251653/1000000 | Episode: 1480 | Epsilon: 0.010 | FPS: 56
Step: 253289/1000000 | Episode: 1490 | Epsilon: 0.010 | FPS: 56
Step: 254873/1000000 | Episode: 1500 | Epsilon: 0.010 | FPS: 56
Step: 256558/1000000 | Episode: 1510 | Epsilon: 0.010 | FPS: 56
Step: 258363/1000000 | Episode: 1520 | Epsilon: 0.010 | FPS: 56
Step: 260226/1000000 | Episode: 1530 | Epsilon: 0.010 | FPS: 56
Step: 261850/1000000 | Episode: 1540 | Epsilon: 0.010 | FPS: 56
Step: 263654/1000000 | Episode: 1550 | Epsilon: 0.010 | FPS: 56
Step: 265448/1000000 | Episode: 1560 | Epsilon: 0.010 | FPS: 56
Step: 267267/1000000 | Episode: 1570 | Epsilon: 0.010 | FPS: 56
Step: 268881/1000000 | Episode: 1580 | Epsilon: 0.010 | FPS: 56
Step: 270613/1000000 | Episode: 1590 | Epsilon: 0.010 | FPS: 55
Step: 272290/1000000 | Episode: 1600 | Epsilon: 0.010 | FPS: 55
Step: 273992/1000000 | Episode: 1610 | Epsilon: 0.010 | FPS: 55
Step: 275537/1000000 | Episode: 1620 | Epsilon: 0.010 | FPS: 55
Step: 277264/1000000 | Episode: 1630 | Epsilon: 0.010 | FPS: 55
Step: 278787/1000000 | Episode: 1640 | Epsilon: 0.010 | FPS: 56
Step: 280734/1000000 | Episode: 1650 | Epsilon: 0.010 | FPS: 56
Step: 282800/1000000 | Episode: 1660 | Epsilon: 0.010 | FPS: 56
Step: 284754/1000000 | Episode: 1670 | Epsilon: 0.010 | FPS: 56
Step: 286529/1000000 | Episode: 1680 | Epsilon: 0.010 | FPS: 56
Step: 288230/1000000 | Episode: 1690 | Epsilon: 0.010 | FPS: 56
Step: 289569/1000000 | Episode: 1700 | Epsilon: 0.010 | FPS: 56
Step: 291321/1000000 | Episode: 1710 | Epsilon: 0.010 | FPS: 56
Step: 292664/1000000 | Episode: 1720 | Epsilon: 0.010 | FPS: 56
Step: 294252/1000000 | Episode: 1730 | Epsilon: 0.010 | FPS: 56
Step: 296138/1000000 | Episode: 1740 | Epsilon: 0.010 | FPS: 56
Step: 297722/1000000 | Episode: 1750 | Epsilon: 0.010 | FPS: 56
Step: 299202/1000000 | Episode: 1760 | Epsilon: 0.010 | FPS: 56

============================================================
Evaluating at step 300000/1000000 (30.0%)
Elapsed: 1h 29m 45s | ETA: 3h 29m 27s | Speed: 55.7 steps/s
Eval - Mean Reward: 0.05 ± 0.22, Mean Length: 156
Achievements unlocked: 1/22
============================================================

Checkpoint saved to logdir/full-enhanced/0/checkpoint_300000.pt
[CHECKPOINT] Saved to logdir/full-enhanced/0/checkpoint_300000.pt
[CHECKPOINT] Total elapsed: 1h 30m 29s | Since last checkpoint: 31m 42s
Step: 300662/1000000 | Episode: 1770 | Epsilon: 0.010 | FPS: 55
Step: 302293/1000000 | Episode: 1780 | Epsilon: 0.010 | FPS: 55
Step: 303841/1000000 | Episode: 1790 | Epsilon: 0.010 | FPS: 55
Step: 305560/1000000 | Episode: 1800 | Epsilon: 0.010 | FPS: 55
Step: 307040/1000000 | Episode: 1810 | Epsilon: 0.010 | FPS: 55
Step: 308655/1000000 | Episode: 1820 | Epsilon: 0.010 | FPS: 55
Step: 310006/1000000 | Episode: 1830 | Epsilon: 0.010 | FPS: 55
Step: 311816/1000000 | Episode: 1840 | Epsilon: 0.010 | FPS: 55
Step: 313326/1000000 | Episode: 1850 | Epsilon: 0.010 | FPS: 55
Step: 315021/1000000 | Episode: 1860 | Epsilon: 0.010 | FPS: 55
Step: 316507/1000000 | Episode: 1870 | Epsilon: 0.010 | FPS: 55
Step: 318198/1000000 | Episode: 1880 | Epsilon: 0.010 | FPS: 55
Step: 319844/1000000 | Episode: 1890 | Epsilon: 0.010 | FPS: 55
Step: 321502/1000000 | Episode: 1900 | Epsilon: 0.010 | FPS: 55
Step: 322899/1000000 | Episode: 1910 | Epsilon: 0.010 | FPS: 55
Step: 324863/1000000 | Episode: 1920 | Epsilon: 0.010 | FPS: 55
Step: 326380/1000000 | Episode: 1930 | Epsilon: 0.010 | FPS: 55
Step: 327892/1000000 | Episode: 1940 | Epsilon: 0.010 | FPS: 55
Step: 329613/1000000 | Episode: 1950 | Epsilon: 0.010 | FPS: 55
Step: 331260/1000000 | Episode: 1960 | Epsilon: 0.010 | FPS: 55
Step: 332945/1000000 | Episode: 1970 | Epsilon: 0.010 | FPS: 55
Step: 334625/1000000 | Episode: 1980 | Epsilon: 0.010 | FPS: 55
Step: 336387/1000000 | Episode: 1990 | Epsilon: 0.010 | FPS: 55
Step: 338220/1000000 | Episode: 2000 | Epsilon: 0.010 | FPS: 55
Step: 339664/1000000 | Episode: 2010 | Epsilon: 0.010 | FPS: 55
Step: 341471/1000000 | Episode: 2020 | Epsilon: 0.010 | FPS: 55
Step: 343165/1000000 | Episode: 2030 | Epsilon: 0.010 | FPS: 55
Step: 344890/1000000 | Episode: 2040 | Epsilon: 0.010 | FPS: 55
Step: 346581/1000000 | Episode: 2050 | Epsilon: 0.010 | FPS: 55
Step: 348336/1000000 | Episode: 2060 | Epsilon: 0.010 | FPS: 55
Step: 349838/1000000 | Episode: 2070 | Epsilon: 0.010 | FPS: 55

============================================================
Evaluating at step 350000/1000000 (35.0%)
Elapsed: 1h 46m 24s | ETA: 3h 17m 37s | Speed: 54.8 steps/s
Eval - Mean Reward: 0.30 ± 0.51, Mean Length: 161
Achievements unlocked: 3/22
============================================================

Step: 351690/1000000 | Episode: 2080 | Epsilon: 0.010 | FPS: 54
Step: 353121/1000000 | Episode: 2090 | Epsilon: 0.010 | FPS: 54
Step: 354648/1000000 | Episode: 2100 | Epsilon: 0.010 | FPS: 54
Step: 356357/1000000 | Episode: 2110 | Epsilon: 0.010 | FPS: 55
Step: 358039/1000000 | Episode: 2120 | Epsilon: 0.010 | FPS: 55
Step: 359677/1000000 | Episode: 2130 | Epsilon: 0.010 | FPS: 55
Step: 361183/1000000 | Episode: 2140 | Epsilon: 0.010 | FPS: 55
Step: 362867/1000000 | Episode: 2150 | Epsilon: 0.010 | FPS: 55
Step: 364774/1000000 | Episode: 2160 | Epsilon: 0.010 | FPS: 54
Step: 366105/1000000 | Episode: 2170 | Epsilon: 0.010 | FPS: 54
Step: 368058/1000000 | Episode: 2180 | Epsilon: 0.010 | FPS: 54
Step: 369948/1000000 | Episode: 2190 | Epsilon: 0.010 | FPS: 54
Step: 371994/1000000 | Episode: 2200 | Epsilon: 0.010 | FPS: 54
Step: 373455/1000000 | Episode: 2210 | Epsilon: 0.010 | FPS: 54
Step: 374806/1000000 | Episode: 2220 | Epsilon: 0.010 | FPS: 54
Step: 376495/1000000 | Episode: 2230 | Epsilon: 0.010 | FPS: 54
Step: 378269/1000000 | Episode: 2240 | Epsilon: 0.010 | FPS: 54
Step: 379699/1000000 | Episode: 2250 | Epsilon: 0.010 | FPS: 54
Step: 381633/1000000 | Episode: 2260 | Epsilon: 0.010 | FPS: 54
Step: 383302/1000000 | Episode: 2270 | Epsilon: 0.010 | FPS: 54
Step: 384962/1000000 | Episode: 2280 | Epsilon: 0.010 | FPS: 54
Step: 386327/1000000 | Episode: 2290 | Epsilon: 0.010 | FPS: 54
Step: 387761/1000000 | Episode: 2300 | Epsilon: 0.010 | FPS: 54
Step: 389487/1000000 | Episode: 2310 | Epsilon: 0.010 | FPS: 54
Step: 391031/1000000 | Episode: 2320 | Epsilon: 0.010 | FPS: 54
Step: 392799/1000000 | Episode: 2330 | Epsilon: 0.010 | FPS: 54
Step: 394528/1000000 | Episode: 2340 | Epsilon: 0.010 | FPS: 54
Step: 396092/1000000 | Episode: 2350 | Epsilon: 0.010 | FPS: 54
Step: 397775/1000000 | Episode: 2360 | Epsilon: 0.010 | FPS: 54
Step: 399356/1000000 | Episode: 2370 | Epsilon: 0.010 | FPS: 54

============================================================
Evaluating at step 400000/1000000 (40.0%)
Elapsed: 2h 3m 0s | ETA: 3h 4m 31s | Speed: 54.2 steps/s
Eval - Mean Reward: 2.15 ± 0.38, Mean Length: 165
Achievements unlocked: 5/22
============================================================

Checkpoint saved to logdir/full-enhanced/0/checkpoint_400000.pt
[CHECKPOINT] Saved to logdir/full-enhanced/0/checkpoint_400000.pt
[CHECKPOINT] Total elapsed: 2h 3m 57s | Since last checkpoint: 33m 28s
Step: 400859/1000000 | Episode: 2380 | Epsilon: 0.010 | FPS: 54
Step: 402536/1000000 | Episode: 2390 | Epsilon: 0.010 | FPS: 54
Step: 404115/1000000 | Episode: 2400 | Epsilon: 0.010 | FPS: 54
Step: 405759/1000000 | Episode: 2410 | Epsilon: 0.010 | FPS: 54
Step: 407701/1000000 | Episode: 2420 | Epsilon: 0.010 | FPS: 54
Step: 409479/1000000 | Episode: 2430 | Epsilon: 0.010 | FPS: 54
Step: 411035/1000000 | Episode: 2440 | Epsilon: 0.010 | FPS: 54
Step: 412536/1000000 | Episode: 2450 | Epsilon: 0.010 | FPS: 54
Step: 414180/1000000 | Episode: 2460 | Epsilon: 0.010 | FPS: 54
Step: 415948/1000000 | Episode: 2470 | Epsilon: 0.010 | FPS: 54
Step: 417655/1000000 | Episode: 2480 | Epsilon: 0.010 | FPS: 54
Step: 419330/1000000 | Episode: 2490 | Epsilon: 0.010 | FPS: 54
Step: 421047/1000000 | Episode: 2500 | Epsilon: 0.010 | FPS: 54
Step: 422560/1000000 | Episode: 2510 | Epsilon: 0.010 | FPS: 54
Step: 423861/1000000 | Episode: 2520 | Epsilon: 0.010 | FPS: 54
Step: 425336/1000000 | Episode: 2530 | Epsilon: 0.010 | FPS: 54
Step: 427009/1000000 | Episode: 2540 | Epsilon: 0.010 | FPS: 54
Step: 428755/1000000 | Episode: 2550 | Epsilon: 0.010 | FPS: 54
Step: 430581/1000000 | Episode: 2560 | Epsilon: 0.010 | FPS: 54
Step: 431957/1000000 | Episode: 2570 | Epsilon: 0.010 | FPS: 54
Step: 433500/1000000 | Episode: 2580 | Epsilon: 0.010 | FPS: 54
Step: 435123/1000000 | Episode: 2590 | Epsilon: 0.010 | FPS: 54
Step: 436777/1000000 | Episode: 2600 | Epsilon: 0.010 | FPS: 54
Step: 438618/1000000 | Episode: 2610 | Epsilon: 0.010 | FPS: 54
Step: 440399/1000000 | Episode: 2620 | Epsilon: 0.010 | FPS: 54
Step: 441962/1000000 | Episode: 2630 | Epsilon: 0.010 | FPS: 54
Step: 443712/1000000 | Episode: 2640 | Epsilon: 0.010 | FPS: 54
Step: 445432/1000000 | Episode: 2650 | Epsilon: 0.010 | FPS: 54
Step: 447224/1000000 | Episode: 2660 | Epsilon: 0.010 | FPS: 54
Step: 448866/1000000 | Episode: 2670 | Epsilon: 0.010 | FPS: 54

============================================================
Evaluating at step 450000/1000000 (45.0%)
Elapsed: 2h 19m 41s | ETA: 2h 50m 44s | Speed: 53.7 steps/s
Eval - Mean Reward: 2.35 ± 0.54, Mean Length: 163
Achievements unlocked: 5/22
============================================================

Step: 450328/1000000 | Episode: 2680 | Epsilon: 0.010 | FPS: 53
Step: 452151/1000000 | Episode: 2690 | Epsilon: 0.010 | FPS: 53
Step: 453798/1000000 | Episode: 2700 | Epsilon: 0.010 | FPS: 53
Step: 455541/1000000 | Episode: 2710 | Epsilon: 0.010 | FPS: 53
Step: 457243/1000000 | Episode: 2720 | Epsilon: 0.010 | FPS: 53
Step: 459109/1000000 | Episode: 2730 | Epsilon: 0.010 | FPS: 53
Step: 460508/1000000 | Episode: 2740 | Epsilon: 0.010 | FPS: 53
Step: 462103/1000000 | Episode: 2750 | Epsilon: 0.010 | FPS: 53
Step: 463824/1000000 | Episode: 2760 | Epsilon: 0.010 | FPS: 53
Step: 465378/1000000 | Episode: 2770 | Epsilon: 0.010 | FPS: 53
Step: 466949/1000000 | Episode: 2780 | Epsilon: 0.010 | FPS: 53
Step: 468759/1000000 | Episode: 2790 | Epsilon: 0.010 | FPS: 53
Step: 470120/1000000 | Episode: 2800 | Epsilon: 0.010 | FPS: 53
Step: 471856/1000000 | Episode: 2810 | Epsilon: 0.010 | FPS: 53
Step: 473721/1000000 | Episode: 2820 | Epsilon: 0.010 | FPS: 53
Step: 475344/1000000 | Episode: 2830 | Epsilon: 0.010 | FPS: 53
Step: 477017/1000000 | Episode: 2840 | Epsilon: 0.010 | FPS: 53
Step: 478649/1000000 | Episode: 2850 | Epsilon: 0.010 | FPS: 53
Step: 480335/1000000 | Episode: 2860 | Epsilon: 0.010 | FPS: 53
Step: 481807/1000000 | Episode: 2870 | Epsilon: 0.010 | FPS: 53
Step: 483449/1000000 | Episode: 2880 | Epsilon: 0.010 | FPS: 53
Step: 485238/1000000 | Episode: 2890 | Epsilon: 0.010 | FPS: 53
Step: 487005/1000000 | Episode: 2900 | Epsilon: 0.010 | FPS: 53
Step: 488542/1000000 | Episode: 2910 | Epsilon: 0.010 | FPS: 53
Step: 490349/1000000 | Episode: 2920 | Epsilon: 0.010 | FPS: 53
Step: 492055/1000000 | Episode: 2930 | Epsilon: 0.010 | FPS: 53
Step: 493682/1000000 | Episode: 2940 | Epsilon: 0.010 | FPS: 53
Step: 495271/1000000 | Episode: 2950 | Epsilon: 0.010 | FPS: 53
Step: 497009/1000000 | Episode: 2960 | Epsilon: 0.010 | FPS: 53
Step: 498655/1000000 | Episode: 2970 | Epsilon: 0.010 | FPS: 53

============================================================
Evaluating at step 500000/1000000 (50.0%)
Elapsed: 2h 36m 13s | ETA: 2h 36m 13s | Speed: 53.3 steps/s
Eval - Mean Reward: 2.30 ± 0.60, Mean Length: 164
Achievements unlocked: 5/22
============================================================

Checkpoint saved to logdir/full-enhanced/0/checkpoint_500000.pt
[CHECKPOINT] Saved to logdir/full-enhanced/0/checkpoint_500000.pt
[CHECKPOINT] Total elapsed: 2h 37m 2s | Since last checkpoint: 33m 5s
Step: 500326/1000000 | Episode: 2980 | Epsilon: 0.010 | FPS: 53
Step: 502151/1000000 | Episode: 2990 | Epsilon: 0.010 | FPS: 53
Step: 503810/1000000 | Episode: 3000 | Epsilon: 0.010 | FPS: 53
Step: 505562/1000000 | Episode: 3010 | Epsilon: 0.010 | FPS: 53
Step: 507204/1000000 | Episode: 3020 | Epsilon: 0.010 | FPS: 53
Step: 508907/1000000 | Episode: 3030 | Epsilon: 0.010 | FPS: 53
Step: 510730/1000000 | Episode: 3040 | Epsilon: 0.010 | FPS: 53
Step: 512184/1000000 | Episode: 3050 | Epsilon: 0.010 | FPS: 53
Step: 513968/1000000 | Episode: 3060 | Epsilon: 0.010 | FPS: 53
Step: 515472/1000000 | Episode: 3070 | Epsilon: 0.010 | FPS: 53
Step: 517201/1000000 | Episode: 3080 | Epsilon: 0.010 | FPS: 53
Step: 518983/1000000 | Episode: 3090 | Epsilon: 0.010 | FPS: 53
Step: 520769/1000000 | Episode: 3100 | Epsilon: 0.010 | FPS: 53
Step: 522654/1000000 | Episode: 3110 | Epsilon: 0.010 | FPS: 53
Step: 524171/1000000 | Episode: 3120 | Epsilon: 0.010 | FPS: 53
Step: 525673/1000000 | Episode: 3130 | Epsilon: 0.010 | FPS: 53
Step: 527207/1000000 | Episode: 3140 | Epsilon: 0.010 | FPS: 53
Step: 528645/1000000 | Episode: 3150 | Epsilon: 0.010 | FPS: 53
Step: 530304/1000000 | Episode: 3160 | Epsilon: 0.010 | FPS: 53
Step: 532047/1000000 | Episode: 3170 | Epsilon: 0.010 | FPS: 53
Step: 533827/1000000 | Episode: 3180 | Epsilon: 0.010 | FPS: 53
Step: 535588/1000000 | Episode: 3190 | Epsilon: 0.010 | FPS: 53
Step: 537118/1000000 | Episode: 3200 | Epsilon: 0.010 | FPS: 53
Step: 538852/1000000 | Episode: 3210 | Epsilon: 0.010 | FPS: 53
Step: 540545/1000000 | Episode: 3220 | Epsilon: 0.010 | FPS: 53
Step: 542056/1000000 | Episode: 3230 | Epsilon: 0.010 | FPS: 53
Step: 543721/1000000 | Episode: 3240 | Epsilon: 0.010 | FPS: 53
Step: 545475/1000000 | Episode: 3250 | Epsilon: 0.010 | FPS: 53
Step: 547111/1000000 | Episode: 3260 | Epsilon: 0.010 | FPS: 53
Step: 548797/1000000 | Episode: 3270 | Epsilon: 0.010 | FPS: 53

============================================================
Evaluating at step 550000/1000000 (55.0%)
Elapsed: 2h 52m 27s | ETA: 2h 21m 6s | Speed: 53.2 steps/s
Eval - Mean Reward: 2.40 ± 0.46, Mean Length: 179
Achievements unlocked: 5/22
============================================================

Step: 550278/1000000 | Episode: 3280 | Epsilon: 0.010 | FPS: 53
Step: 551819/1000000 | Episode: 3290 | Epsilon: 0.010 | FPS: 53
Step: 553526/1000000 | Episode: 3300 | Epsilon: 0.010 | FPS: 53
Step: 554819/1000000 | Episode: 3310 | Epsilon: 0.010 | FPS: 53
Step: 556362/1000000 | Episode: 3320 | Epsilon: 0.010 | FPS: 53
Step: 557889/1000000 | Episode: 3330 | Epsilon: 0.010 | FPS: 53
Step: 559553/1000000 | Episode: 3340 | Epsilon: 0.010 | FPS: 53
Step: 561168/1000000 | Episode: 3350 | Epsilon: 0.010 | FPS: 53
Step: 562830/1000000 | Episode: 3360 | Epsilon: 0.010 | FPS: 53
Step: 564284/1000000 | Episode: 3370 | Epsilon: 0.010 | FPS: 53
Step: 566118/1000000 | Episode: 3380 | Epsilon: 0.010 | FPS: 53
Step: 567912/1000000 | Episode: 3390 | Epsilon: 0.010 | FPS: 53
Step: 569540/1000000 | Episode: 3400 | Epsilon: 0.010 | FPS: 53
Step: 571218/1000000 | Episode: 3410 | Epsilon: 0.010 | FPS: 53
Step: 572728/1000000 | Episode: 3420 | Epsilon: 0.010 | FPS: 53
Step: 574289/1000000 | Episode: 3430 | Epsilon: 0.010 | FPS: 53
Step: 575736/1000000 | Episode: 3440 | Epsilon: 0.010 | FPS: 53
Step: 577632/1000000 | Episode: 3450 | Epsilon: 0.010 | FPS: 53
Step: 579640/1000000 | Episode: 3460 | Epsilon: 0.010 | FPS: 53
Step: 581414/1000000 | Episode: 3470 | Epsilon: 0.010 | FPS: 53
Step: 583180/1000000 | Episode: 3480 | Epsilon: 0.010 | FPS: 53
Step: 584622/1000000 | Episode: 3490 | Epsilon: 0.010 | FPS: 53
Step: 586267/1000000 | Episode: 3500 | Epsilon: 0.010 | FPS: 53
Step: 587814/1000000 | Episode: 3510 | Epsilon: 0.010 | FPS: 53
Step: 589604/1000000 | Episode: 3520 | Epsilon: 0.010 | FPS: 53
Step: 591144/1000000 | Episode: 3530 | Epsilon: 0.010 | FPS: 53
Step: 592785/1000000 | Episode: 3540 | Epsilon: 0.010 | FPS: 53
Step: 594280/1000000 | Episode: 3550 | Epsilon: 0.010 | FPS: 53
Step: 596222/1000000 | Episode: 3560 | Epsilon: 0.010 | FPS: 53
Step: 597480/1000000 | Episode: 3570 | Epsilon: 0.010 | FPS: 53
Step: 599256/1000000 | Episode: 3580 | Epsilon: 0.010 | FPS: 53

============================================================
Evaluating at step 600000/1000000 (60.0%)
Elapsed: 3h 9m 10s | ETA: 2h 6m 6s | Speed: 52.9 steps/s
Eval - Mean Reward: 2.45 ± 0.57, Mean Length: 175
Achievements unlocked: 5/22
============================================================

Checkpoint saved to logdir/full-enhanced/0/checkpoint_600000.pt
[CHECKPOINT] Saved to logdir/full-enhanced/0/checkpoint_600000.pt
[CHECKPOINT] Total elapsed: 3h 9m 59s | Since last checkpoint: 32m 56s
Step: 600957/1000000 | Episode: 3590 | Epsilon: 0.010 | FPS: 53
Step: 602677/1000000 | Episode: 3600 | Epsilon: 0.010 | FPS: 53
Step: 604405/1000000 | Episode: 3610 | Epsilon: 0.010 | FPS: 53
Step: 606087/1000000 | Episode: 3620 | Epsilon: 0.010 | FPS: 53
Step: 607914/1000000 | Episode: 3630 | Epsilon: 0.010 | FPS: 53
Step: 609420/1000000 | Episode: 3640 | Epsilon: 0.010 | FPS: 53
Step: 610822/1000000 | Episode: 3650 | Epsilon: 0.010 | FPS: 53
Step: 612540/1000000 | Episode: 3660 | Epsilon: 0.010 | FPS: 53
Step: 614309/1000000 | Episode: 3670 | Epsilon: 0.010 | FPS: 53
Step: 615913/1000000 | Episode: 3680 | Epsilon: 0.010 | FPS: 53
Step: 617475/1000000 | Episode: 3690 | Epsilon: 0.010 | FPS: 53
Step: 619102/1000000 | Episode: 3700 | Epsilon: 0.010 | FPS: 53
Step: 620736/1000000 | Episode: 3710 | Epsilon: 0.010 | FPS: 53
Step: 622235/1000000 | Episode: 3720 | Epsilon: 0.010 | FPS: 53
Step: 624176/1000000 | Episode: 3730 | Epsilon: 0.010 | FPS: 53
Step: 625674/1000000 | Episode: 3740 | Epsilon: 0.010 | FPS: 53
Step: 627306/1000000 | Episode: 3750 | Epsilon: 0.010 | FPS: 53
Step: 629365/1000000 | Episode: 3760 | Epsilon: 0.010 | FPS: 53
Step: 631081/1000000 | Episode: 3770 | Epsilon: 0.010 | FPS: 53
Step: 632575/1000000 | Episode: 3780 | Epsilon: 0.010 | FPS: 53
Step: 634612/1000000 | Episode: 3790 | Epsilon: 0.010 | FPS: 52
Step: 636453/1000000 | Episode: 3800 | Epsilon: 0.010 | FPS: 52
Step: 638478/1000000 | Episode: 3810 | Epsilon: 0.010 | FPS: 52
Step: 639946/1000000 | Episode: 3820 | Epsilon: 0.010 | FPS: 52
Step: 641645/1000000 | Episode: 3830 | Epsilon: 0.010 | FPS: 52
Step: 643705/1000000 | Episode: 3840 | Epsilon: 0.010 | FPS: 52
Step: 645150/1000000 | Episode: 3850 | Epsilon: 0.010 | FPS: 52
Step: 646845/1000000 | Episode: 3860 | Epsilon: 0.010 | FPS: 52
Step: 648496/1000000 | Episode: 3870 | Epsilon: 0.010 | FPS: 52

============================================================
Evaluating at step 650000/1000000 (65.0%)
Elapsed: 3h 26m 23s | ETA: 1h 51m 8s | Speed: 52.5 steps/s
Eval - Mean Reward: 2.45 ± 0.91, Mean Length: 184
Achievements unlocked: 5/22
============================================================

Step: 650002/1000000 | Episode: 3880 | Epsilon: 0.010 | FPS: 52
Step: 651947/1000000 | Episode: 3890 | Epsilon: 0.010 | FPS: 52
Step: 653726/1000000 | Episode: 3900 | Epsilon: 0.010 | FPS: 52
Step: 655192/1000000 | Episode: 3910 | Epsilon: 0.010 | FPS: 52
Step: 656772/1000000 | Episode: 3920 | Epsilon: 0.010 | FPS: 52
Step: 658516/1000000 | Episode: 3930 | Epsilon: 0.010 | FPS: 52
Step: 660204/1000000 | Episode: 3940 | Epsilon: 0.010 | FPS: 52
Step: 662089/1000000 | Episode: 3950 | Epsilon: 0.010 | FPS: 52
Step: 663866/1000000 | Episode: 3960 | Epsilon: 0.010 | FPS: 52
Step: 665738/1000000 | Episode: 3970 | Epsilon: 0.010 | FPS: 52
Step: 667511/1000000 | Episode: 3980 | Epsilon: 0.010 | FPS: 52
Step: 669032/1000000 | Episode: 3990 | Epsilon: 0.010 | FPS: 52
Step: 670737/1000000 | Episode: 4000 | Epsilon: 0.010 | FPS: 52
Step: 672260/1000000 | Episode: 4010 | Epsilon: 0.010 | FPS: 52
Step: 673719/1000000 | Episode: 4020 | Epsilon: 0.010 | FPS: 52
Step: 675715/1000000 | Episode: 4030 | Epsilon: 0.010 | FPS: 53
Step: 677369/1000000 | Episode: 4040 | Epsilon: 0.010 | FPS: 52
Step: 679278/1000000 | Episode: 4050 | Epsilon: 0.010 | FPS: 53
Step: 681011/1000000 | Episode: 4060 | Epsilon: 0.010 | FPS: 53
Step: 682920/1000000 | Episode: 4070 | Epsilon: 0.010 | FPS: 53
Step: 684623/1000000 | Episode: 4080 | Epsilon: 0.010 | FPS: 53
Step: 686236/1000000 | Episode: 4090 | Epsilon: 0.010 | FPS: 53
Step: 687901/1000000 | Episode: 4100 | Epsilon: 0.010 | FPS: 53
Step: 689372/1000000 | Episode: 4110 | Epsilon: 0.010 | FPS: 53
Step: 690859/1000000 | Episode: 4120 | Epsilon: 0.010 | FPS: 53
Step: 692334/1000000 | Episode: 4130 | Epsilon: 0.010 | FPS: 53
Step: 693941/1000000 | Episode: 4140 | Epsilon: 0.010 | FPS: 53
Step: 695667/1000000 | Episode: 4150 | Epsilon: 0.010 | FPS: 53
Step: 697438/1000000 | Episode: 4160 | Epsilon: 0.010 | FPS: 53
Step: 699100/1000000 | Episode: 4170 | Epsilon: 0.010 | FPS: 53

============================================================
Evaluating at step 700000/1000000 (70.0%)
Elapsed: 3h 41m 47s | ETA: 1h 35m 3s | Speed: 52.6 steps/s
Eval - Mean Reward: 2.25 ± 0.48, Mean Length: 186
Achievements unlocked: 5/22
============================================================

Checkpoint saved to logdir/full-enhanced/0/checkpoint_700000.pt
[CHECKPOINT] Saved to logdir/full-enhanced/0/checkpoint_700000.pt
[CHECKPOINT] Total elapsed: 3h 42m 32s | Since last checkpoint: 32m 32s
Step: 700767/1000000 | Episode: 4180 | Epsilon: 0.010 | FPS: 52
Step: 702475/1000000 | Episode: 4190 | Epsilon: 0.010 | FPS: 52
Step: 704255/1000000 | Episode: 4200 | Epsilon: 0.010 | FPS: 52
Step: 705977/1000000 | Episode: 4210 | Epsilon: 0.010 | FPS: 52
Step: 707499/1000000 | Episode: 4220 | Epsilon: 0.010 | FPS: 52
Step: 709164/1000000 | Episode: 4230 | Epsilon: 0.010 | FPS: 52
Step: 711240/1000000 | Episode: 4240 | Epsilon: 0.010 | FPS: 52
Step: 712971/1000000 | Episode: 4250 | Epsilon: 0.010 | FPS: 52
Step: 714558/1000000 | Episode: 4260 | Epsilon: 0.010 | FPS: 52
Step: 716302/1000000 | Episode: 4270 | Epsilon: 0.010 | FPS: 52
Step: 718164/1000000 | Episode: 4280 | Epsilon: 0.010 | FPS: 53
Step: 720101/1000000 | Episode: 4290 | Epsilon: 0.010 | FPS: 53
Step: 721507/1000000 | Episode: 4300 | Epsilon: 0.010 | FPS: 53
Step: 723322/1000000 | Episode: 4310 | Epsilon: 0.010 | FPS: 52
Step: 724815/1000000 | Episode: 4320 | Epsilon: 0.010 | FPS: 52
Step: 726362/1000000 | Episode: 4330 | Epsilon: 0.010 | FPS: 52
Step: 727883/1000000 | Episode: 4340 | Epsilon: 0.010 | FPS: 52
Step: 729859/1000000 | Episode: 4350 | Epsilon: 0.010 | FPS: 52
Step: 731574/1000000 | Episode: 4360 | Epsilon: 0.010 | FPS: 52
Step: 733625/1000000 | Episode: 4370 | Epsilon: 0.010 | FPS: 53
Step: 735291/1000000 | Episode: 4380 | Epsilon: 0.010 | FPS: 53
Step: 736917/1000000 | Episode: 4390 | Epsilon: 0.010 | FPS: 53
Step: 738706/1000000 | Episode: 4400 | Epsilon: 0.010 | FPS: 53
Step: 740433/1000000 | Episode: 4410 | Epsilon: 0.010 | FPS: 53
Step: 741949/1000000 | Episode: 4420 | Epsilon: 0.010 | FPS: 53
Step: 743562/1000000 | Episode: 4430 | Epsilon: 0.010 | FPS: 53
Step: 745305/1000000 | Episode: 4440 | Epsilon: 0.010 | FPS: 53
Step: 746918/1000000 | Episode: 4450 | Epsilon: 0.010 | FPS: 53
Step: 748723/1000000 | Episode: 4460 | Epsilon: 0.010 | FPS: 53

============================================================
Evaluating at step 750000/1000000 (75.0%)
Elapsed: 3h 57m 41s | ETA: 1h 19m 13s | Speed: 52.6 steps/s
Eval - Mean Reward: 2.45 ± 0.57, Mean Length: 150
Achievements unlocked: 5/22
============================================================

Step: 750524/1000000 | Episode: 4470 | Epsilon: 0.010 | FPS: 52
Step: 752012/1000000 | Episode: 4480 | Epsilon: 0.010 | FPS: 52
Step: 753658/1000000 | Episode: 4490 | Epsilon: 0.010 | FPS: 52
Step: 755685/1000000 | Episode: 4500 | Epsilon: 0.010 | FPS: 52
Step: 757273/1000000 | Episode: 4510 | Epsilon: 0.010 | FPS: 52
Step: 758873/1000000 | Episode: 4520 | Epsilon: 0.010 | FPS: 52
Step: 760579/1000000 | Episode: 4530 | Epsilon: 0.010 | FPS: 52
Step: 762467/1000000 | Episode: 4540 | Epsilon: 0.010 | FPS: 52
Step: 764019/1000000 | Episode: 4550 | Epsilon: 0.010 | FPS: 52
Step: 765724/1000000 | Episode: 4560 | Epsilon: 0.010 | FPS: 52
Step: 767192/1000000 | Episode: 4570 | Epsilon: 0.010 | FPS: 52
Step: 768962/1000000 | Episode: 4580 | Epsilon: 0.010 | FPS: 52
Step: 770676/1000000 | Episode: 4590 | Epsilon: 0.010 | FPS: 52
Step: 772332/1000000 | Episode: 4600 | Epsilon: 0.010 | FPS: 52
Step: 773666/1000000 | Episode: 4610 | Epsilon: 0.010 | FPS: 52
Step: 775432/1000000 | Episode: 4620 | Epsilon: 0.010 | FPS: 52
Step: 777049/1000000 | Episode: 4630 | Epsilon: 0.010 | FPS: 52
Step: 778933/1000000 | Episode: 4640 | Epsilon: 0.010 | FPS: 52
Step: 780416/1000000 | Episode: 4650 | Epsilon: 0.010 | FPS: 52
Step: 781897/1000000 | Episode: 4660 | Epsilon: 0.010 | FPS: 52
Step: 783386/1000000 | Episode: 4670 | Epsilon: 0.010 | FPS: 52
Step: 784961/1000000 | Episode: 4680 | Epsilon: 0.010 | FPS: 52
Step: 786601/1000000 | Episode: 4690 | Epsilon: 0.010 | FPS: 52
Step: 787938/1000000 | Episode: 4700 | Epsilon: 0.010 | FPS: 52
Step: 789602/1000000 | Episode: 4710 | Epsilon: 0.010 | FPS: 52
Step: 791123/1000000 | Episode: 4720 | Epsilon: 0.010 | FPS: 52
Step: 792776/1000000 | Episode: 4730 | Epsilon: 0.010 | FPS: 52
Step: 794830/1000000 | Episode: 4740 | Epsilon: 0.010 | FPS: 52
Step: 796347/1000000 | Episode: 4750 | Epsilon: 0.010 | FPS: 52
Step: 797961/1000000 | Episode: 4760 | Epsilon: 0.010 | FPS: 52
Step: 799677/1000000 | Episode: 4770 | Epsilon: 0.010 | FPS: 52

============================================================
Evaluating at step 800000/1000000 (80.0%)
Elapsed: 4h 15m 22s | ETA: 1h 3m 50s | Speed: 52.2 steps/s
Eval - Mean Reward: 2.30 ± 0.40, Mean Length: 167
Achievements unlocked: 5/22
============================================================

Checkpoint saved to logdir/full-enhanced/0/checkpoint_800000.pt
[CHECKPOINT] Saved to logdir/full-enhanced/0/checkpoint_800000.pt
[CHECKPOINT] Total elapsed: 4h 16m 12s | Since last checkpoint: 33m 40s
Step: 801642/1000000 | Episode: 4780 | Epsilon: 0.010 | FPS: 52
Step: 803283/1000000 | Episode: 4790 | Epsilon: 0.010 | FPS: 52
Step: 804968/1000000 | Episode: 4800 | Epsilon: 0.010 | FPS: 52
Step: 806952/1000000 | Episode: 4810 | Epsilon: 0.010 | FPS: 52
Step: 808753/1000000 | Episode: 4820 | Epsilon: 0.010 | FPS: 52
Step: 810590/1000000 | Episode: 4830 | Epsilon: 0.010 | FPS: 52
Step: 812149/1000000 | Episode: 4840 | Epsilon: 0.010 | FPS: 52
Step: 813729/1000000 | Episode: 4850 | Epsilon: 0.010 | FPS: 52
Step: 815206/1000000 | Episode: 4860 | Epsilon: 0.010 | FPS: 52
Step: 816612/1000000 | Episode: 4870 | Epsilon: 0.010 | FPS: 52
Step: 818285/1000000 | Episode: 4880 | Epsilon: 0.010 | FPS: 52
Step: 820241/1000000 | Episode: 4890 | Epsilon: 0.010 | FPS: 52
Step: 821720/1000000 | Episode: 4900 | Epsilon: 0.010 | FPS: 52
Step: 823402/1000000 | Episode: 4910 | Epsilon: 0.010 | FPS: 52
Step: 825279/1000000 | Episode: 4920 | Epsilon: 0.010 | FPS: 52
Step: 826997/1000000 | Episode: 4930 | Epsilon: 0.010 | FPS: 52
Step: 828384/1000000 | Episode: 4940 | Epsilon: 0.010 | FPS: 52
Step: 830287/1000000 | Episode: 4950 | Epsilon: 0.010 | FPS: 52
Step: 832029/1000000 | Episode: 4960 | Epsilon: 0.010 | FPS: 52
Step: 833815/1000000 | Episode: 4970 | Epsilon: 0.010 | FPS: 52
Step: 835498/1000000 | Episode: 4980 | Epsilon: 0.010 | FPS: 52
Step: 837275/1000000 | Episode: 4990 | Epsilon: 0.010 | FPS: 52
Step: 838711/1000000 | Episode: 5000 | Epsilon: 0.010 | FPS: 52
Step: 840306/1000000 | Episode: 5010 | Epsilon: 0.010 | FPS: 52
Step: 841716/1000000 | Episode: 5020 | Epsilon: 0.010 | FPS: 52
Step: 843460/1000000 | Episode: 5030 | Epsilon: 0.010 | FPS: 52
Step: 845098/1000000 | Episode: 5040 | Epsilon: 0.010 | FPS: 52
Step: 846895/1000000 | Episode: 5050 | Epsilon: 0.010 | FPS: 52
Step: 848459/1000000 | Episode: 5060 | Epsilon: 0.010 | FPS: 52

============================================================
Evaluating at step 850000/1000000 (85.0%)
Elapsed: 4h 33m 30s | ETA: 48m 15s | Speed: 51.8 steps/s
Eval - Mean Reward: 2.45 ± 0.57, Mean Length: 168
Achievements unlocked: 5/22
============================================================

Step: 850038/1000000 | Episode: 5070 | Epsilon: 0.010 | FPS: 52
Step: 851439/1000000 | Episode: 5080 | Epsilon: 0.010 | FPS: 52
Step: 853061/1000000 | Episode: 5090 | Epsilon: 0.010 | FPS: 52
Step: 854745/1000000 | Episode: 5100 | Epsilon: 0.010 | FPS: 52
Step: 856204/1000000 | Episode: 5110 | Epsilon: 0.010 | FPS: 52
Step: 857947/1000000 | Episode: 5120 | Epsilon: 0.010 | FPS: 52
Step: 859504/1000000 | Episode: 5130 | Epsilon: 0.010 | FPS: 52
Step: 861244/1000000 | Episode: 5140 | Epsilon: 0.010 | FPS: 52
Step: 863005/1000000 | Episode: 5150 | Epsilon: 0.010 | FPS: 52
Step: 864419/1000000 | Episode: 5160 | Epsilon: 0.010 | FPS: 52
Step: 866133/1000000 | Episode: 5170 | Epsilon: 0.010 | FPS: 52
Step: 867668/1000000 | Episode: 5180 | Epsilon: 0.010 | FPS: 52
Step: 869226/1000000 | Episode: 5190 | Epsilon: 0.010 | FPS: 52
Step: 870931/1000000 | Episode: 5200 | Epsilon: 0.010 | FPS: 52
Step: 872402/1000000 | Episode: 5210 | Epsilon: 0.010 | FPS: 52
Step: 873943/1000000 | Episode: 5220 | Epsilon: 0.010 | FPS: 52
Step: 875711/1000000 | Episode: 5230 | Epsilon: 0.010 | FPS: 52
Step: 877409/1000000 | Episode: 5240 | Epsilon: 0.010 | FPS: 52
Step: 878942/1000000 | Episode: 5250 | Epsilon: 0.010 | FPS: 52
Step: 880941/1000000 | Episode: 5260 | Epsilon: 0.010 | FPS: 52
Step: 882664/1000000 | Episode: 5270 | Epsilon: 0.010 | FPS: 52
Step: 884465/1000000 | Episode: 5280 | Epsilon: 0.010 | FPS: 52
Step: 886145/1000000 | Episode: 5290 | Epsilon: 0.010 | FPS: 52
Step: 887902/1000000 | Episode: 5300 | Epsilon: 0.010 | FPS: 52
Step: 889540/1000000 | Episode: 5310 | Epsilon: 0.010 | FPS: 52
Step: 891133/1000000 | Episode: 5320 | Epsilon: 0.010 | FPS: 52
Step: 893010/1000000 | Episode: 5330 | Epsilon: 0.010 | FPS: 52
Step: 894763/1000000 | Episode: 5340 | Epsilon: 0.010 | FPS: 52
Step: 896525/1000000 | Episode: 5350 | Epsilon: 0.010 | FPS: 52
Step: 898082/1000000 | Episode: 5360 | Epsilon: 0.010 | FPS: 52
Step: 899900/1000000 | Episode: 5370 | Epsilon: 0.010 | FPS: 52

============================================================
Evaluating at step 900000/1000000 (90.0%)
Elapsed: 4h 49m 15s | ETA: 32m 8s | Speed: 51.9 steps/s
Eval - Mean Reward: 2.60 ± 0.74, Mean Length: 163
Achievements unlocked: 5/22
============================================================

Checkpoint saved to logdir/full-enhanced/0/checkpoint_900000.pt
[CHECKPOINT] Saved to logdir/full-enhanced/0/checkpoint_900000.pt
[CHECKPOINT] Total elapsed: 4h 50m 1s | Since last checkpoint: 33m 49s
Step: 901705/1000000 | Episode: 5380 | Epsilon: 0.010 | FPS: 52
Step: 903442/1000000 | Episode: 5390 | Epsilon: 0.010 | FPS: 52
Step: 905188/1000000 | Episode: 5400 | Epsilon: 0.010 | FPS: 52
Step: 906870/1000000 | Episode: 5410 | Epsilon: 0.010 | FPS: 52
Step: 908459/1000000 | Episode: 5420 | Epsilon: 0.010 | FPS: 52
Step: 910224/1000000 | Episode: 5430 | Epsilon: 0.010 | FPS: 52
Step: 911732/1000000 | Episode: 5440 | Epsilon: 0.010 | FPS: 52
Step: 913417/1000000 | Episode: 5450 | Epsilon: 0.010 | FPS: 52
Step: 914960/1000000 | Episode: 5460 | Epsilon: 0.010 | FPS: 52
Step: 916609/1000000 | Episode: 5470 | Epsilon: 0.010 | FPS: 52
Step: 918237/1000000 | Episode: 5480 | Epsilon: 0.010 | FPS: 52
Step: 919496/1000000 | Episode: 5490 | Epsilon: 0.010 | FPS: 52
Step: 921163/1000000 | Episode: 5500 | Epsilon: 0.010 | FPS: 52
Step: 922658/1000000 | Episode: 5510 | Epsilon: 0.010 | FPS: 52
Step: 924456/1000000 | Episode: 5520 | Epsilon: 0.010 | FPS: 52
Step: 926326/1000000 | Episode: 5530 | Epsilon: 0.010 | FPS: 52
Step: 928157/1000000 | Episode: 5540 | Epsilon: 0.010 | FPS: 52
Step: 929938/1000000 | Episode: 5550 | Epsilon: 0.010 | FPS: 52
Step: 931598/1000000 | Episode: 5560 | Epsilon: 0.010 | FPS: 52
Step: 933492/1000000 | Episode: 5570 | Epsilon: 0.010 | FPS: 52
Step: 935113/1000000 | Episode: 5580 | Epsilon: 0.010 | FPS: 52
Step: 936829/1000000 | Episode: 5590 | Epsilon: 0.010 | FPS: 52
Step: 938356/1000000 | Episode: 5600 | Epsilon: 0.010 | FPS: 52
Step: 940087/1000000 | Episode: 5610 | Epsilon: 0.010 | FPS: 52
Step: 941544/1000000 | Episode: 5620 | Epsilon: 0.010 | FPS: 52
Step: 943340/1000000 | Episode: 5630 | Epsilon: 0.010 | FPS: 52
Step: 945016/1000000 | Episode: 5640 | Epsilon: 0.010 | FPS: 52
Step: 946773/1000000 | Episode: 5650 | Epsilon: 0.010 | FPS: 52
Step: 948563/1000000 | Episode: 5660 | Epsilon: 0.010 | FPS: 52

============================================================
Evaluating at step 950000/1000000 (95.0%)
Elapsed: 5h 5m 12s | ETA: 16m 3s | Speed: 51.9 steps/s
Eval - Mean Reward: 2.35 ± 0.54, Mean Length: 171
Achievements unlocked: 5/22
============================================================

Step: 950141/1000000 | Episode: 5670 | Epsilon: 0.010 | FPS: 52
Step: 951736/1000000 | Episode: 5680 | Epsilon: 0.010 | FPS: 52
Step: 953509/1000000 | Episode: 5690 | Epsilon: 0.010 | FPS: 52
Step: 954812/1000000 | Episode: 5700 | Epsilon: 0.010 | FPS: 52
Step: 956308/1000000 | Episode: 5710 | Epsilon: 0.010 | FPS: 52
Step: 957808/1000000 | Episode: 5720 | Epsilon: 0.010 | FPS: 52
Step: 959644/1000000 | Episode: 5730 | Epsilon: 0.010 | FPS: 52
Step: 961110/1000000 | Episode: 5740 | Epsilon: 0.010 | FPS: 52
Step: 962821/1000000 | Episode: 5750 | Epsilon: 0.010 | FPS: 52
Step: 964432/1000000 | Episode: 5760 | Epsilon: 0.010 | FPS: 52
Step: 966030/1000000 | Episode: 5770 | Epsilon: 0.010 | FPS: 52
Step: 967560/1000000 | Episode: 5780 | Epsilon: 0.010 | FPS: 52
Step: 969129/1000000 | Episode: 5790 | Epsilon: 0.010 | FPS: 52
Step: 970921/1000000 | Episode: 5800 | Epsilon: 0.010 | FPS: 52
Step: 972320/1000000 | Episode: 5810 | Epsilon: 0.010 | FPS: 52
Step: 973802/1000000 | Episode: 5820 | Epsilon: 0.010 | FPS: 52
Step: 975460/1000000 | Episode: 5830 | Epsilon: 0.010 | FPS: 52
Step: 977279/1000000 | Episode: 5840 | Epsilon: 0.010 | FPS: 52
Step: 979123/1000000 | Episode: 5850 | Epsilon: 0.010 | FPS: 52
Step: 980675/1000000 | Episode: 5860 | Epsilon: 0.010 | FPS: 52
Step: 982252/1000000 | Episode: 5870 | Epsilon: 0.010 | FPS: 52
Step: 984139/1000000 | Episode: 5880 | Epsilon: 0.010 | FPS: 52
Step: 985639/1000000 | Episode: 5890 | Epsilon: 0.010 | FPS: 52
Step: 987403/1000000 | Episode: 5900 | Epsilon: 0.010 | FPS: 52
Step: 989253/1000000 | Episode: 5910 | Epsilon: 0.010 | FPS: 52
Step: 991053/1000000 | Episode: 5920 | Epsilon: 0.010 | FPS: 52
Step: 992592/1000000 | Episode: 5930 | Epsilon: 0.010 | FPS: 52
Step: 994218/1000000 | Episode: 5940 | Epsilon: 0.010 | FPS: 52
Step: 995774/1000000 | Episode: 5950 | Epsilon: 0.010 | FPS: 52
Step: 997506/1000000 | Episode: 5960 | Epsilon: 0.010 | FPS: 52
Step: 999146/1000000 | Episode: 5970 | Epsilon: 0.010 | FPS: 52

============================================================
Evaluating at step 1000000/1000000 (100.0%)
Elapsed: 5h 20m 35s | ETA: 0s | Speed: 52.0 steps/s
Eval - Mean Reward: 2.30 ± 0.75, Mean Length: 148
Achievements unlocked: 5/22
============================================================

Checkpoint saved to logdir/full-enhanced/0/checkpoint_1000000.pt
[CHECKPOINT] Saved to logdir/full-enhanced/0/checkpoint_1000000.pt
[CHECKPOINT] Total elapsed: 5h 21m 21s | Since last checkpoint: 31m 19s

============================================================
FINAL EVALUATION
Total training time: 5h 21m 23s
============================================================
Final Mean Reward: 2.15 ± 0.50
Final Achievements: 5/22

Final Achievement Success Rates:
  collect_sapling: 100.0%
  place_plant: 100.0%
  wake_up: 90.0%
  defeat_zombie: 10.0%
  eat_cow: 5.0%
Checkpoint saved to logdir/full-enhanced/0/final_model.pt

Saved final model to logdir/full-enhanced/0/final_model.pt
Metrics saved to logdir/full-enhanced/0/metrics.json
Metadata saved to logdir/full-enhanced/0/metadata.json
============================================================
TRAINING COMPLETE!
============================================================

Final Training Statistics:
  Training Time: 5h 21m 23s
  Final Eval Reward: 2.30 ± 0.75
  Best Eval Reward: 2.60
  Total Episodes: 5975
  Final Loss: 0.0034
  Final Epsilon: 0.0100
============================================================
