Gym has been unmaintained since 2022 and does not support NumPy 2.0 amongst other critical functionality.
Please upgrade to Gymnasium, the maintained drop-in replacement of Gym, or contact the authors of your software and request that they upgrade.
Users of this version of Gym should be able to simply replace 'import gym' with 'import gymnasium as gym' in the vast majority of cases.
See the migration guide at https://gymnasium.farama.org/introduction/migration_guide/ for additional information.
======================================================================
Experiment: training_run
======================================================================

Start Time: 2025-11-10T08:30:09.223502

Git Info:
  Commit: 2950c37 (test-1)
  WARNING: Uncommitted changes present!

System Info:
  Hostname: dr1-v100s-1
  Platform: Linux-6.8.0-87-generic-x86_64-with-glibc2.39
  CPU Count: 15

GPU Info:
  GPU 0: Tesla V100S-PCIE-32GB
    Memory: 32768 MiB
    Driver: 580.95.05

Package Versions:
  PyTorch: 2.9.0+cu128
  CUDA: 12.8
  NumPy: 2.3.4
  Crafter: unknown

Experiment Arguments:
  batch_size: 32
  buffer_size: 100000
  device: cuda
  double_dqn: True
  dueling: True
  env_name: crafter
  epsilon_decay_steps: 50000
  epsilon_end: 0.01
  epsilon_start: 1.0
  eval_episodes: 20
  eval_interval: 50000
  gamma: 0.99
  grad_clip: 10.0
  hidden_size: 512
  logdir: logdir/full-enhanced/1
  lr: 0.0001
  munchausen: True
  munchausen_alpha: 0.9
  munchausen_tau: 0.03
  n_step: 3
  resume: None
  save_freq: 100000
  seed: 1
  steps: 1000000
  target_update_freq: 2500
  training_starts: 5000
  update_freq: 4
======================================================================

Step: 1691/1000000 | Episode: 10 | Epsilon: 0.967 | FPS: 92
Step: 3575/1000000 | Episode: 20 | Epsilon: 0.929 | FPS: 93
Step: 5062/1000000 | Episode: 30 | Epsilon: 0.900 | FPS: 86
Step: 6509/1000000 | Episode: 40 | Epsilon: 0.871 | FPS: 81
Step: 7946/1000000 | Episode: 50 | Epsilon: 0.843 | FPS: 77
Step: 9473/1000000 | Episode: 60 | Epsilon: 0.812 | FPS: 74
Step: 11015/1000000 | Episode: 70 | Epsilon: 0.782 | FPS: 72
Step: 12844/1000000 | Episode: 80 | Epsilon: 0.746 | FPS: 73
Step: 14437/1000000 | Episode: 90 | Epsilon: 0.714 | FPS: 72
Step: 16039/1000000 | Episode: 100 | Epsilon: 0.682 | FPS: 71
Step: 17812/1000000 | Episode: 110 | Epsilon: 0.647 | FPS: 71
Step: 19280/1000000 | Episode: 120 | Epsilon: 0.618 | FPS: 70
Step: 20853/1000000 | Episode: 130 | Epsilon: 0.587 | FPS: 70
Step: 22641/1000000 | Episode: 140 | Epsilon: 0.552 | FPS: 69
Step: 24342/1000000 | Episode: 150 | Epsilon: 0.518 | FPS: 69
Step: 25951/1000000 | Episode: 160 | Epsilon: 0.486 | FPS: 69
Step: 27663/1000000 | Episode: 170 | Epsilon: 0.452 | FPS: 69
Step: 29322/1000000 | Episode: 180 | Epsilon: 0.419 | FPS: 68
Step: 31030/1000000 | Episode: 190 | Epsilon: 0.386 | FPS: 68
Step: 32791/1000000 | Episode: 200 | Epsilon: 0.351 | FPS: 68
Step: 34432/1000000 | Episode: 210 | Epsilon: 0.318 | FPS: 67
Step: 36119/1000000 | Episode: 220 | Epsilon: 0.285 | FPS: 67
Step: 37655/1000000 | Episode: 230 | Epsilon: 0.254 | FPS: 67
Step: 39659/1000000 | Episode: 240 | Epsilon: 0.215 | FPS: 67
Step: 41098/1000000 | Episode: 250 | Epsilon: 0.186 | FPS: 67
Step: 42579/1000000 | Episode: 260 | Epsilon: 0.157 | FPS: 66
Step: 44112/1000000 | Episode: 270 | Epsilon: 0.127 | FPS: 66
Step: 46145/1000000 | Episode: 280 | Epsilon: 0.086 | FPS: 66
Step: 48191/1000000 | Episode: 290 | Epsilon: 0.046 | FPS: 66
Step: 49951/1000000 | Episode: 300 | Epsilon: 0.011 | FPS: 66

============================================================
Evaluating at step 50000/1000000 (5.0%)
Elapsed: 12m 36s | ETA: 3h 59m 36s | Speed: 66.1 steps/s
Eval - Mean Reward: 1.40 ± 0.46, Mean Length: 173
Achievements unlocked: 4/22
============================================================

Step: 51559/1000000 | Episode: 310 | Epsilon: 0.010 | FPS: 63
Step: 53288/1000000 | Episode: 320 | Epsilon: 0.010 | FPS: 63
Step: 55019/1000000 | Episode: 330 | Epsilon: 0.010 | FPS: 63
Step: 56754/1000000 | Episode: 340 | Epsilon: 0.010 | FPS: 62
Step: 58347/1000000 | Episode: 350 | Epsilon: 0.010 | FPS: 62
Step: 60174/1000000 | Episode: 360 | Epsilon: 0.010 | FPS: 62
Step: 61976/1000000 | Episode: 370 | Epsilon: 0.010 | FPS: 62
Step: 63868/1000000 | Episode: 380 | Epsilon: 0.010 | FPS: 61
Step: 65920/1000000 | Episode: 390 | Epsilon: 0.010 | FPS: 61
Step: 67586/1000000 | Episode: 400 | Epsilon: 0.010 | FPS: 61
Step: 69178/1000000 | Episode: 410 | Epsilon: 0.010 | FPS: 61
Step: 71180/1000000 | Episode: 420 | Epsilon: 0.010 | FPS: 61
Step: 72666/1000000 | Episode: 430 | Epsilon: 0.010 | FPS: 61
Step: 74431/1000000 | Episode: 440 | Epsilon: 0.010 | FPS: 61
Step: 76180/1000000 | Episode: 450 | Epsilon: 0.010 | FPS: 60
Step: 77981/1000000 | Episode: 460 | Epsilon: 0.010 | FPS: 61
Step: 79885/1000000 | Episode: 470 | Epsilon: 0.010 | FPS: 61
Step: 81899/1000000 | Episode: 480 | Epsilon: 0.010 | FPS: 61
Step: 83489/1000000 | Episode: 490 | Epsilon: 0.010 | FPS: 60
Step: 85166/1000000 | Episode: 500 | Epsilon: 0.010 | FPS: 60
Step: 86676/1000000 | Episode: 510 | Epsilon: 0.010 | FPS: 60
Step: 88480/1000000 | Episode: 520 | Epsilon: 0.010 | FPS: 60
Step: 90151/1000000 | Episode: 530 | Epsilon: 0.010 | FPS: 60
Step: 92159/1000000 | Episode: 540 | Epsilon: 0.010 | FPS: 60
Step: 94178/1000000 | Episode: 550 | Epsilon: 0.010 | FPS: 60
Step: 96049/1000000 | Episode: 560 | Epsilon: 0.010 | FPS: 60
Step: 97684/1000000 | Episode: 570 | Epsilon: 0.010 | FPS: 60
Step: 99602/1000000 | Episode: 580 | Epsilon: 0.010 | FPS: 60

============================================================
Evaluating at step 100000/1000000 (10.0%)
Elapsed: 27m 31s | ETA: 4h 7m 44s | Speed: 60.5 steps/s
Eval - Mean Reward: 1.55 ± 0.50, Mean Length: 189
Achievements unlocked: 4/22
============================================================

Checkpoint saved to logdir/full-enhanced/1/checkpoint_100000.pt
[CHECKPOINT] Saved to logdir/full-enhanced/1/checkpoint_100000.pt
[CHECKPOINT] Total elapsed: 28m 13s | Since last checkpoint: 28m 13s
Step: 101150/1000000 | Episode: 590 | Epsilon: 0.010 | FPS: 59
Step: 103134/1000000 | Episode: 600 | Epsilon: 0.010 | FPS: 59
Step: 105044/1000000 | Episode: 610 | Epsilon: 0.010 | FPS: 59
Step: 106763/1000000 | Episode: 620 | Epsilon: 0.010 | FPS: 59
Step: 108600/1000000 | Episode: 630 | Epsilon: 0.010 | FPS: 59
Step: 110176/1000000 | Episode: 640 | Epsilon: 0.010 | FPS: 59
Step: 111940/1000000 | Episode: 650 | Epsilon: 0.010 | FPS: 59
Step: 113731/1000000 | Episode: 660 | Epsilon: 0.010 | FPS: 59
Step: 115529/1000000 | Episode: 670 | Epsilon: 0.010 | FPS: 59
Step: 117433/1000000 | Episode: 680 | Epsilon: 0.010 | FPS: 59
Step: 119020/1000000 | Episode: 690 | Epsilon: 0.010 | FPS: 59
Step: 120711/1000000 | Episode: 700 | Epsilon: 0.010 | FPS: 59
Step: 122459/1000000 | Episode: 710 | Epsilon: 0.010 | FPS: 59
Step: 124050/1000000 | Episode: 720 | Epsilon: 0.010 | FPS: 59
Step: 125538/1000000 | Episode: 730 | Epsilon: 0.010 | FPS: 59
Step: 127374/1000000 | Episode: 740 | Epsilon: 0.010 | FPS: 59
Step: 128504/1000000 | Episode: 750 | Epsilon: 0.010 | FPS: 59
Step: 130088/1000000 | Episode: 760 | Epsilon: 0.010 | FPS: 59
Step: 131565/1000000 | Episode: 770 | Epsilon: 0.010 | FPS: 59
Step: 133352/1000000 | Episode: 780 | Epsilon: 0.010 | FPS: 59
Step: 134811/1000000 | Episode: 790 | Epsilon: 0.010 | FPS: 59
Step: 136420/1000000 | Episode: 800 | Epsilon: 0.010 | FPS: 59
Step: 138149/1000000 | Episode: 810 | Epsilon: 0.010 | FPS: 59
Step: 139652/1000000 | Episode: 820 | Epsilon: 0.010 | FPS: 59
Step: 141221/1000000 | Episode: 830 | Epsilon: 0.010 | FPS: 59
Step: 142718/1000000 | Episode: 840 | Epsilon: 0.010 | FPS: 59
Step: 144054/1000000 | Episode: 850 | Epsilon: 0.010 | FPS: 58
Step: 145591/1000000 | Episode: 860 | Epsilon: 0.010 | FPS: 58
Step: 147146/1000000 | Episode: 870 | Epsilon: 0.010 | FPS: 58
Step: 148784/1000000 | Episode: 880 | Epsilon: 0.010 | FPS: 58

============================================================
Evaluating at step 150000/1000000 (15.0%)
Elapsed: 42m 52s | ETA: 4h 2m 58s | Speed: 58.3 steps/s
Eval - Mean Reward: 0.10 ± 0.00, Mean Length: 185
Achievements unlocked: 1/22
============================================================

Step: 150370/1000000 | Episode: 890 | Epsilon: 0.010 | FPS: 57
Step: 152022/1000000 | Episode: 900 | Epsilon: 0.010 | FPS: 57
Step: 153277/1000000 | Episode: 910 | Epsilon: 0.010 | FPS: 57
Step: 154977/1000000 | Episode: 920 | Epsilon: 0.010 | FPS: 57
Step: 156633/1000000 | Episode: 930 | Epsilon: 0.010 | FPS: 57
Step: 158311/1000000 | Episode: 940 | Epsilon: 0.010 | FPS: 57
Step: 160106/1000000 | Episode: 950 | Epsilon: 0.010 | FPS: 57
Step: 161687/1000000 | Episode: 960 | Epsilon: 0.010 | FPS: 57
Step: 163326/1000000 | Episode: 970 | Epsilon: 0.010 | FPS: 57
Step: 164943/1000000 | Episode: 980 | Epsilon: 0.010 | FPS: 57
Step: 166560/1000000 | Episode: 990 | Epsilon: 0.010 | FPS: 57
Step: 168184/1000000 | Episode: 1000 | Epsilon: 0.010 | FPS: 57
Step: 169729/1000000 | Episode: 1010 | Epsilon: 0.010 | FPS: 57
Step: 171276/1000000 | Episode: 1020 | Epsilon: 0.010 | FPS: 57
Step: 173241/1000000 | Episode: 1030 | Epsilon: 0.010 | FPS: 57
Step: 174887/1000000 | Episode: 1040 | Epsilon: 0.010 | FPS: 57
Step: 176183/1000000 | Episode: 1050 | Epsilon: 0.010 | FPS: 57
Step: 177892/1000000 | Episode: 1060 | Epsilon: 0.010 | FPS: 57
Step: 179314/1000000 | Episode: 1070 | Epsilon: 0.010 | FPS: 57
Step: 180818/1000000 | Episode: 1080 | Epsilon: 0.010 | FPS: 57
Step: 182284/1000000 | Episode: 1090 | Epsilon: 0.010 | FPS: 57
Step: 183845/1000000 | Episode: 1100 | Epsilon: 0.010 | FPS: 57
Step: 185597/1000000 | Episode: 1110 | Epsilon: 0.010 | FPS: 57
Step: 187420/1000000 | Episode: 1120 | Epsilon: 0.010 | FPS: 57
Step: 188884/1000000 | Episode: 1130 | Epsilon: 0.010 | FPS: 57
Step: 190570/1000000 | Episode: 1140 | Epsilon: 0.010 | FPS: 57
Step: 192127/1000000 | Episode: 1150 | Epsilon: 0.010 | FPS: 57
Step: 193906/1000000 | Episode: 1160 | Epsilon: 0.010 | FPS: 57
Step: 195363/1000000 | Episode: 1170 | Epsilon: 0.010 | FPS: 57
Step: 197197/1000000 | Episode: 1180 | Epsilon: 0.010 | FPS: 57
Step: 198951/1000000 | Episode: 1190 | Epsilon: 0.010 | FPS: 57

============================================================
Evaluating at step 200000/1000000 (20.0%)
Elapsed: 58m 46s | ETA: 3h 55m 6s | Speed: 56.7 steps/s
Eval - Mean Reward: 1.05 ± 0.38, Mean Length: 140
Achievements unlocked: 3/22
============================================================

Checkpoint saved to logdir/full-enhanced/1/checkpoint_200000.pt
[CHECKPOINT] Saved to logdir/full-enhanced/1/checkpoint_200000.pt
[CHECKPOINT] Total elapsed: 59m 27s | Since last checkpoint: 31m 14s
Step: 200640/1000000 | Episode: 1200 | Epsilon: 0.010 | FPS: 56
Step: 202602/1000000 | Episode: 1210 | Epsilon: 0.010 | FPS: 56
Step: 204033/1000000 | Episode: 1220 | Epsilon: 0.010 | FPS: 56
Step: 205752/1000000 | Episode: 1230 | Epsilon: 0.010 | FPS: 56
Step: 207422/1000000 | Episode: 1240 | Epsilon: 0.010 | FPS: 56
Step: 209100/1000000 | Episode: 1250 | Epsilon: 0.010 | FPS: 56
Step: 210576/1000000 | Episode: 1260 | Epsilon: 0.010 | FPS: 56
Step: 212219/1000000 | Episode: 1270 | Epsilon: 0.010 | FPS: 56
Step: 213892/1000000 | Episode: 1280 | Epsilon: 0.010 | FPS: 56
Step: 215517/1000000 | Episode: 1290 | Epsilon: 0.010 | FPS: 56
Step: 217190/1000000 | Episode: 1300 | Epsilon: 0.010 | FPS: 56
Step: 218752/1000000 | Episode: 1310 | Epsilon: 0.010 | FPS: 56
Step: 220034/1000000 | Episode: 1320 | Epsilon: 0.010 | FPS: 56
Step: 221457/1000000 | Episode: 1330 | Epsilon: 0.010 | FPS: 56
Step: 223136/1000000 | Episode: 1340 | Epsilon: 0.010 | FPS: 56
Step: 224504/1000000 | Episode: 1350 | Epsilon: 0.010 | FPS: 56
Step: 225948/1000000 | Episode: 1360 | Epsilon: 0.010 | FPS: 56
Step: 227681/1000000 | Episode: 1370 | Epsilon: 0.010 | FPS: 56
Step: 229443/1000000 | Episode: 1380 | Epsilon: 0.010 | FPS: 56
Step: 231258/1000000 | Episode: 1390 | Epsilon: 0.010 | FPS: 56
Step: 233133/1000000 | Episode: 1400 | Epsilon: 0.010 | FPS: 56
Step: 234817/1000000 | Episode: 1410 | Epsilon: 0.010 | FPS: 56
Step: 236502/1000000 | Episode: 1420 | Epsilon: 0.010 | FPS: 56
Step: 238147/1000000 | Episode: 1430 | Epsilon: 0.010 | FPS: 56
Step: 239843/1000000 | Episode: 1440 | Epsilon: 0.010 | FPS: 56
Step: 241796/1000000 | Episode: 1450 | Epsilon: 0.010 | FPS: 56
Step: 243272/1000000 | Episode: 1460 | Epsilon: 0.010 | FPS: 56
Step: 244952/1000000 | Episode: 1470 | Epsilon: 0.010 | FPS: 56
Step: 246651/1000000 | Episode: 1480 | Epsilon: 0.010 | FPS: 56
Step: 248169/1000000 | Episode: 1490 | Epsilon: 0.010 | FPS: 56
Step: 249905/1000000 | Episode: 1500 | Epsilon: 0.010 | FPS: 56

============================================================
Evaluating at step 250000/1000000 (25.0%)
Elapsed: 1h 14m 8s | ETA: 3h 42m 26s | Speed: 56.2 steps/s
Eval - Mean Reward: 1.15 ± 0.38, Mean Length: 178
Achievements unlocked: 4/22
============================================================

Step: 251553/1000000 | Episode: 1510 | Epsilon: 0.010 | FPS: 56
Step: 253333/1000000 | Episode: 1520 | Epsilon: 0.010 | FPS: 55
Step: 255193/1000000 | Episode: 1530 | Epsilon: 0.010 | FPS: 55
Step: 256773/1000000 | Episode: 1540 | Epsilon: 0.010 | FPS: 55
Step: 258449/1000000 | Episode: 1550 | Epsilon: 0.010 | FPS: 55
Step: 260228/1000000 | Episode: 1560 | Epsilon: 0.010 | FPS: 55
Step: 261815/1000000 | Episode: 1570 | Epsilon: 0.010 | FPS: 55
Step: 263344/1000000 | Episode: 1580 | Epsilon: 0.010 | FPS: 55
Step: 264693/1000000 | Episode: 1590 | Epsilon: 0.010 | FPS: 55
Step: 266433/1000000 | Episode: 1600 | Epsilon: 0.010 | FPS: 55
Step: 267930/1000000 | Episode: 1610 | Epsilon: 0.010 | FPS: 55
Step: 269650/1000000 | Episode: 1620 | Epsilon: 0.010 | FPS: 55
Step: 271552/1000000 | Episode: 1630 | Epsilon: 0.010 | FPS: 55
Step: 273186/1000000 | Episode: 1640 | Epsilon: 0.010 | FPS: 55
Step: 274923/1000000 | Episode: 1650 | Epsilon: 0.010 | FPS: 55
Step: 276542/1000000 | Episode: 1660 | Epsilon: 0.010 | FPS: 55
Step: 278323/1000000 | Episode: 1670 | Epsilon: 0.010 | FPS: 55
Step: 280060/1000000 | Episode: 1680 | Epsilon: 0.010 | FPS: 55
Step: 281575/1000000 | Episode: 1690 | Epsilon: 0.010 | FPS: 55
Step: 283073/1000000 | Episode: 1700 | Epsilon: 0.010 | FPS: 55
Step: 284660/1000000 | Episode: 1710 | Epsilon: 0.010 | FPS: 55
Step: 286613/1000000 | Episode: 1720 | Epsilon: 0.010 | FPS: 56
Step: 288394/1000000 | Episode: 1730 | Epsilon: 0.010 | FPS: 56
Step: 289980/1000000 | Episode: 1740 | Epsilon: 0.010 | FPS: 56
Step: 291563/1000000 | Episode: 1750 | Epsilon: 0.010 | FPS: 56
Step: 293299/1000000 | Episode: 1760 | Epsilon: 0.010 | FPS: 56
Step: 294692/1000000 | Episode: 1770 | Epsilon: 0.010 | FPS: 56
Step: 296451/1000000 | Episode: 1780 | Epsilon: 0.010 | FPS: 56
Step: 298316/1000000 | Episode: 1790 | Epsilon: 0.010 | FPS: 56

============================================================
Evaluating at step 300000/1000000 (30.0%)
Elapsed: 1h 29m 43s | ETA: 3h 29m 22s | Speed: 55.7 steps/s
Eval - Mean Reward: -0.90 ± 0.00, Mean Length: 189
Achievements unlocked: 0/22
============================================================

Checkpoint saved to logdir/full-enhanced/1/checkpoint_300000.pt
[CHECKPOINT] Saved to logdir/full-enhanced/1/checkpoint_300000.pt
[CHECKPOINT] Total elapsed: 1h 30m 28s | Since last checkpoint: 31m 1s
Step: 300158/1000000 | Episode: 1800 | Epsilon: 0.010 | FPS: 55
Step: 301647/1000000 | Episode: 1810 | Epsilon: 0.010 | FPS: 55
Step: 303580/1000000 | Episode: 1820 | Epsilon: 0.010 | FPS: 55
Step: 305159/1000000 | Episode: 1830 | Epsilon: 0.010 | FPS: 55
Step: 306677/1000000 | Episode: 1840 | Epsilon: 0.010 | FPS: 55
Step: 308415/1000000 | Episode: 1850 | Epsilon: 0.010 | FPS: 55
Step: 310365/1000000 | Episode: 1860 | Epsilon: 0.010 | FPS: 55
Step: 311962/1000000 | Episode: 1870 | Epsilon: 0.010 | FPS: 55
Step: 313611/1000000 | Episode: 1880 | Epsilon: 0.010 | FPS: 55
Step: 315429/1000000 | Episode: 1890 | Epsilon: 0.010 | FPS: 55
Step: 317086/1000000 | Episode: 1900 | Epsilon: 0.010 | FPS: 55
Step: 318973/1000000 | Episode: 1910 | Epsilon: 0.010 | FPS: 55
Step: 320654/1000000 | Episode: 1920 | Epsilon: 0.010 | FPS: 55
Step: 322559/1000000 | Episode: 1930 | Epsilon: 0.010 | FPS: 55
Step: 324414/1000000 | Episode: 1940 | Epsilon: 0.010 | FPS: 55
Step: 326087/1000000 | Episode: 1950 | Epsilon: 0.010 | FPS: 55
Step: 327649/1000000 | Episode: 1960 | Epsilon: 0.010 | FPS: 55
Step: 329517/1000000 | Episode: 1970 | Epsilon: 0.010 | FPS: 55
Step: 331063/1000000 | Episode: 1980 | Epsilon: 0.010 | FPS: 55
Step: 332835/1000000 | Episode: 1990 | Epsilon: 0.010 | FPS: 55
Step: 334757/1000000 | Episode: 2000 | Epsilon: 0.010 | FPS: 56
Step: 336740/1000000 | Episode: 2010 | Epsilon: 0.010 | FPS: 56
Step: 338561/1000000 | Episode: 2020 | Epsilon: 0.010 | FPS: 56
Step: 340168/1000000 | Episode: 2030 | Epsilon: 0.010 | FPS: 56
Step: 341944/1000000 | Episode: 2040 | Epsilon: 0.010 | FPS: 56
Step: 343941/1000000 | Episode: 2050 | Epsilon: 0.010 | FPS: 56
Step: 345720/1000000 | Episode: 2060 | Epsilon: 0.010 | FPS: 56
Step: 347265/1000000 | Episode: 2070 | Epsilon: 0.010 | FPS: 56
Step: 348968/1000000 | Episode: 2080 | Epsilon: 0.010 | FPS: 56

============================================================
Evaluating at step 350000/1000000 (35.0%)
Elapsed: 1h 44m 46s | ETA: 3h 14m 34s | Speed: 55.7 steps/s
Eval - Mean Reward: 2.25 ± 0.36, Mean Length: 177
Achievements unlocked: 5/22
============================================================

Step: 350616/1000000 | Episode: 2090 | Epsilon: 0.010 | FPS: 55
Step: 352046/1000000 | Episode: 2100 | Epsilon: 0.010 | FPS: 55
Step: 353704/1000000 | Episode: 2110 | Epsilon: 0.010 | FPS: 55
Step: 355338/1000000 | Episode: 2120 | Epsilon: 0.010 | FPS: 55
Step: 357048/1000000 | Episode: 2130 | Epsilon: 0.010 | FPS: 55
Step: 358789/1000000 | Episode: 2140 | Epsilon: 0.010 | FPS: 55
Step: 360117/1000000 | Episode: 2150 | Epsilon: 0.010 | FPS: 55
Step: 361783/1000000 | Episode: 2160 | Epsilon: 0.010 | FPS: 55
Step: 363663/1000000 | Episode: 2170 | Epsilon: 0.010 | FPS: 55
Step: 365503/1000000 | Episode: 2180 | Epsilon: 0.010 | FPS: 55
Step: 367363/1000000 | Episode: 2190 | Epsilon: 0.010 | FPS: 55
Step: 368996/1000000 | Episode: 2200 | Epsilon: 0.010 | FPS: 55
Step: 370808/1000000 | Episode: 2210 | Epsilon: 0.010 | FPS: 55
Step: 372554/1000000 | Episode: 2220 | Epsilon: 0.010 | FPS: 55
Step: 374027/1000000 | Episode: 2230 | Epsilon: 0.010 | FPS: 55
Step: 375413/1000000 | Episode: 2240 | Epsilon: 0.010 | FPS: 55
Step: 377142/1000000 | Episode: 2250 | Epsilon: 0.010 | FPS: 55
Step: 379310/1000000 | Episode: 2260 | Epsilon: 0.010 | FPS: 55
Step: 380915/1000000 | Episode: 2270 | Epsilon: 0.010 | FPS: 55
Step: 382331/1000000 | Episode: 2280 | Epsilon: 0.010 | FPS: 55
Step: 384189/1000000 | Episode: 2290 | Epsilon: 0.010 | FPS: 55
Step: 385791/1000000 | Episode: 2300 | Epsilon: 0.010 | FPS: 55
Step: 387335/1000000 | Episode: 2310 | Epsilon: 0.010 | FPS: 55
Step: 389005/1000000 | Episode: 2320 | Epsilon: 0.010 | FPS: 55
Step: 390624/1000000 | Episode: 2330 | Epsilon: 0.010 | FPS: 55
Step: 392245/1000000 | Episode: 2340 | Epsilon: 0.010 | FPS: 55
Step: 393922/1000000 | Episode: 2350 | Epsilon: 0.010 | FPS: 56
Step: 395641/1000000 | Episode: 2360 | Epsilon: 0.010 | FPS: 56
Step: 397062/1000000 | Episode: 2370 | Epsilon: 0.010 | FPS: 56
Step: 398728/1000000 | Episode: 2380 | Epsilon: 0.010 | FPS: 56

============================================================
Evaluating at step 400000/1000000 (40.0%)
Elapsed: 2h 0m 3s | ETA: 3h 0m 5s | Speed: 55.5 steps/s
Eval - Mean Reward: 2.20 ± 0.94, Mean Length: 156
Achievements unlocked: 5/22
============================================================

Checkpoint saved to logdir/full-enhanced/1/checkpoint_400000.pt
[CHECKPOINT] Saved to logdir/full-enhanced/1/checkpoint_400000.pt
[CHECKPOINT] Total elapsed: 2h 0m 44s | Since last checkpoint: 30m 15s
Step: 400173/1000000 | Episode: 2390 | Epsilon: 0.010 | FPS: 55
Step: 401842/1000000 | Episode: 2400 | Epsilon: 0.010 | FPS: 55
Step: 403654/1000000 | Episode: 2410 | Epsilon: 0.010 | FPS: 55
Step: 405422/1000000 | Episode: 2420 | Epsilon: 0.010 | FPS: 55
Step: 407047/1000000 | Episode: 2430 | Epsilon: 0.010 | FPS: 55
Step: 408577/1000000 | Episode: 2440 | Epsilon: 0.010 | FPS: 55
Step: 410363/1000000 | Episode: 2450 | Epsilon: 0.010 | FPS: 55
Step: 412053/1000000 | Episode: 2460 | Epsilon: 0.010 | FPS: 55
Step: 413631/1000000 | Episode: 2470 | Epsilon: 0.010 | FPS: 55
Step: 415163/1000000 | Episode: 2480 | Epsilon: 0.010 | FPS: 55
Step: 416830/1000000 | Episode: 2490 | Epsilon: 0.010 | FPS: 55
Step: 418565/1000000 | Episode: 2500 | Epsilon: 0.010 | FPS: 55
Step: 420340/1000000 | Episode: 2510 | Epsilon: 0.010 | FPS: 55
Step: 421903/1000000 | Episode: 2520 | Epsilon: 0.010 | FPS: 55
Step: 423428/1000000 | Episode: 2530 | Epsilon: 0.010 | FPS: 55
Step: 424616/1000000 | Episode: 2540 | Epsilon: 0.010 | FPS: 55
Step: 426676/1000000 | Episode: 2550 | Epsilon: 0.010 | FPS: 55
Step: 428273/1000000 | Episode: 2560 | Epsilon: 0.010 | FPS: 55
Step: 430092/1000000 | Episode: 2570 | Epsilon: 0.010 | FPS: 55
Step: 431607/1000000 | Episode: 2580 | Epsilon: 0.010 | FPS: 55
Step: 433374/1000000 | Episode: 2590 | Epsilon: 0.010 | FPS: 55
Step: 434841/1000000 | Episode: 2600 | Epsilon: 0.010 | FPS: 55
Step: 436235/1000000 | Episode: 2610 | Epsilon: 0.010 | FPS: 55
Step: 437716/1000000 | Episode: 2620 | Epsilon: 0.010 | FPS: 55
Step: 439411/1000000 | Episode: 2630 | Epsilon: 0.010 | FPS: 55
Step: 441258/1000000 | Episode: 2640 | Epsilon: 0.010 | FPS: 55
Step: 443046/1000000 | Episode: 2650 | Epsilon: 0.010 | FPS: 55
Step: 444527/1000000 | Episode: 2660 | Epsilon: 0.010 | FPS: 55
Step: 446127/1000000 | Episode: 2670 | Epsilon: 0.010 | FPS: 55
Step: 447848/1000000 | Episode: 2680 | Epsilon: 0.010 | FPS: 55
Step: 449685/1000000 | Episode: 2690 | Epsilon: 0.010 | FPS: 55

============================================================
Evaluating at step 450000/1000000 (45.0%)
Elapsed: 2h 16m 52s | ETA: 2h 47m 17s | Speed: 54.8 steps/s
Eval - Mean Reward: 2.15 ± 0.38, Mean Length: 146
Achievements unlocked: 5/22
============================================================

Step: 451612/1000000 | Episode: 2700 | Epsilon: 0.010 | FPS: 55
Step: 453294/1000000 | Episode: 2710 | Epsilon: 0.010 | FPS: 55
Step: 454889/1000000 | Episode: 2720 | Epsilon: 0.010 | FPS: 55
Step: 456702/1000000 | Episode: 2730 | Epsilon: 0.010 | FPS: 55
Step: 458340/1000000 | Episode: 2740 | Epsilon: 0.010 | FPS: 55
Step: 459987/1000000 | Episode: 2750 | Epsilon: 0.010 | FPS: 55
Step: 461712/1000000 | Episode: 2760 | Epsilon: 0.010 | FPS: 55
Step: 463361/1000000 | Episode: 2770 | Epsilon: 0.010 | FPS: 55
Step: 464990/1000000 | Episode: 2780 | Epsilon: 0.010 | FPS: 55
Step: 466897/1000000 | Episode: 2790 | Epsilon: 0.010 | FPS: 54
Step: 468558/1000000 | Episode: 2800 | Epsilon: 0.010 | FPS: 54
Step: 470152/1000000 | Episode: 2810 | Epsilon: 0.010 | FPS: 54
Step: 471788/1000000 | Episode: 2820 | Epsilon: 0.010 | FPS: 54
Step: 473461/1000000 | Episode: 2830 | Epsilon: 0.010 | FPS: 54
Step: 475109/1000000 | Episode: 2840 | Epsilon: 0.010 | FPS: 54
Step: 476783/1000000 | Episode: 2850 | Epsilon: 0.010 | FPS: 55
Step: 478422/1000000 | Episode: 2860 | Epsilon: 0.010 | FPS: 54
Step: 479966/1000000 | Episode: 2870 | Epsilon: 0.010 | FPS: 55
Step: 481558/1000000 | Episode: 2880 | Epsilon: 0.010 | FPS: 55
Step: 483301/1000000 | Episode: 2890 | Epsilon: 0.010 | FPS: 54
Step: 485154/1000000 | Episode: 2900 | Epsilon: 0.010 | FPS: 54
Step: 486979/1000000 | Episode: 2910 | Epsilon: 0.010 | FPS: 54
Step: 488656/1000000 | Episode: 2920 | Epsilon: 0.010 | FPS: 54
Step: 490361/1000000 | Episode: 2930 | Epsilon: 0.010 | FPS: 54
Step: 492309/1000000 | Episode: 2940 | Epsilon: 0.010 | FPS: 54
Step: 494290/1000000 | Episode: 2950 | Epsilon: 0.010 | FPS: 54
Step: 495912/1000000 | Episode: 2960 | Epsilon: 0.010 | FPS: 54
Step: 497597/1000000 | Episode: 2970 | Epsilon: 0.010 | FPS: 54
Step: 499042/1000000 | Episode: 2980 | Epsilon: 0.010 | FPS: 54

============================================================
Evaluating at step 500000/1000000 (50.0%)
Elapsed: 2h 34m 29s | ETA: 2h 34m 29s | Speed: 53.9 steps/s
Eval - Mean Reward: 2.25 ± 0.91, Mean Length: 164
Achievements unlocked: 5/22
============================================================

Checkpoint saved to logdir/full-enhanced/1/checkpoint_500000.pt
[CHECKPOINT] Saved to logdir/full-enhanced/1/checkpoint_500000.pt
[CHECKPOINT] Total elapsed: 2h 35m 25s | Since last checkpoint: 34m 41s
Step: 501066/1000000 | Episode: 2990 | Epsilon: 0.010 | FPS: 54
Step: 502829/1000000 | Episode: 3000 | Epsilon: 0.010 | FPS: 54
Step: 504485/1000000 | Episode: 3010 | Epsilon: 0.010 | FPS: 54
Step: 506083/1000000 | Episode: 3020 | Epsilon: 0.010 | FPS: 54
Step: 507759/1000000 | Episode: 3030 | Epsilon: 0.010 | FPS: 54
Step: 509195/1000000 | Episode: 3040 | Epsilon: 0.010 | FPS: 54
Step: 510671/1000000 | Episode: 3050 | Epsilon: 0.010 | FPS: 54
Step: 512392/1000000 | Episode: 3060 | Epsilon: 0.010 | FPS: 53
Step: 514071/1000000 | Episode: 3070 | Epsilon: 0.010 | FPS: 53
Step: 515925/1000000 | Episode: 3080 | Epsilon: 0.010 | FPS: 53
Step: 517598/1000000 | Episode: 3090 | Epsilon: 0.010 | FPS: 54
Step: 519423/1000000 | Episode: 3100 | Epsilon: 0.010 | FPS: 54
Step: 520987/1000000 | Episode: 3110 | Epsilon: 0.010 | FPS: 54
Step: 522519/1000000 | Episode: 3120 | Epsilon: 0.010 | FPS: 54
Step: 524069/1000000 | Episode: 3130 | Epsilon: 0.010 | FPS: 54
Step: 525728/1000000 | Episode: 3140 | Epsilon: 0.010 | FPS: 54
Step: 527458/1000000 | Episode: 3150 | Epsilon: 0.010 | FPS: 54
Step: 528856/1000000 | Episode: 3160 | Epsilon: 0.010 | FPS: 54
Step: 530667/1000000 | Episode: 3170 | Epsilon: 0.010 | FPS: 54
Step: 532206/1000000 | Episode: 3180 | Epsilon: 0.010 | FPS: 54
Step: 534061/1000000 | Episode: 3190 | Epsilon: 0.010 | FPS: 54
Step: 535677/1000000 | Episode: 3200 | Epsilon: 0.010 | FPS: 54
Step: 537662/1000000 | Episode: 3210 | Epsilon: 0.010 | FPS: 54
Step: 539419/1000000 | Episode: 3220 | Epsilon: 0.010 | FPS: 54
Step: 541062/1000000 | Episode: 3230 | Epsilon: 0.010 | FPS: 54
Step: 542743/1000000 | Episode: 3240 | Epsilon: 0.010 | FPS: 54
Step: 544453/1000000 | Episode: 3250 | Epsilon: 0.010 | FPS: 54
Step: 546148/1000000 | Episode: 3260 | Epsilon: 0.010 | FPS: 54
Step: 547931/1000000 | Episode: 3270 | Epsilon: 0.010 | FPS: 54
Step: 549485/1000000 | Episode: 3280 | Epsilon: 0.010 | FPS: 54

============================================================
Evaluating at step 550000/1000000 (55.0%)
Elapsed: 2h 50m 27s | ETA: 2h 19m 27s | Speed: 53.8 steps/s
Eval - Mean Reward: 2.35 ± 0.54, Mean Length: 149
Achievements unlocked: 5/22
============================================================

Step: 551337/1000000 | Episode: 3290 | Epsilon: 0.010 | FPS: 54
Step: 552871/1000000 | Episode: 3300 | Epsilon: 0.010 | FPS: 54
Step: 554632/1000000 | Episode: 3310 | Epsilon: 0.010 | FPS: 54
Step: 556354/1000000 | Episode: 3320 | Epsilon: 0.010 | FPS: 54
Step: 558264/1000000 | Episode: 3330 | Epsilon: 0.010 | FPS: 54
Step: 560142/1000000 | Episode: 3340 | Epsilon: 0.010 | FPS: 54
Step: 561875/1000000 | Episode: 3350 | Epsilon: 0.010 | FPS: 54
Step: 563782/1000000 | Episode: 3360 | Epsilon: 0.010 | FPS: 54
Step: 565152/1000000 | Episode: 3370 | Epsilon: 0.010 | FPS: 54
Step: 566919/1000000 | Episode: 3380 | Epsilon: 0.010 | FPS: 54
Step: 568468/1000000 | Episode: 3390 | Epsilon: 0.010 | FPS: 54
Step: 569989/1000000 | Episode: 3400 | Epsilon: 0.010 | FPS: 54
Step: 571396/1000000 | Episode: 3410 | Epsilon: 0.010 | FPS: 54
Step: 572729/1000000 | Episode: 3420 | Epsilon: 0.010 | FPS: 54
Step: 574405/1000000 | Episode: 3430 | Epsilon: 0.010 | FPS: 54
Step: 576054/1000000 | Episode: 3440 | Epsilon: 0.010 | FPS: 54
Step: 577718/1000000 | Episode: 3450 | Epsilon: 0.010 | FPS: 54
Step: 579349/1000000 | Episode: 3460 | Epsilon: 0.010 | FPS: 54
Step: 581143/1000000 | Episode: 3470 | Epsilon: 0.010 | FPS: 54
Step: 582804/1000000 | Episode: 3480 | Epsilon: 0.010 | FPS: 54
Step: 584605/1000000 | Episode: 3490 | Epsilon: 0.010 | FPS: 54
Step: 586213/1000000 | Episode: 3500 | Epsilon: 0.010 | FPS: 54
Step: 587885/1000000 | Episode: 3510 | Epsilon: 0.010 | FPS: 54
Step: 589701/1000000 | Episode: 3520 | Epsilon: 0.010 | FPS: 54
Step: 591403/1000000 | Episode: 3530 | Epsilon: 0.010 | FPS: 54
Step: 593263/1000000 | Episode: 3540 | Epsilon: 0.010 | FPS: 54
Step: 595047/1000000 | Episode: 3550 | Epsilon: 0.010 | FPS: 54
Step: 596833/1000000 | Episode: 3560 | Epsilon: 0.010 | FPS: 54
Step: 598759/1000000 | Episode: 3570 | Epsilon: 0.010 | FPS: 54

============================================================
Evaluating at step 600000/1000000 (60.0%)
Elapsed: 3h 6m 7s | ETA: 2h 4m 4s | Speed: 53.7 steps/s
Eval - Mean Reward: 2.25 ± 0.36, Mean Length: 158
Achievements unlocked: 5/22
============================================================

Checkpoint saved to logdir/full-enhanced/1/checkpoint_600000.pt
[CHECKPOINT] Saved to logdir/full-enhanced/1/checkpoint_600000.pt
[CHECKPOINT] Total elapsed: 3h 6m 59s | Since last checkpoint: 31m 33s
Step: 600589/1000000 | Episode: 3580 | Epsilon: 0.010 | FPS: 53
Step: 602476/1000000 | Episode: 3590 | Epsilon: 0.010 | FPS: 53
Step: 603870/1000000 | Episode: 3600 | Epsilon: 0.010 | FPS: 53
Step: 605504/1000000 | Episode: 3610 | Epsilon: 0.010 | FPS: 53
Step: 607271/1000000 | Episode: 3620 | Epsilon: 0.010 | FPS: 53
Step: 608892/1000000 | Episode: 3630 | Epsilon: 0.010 | FPS: 53
Step: 610455/1000000 | Episode: 3640 | Epsilon: 0.010 | FPS: 53
Step: 612269/1000000 | Episode: 3650 | Epsilon: 0.010 | FPS: 53
Step: 614088/1000000 | Episode: 3660 | Epsilon: 0.010 | FPS: 53
Step: 615483/1000000 | Episode: 3670 | Epsilon: 0.010 | FPS: 53
Step: 617424/1000000 | Episode: 3680 | Epsilon: 0.010 | FPS: 53
Step: 619408/1000000 | Episode: 3690 | Epsilon: 0.010 | FPS: 53
Step: 621088/1000000 | Episode: 3700 | Epsilon: 0.010 | FPS: 53
Step: 622713/1000000 | Episode: 3710 | Epsilon: 0.010 | FPS: 53
Step: 624453/1000000 | Episode: 3720 | Epsilon: 0.010 | FPS: 53
Step: 625977/1000000 | Episode: 3730 | Epsilon: 0.010 | FPS: 53
Step: 627550/1000000 | Episode: 3740 | Epsilon: 0.010 | FPS: 53
Step: 629061/1000000 | Episode: 3750 | Epsilon: 0.010 | FPS: 53
Step: 630832/1000000 | Episode: 3760 | Epsilon: 0.010 | FPS: 53
Step: 632350/1000000 | Episode: 3770 | Epsilon: 0.010 | FPS: 53
Step: 633918/1000000 | Episode: 3780 | Epsilon: 0.010 | FPS: 53
Step: 635590/1000000 | Episode: 3790 | Epsilon: 0.010 | FPS: 53
Step: 637461/1000000 | Episode: 3800 | Epsilon: 0.010 | FPS: 53
Step: 639170/1000000 | Episode: 3810 | Epsilon: 0.010 | FPS: 53
Step: 640710/1000000 | Episode: 3820 | Epsilon: 0.010 | FPS: 53
Step: 642497/1000000 | Episode: 3830 | Epsilon: 0.010 | FPS: 53
Step: 644344/1000000 | Episode: 3840 | Epsilon: 0.010 | FPS: 53
Step: 645786/1000000 | Episode: 3850 | Epsilon: 0.010 | FPS: 53
Step: 647600/1000000 | Episode: 3860 | Epsilon: 0.010 | FPS: 53
Step: 649565/1000000 | Episode: 3870 | Epsilon: 0.010 | FPS: 53

============================================================
Evaluating at step 650000/1000000 (65.0%)
Elapsed: 3h 23m 20s | ETA: 1h 49m 29s | Speed: 53.3 steps/s
Eval - Mean Reward: 2.45 ± 0.48, Mean Length: 163
Achievements unlocked: 5/22
============================================================

Step: 651232/1000000 | Episode: 3880 | Epsilon: 0.010 | FPS: 53
Step: 652995/1000000 | Episode: 3890 | Epsilon: 0.010 | FPS: 53
Step: 654532/1000000 | Episode: 3900 | Epsilon: 0.010 | FPS: 53
Step: 655962/1000000 | Episode: 3910 | Epsilon: 0.010 | FPS: 53
Step: 657852/1000000 | Episode: 3920 | Epsilon: 0.010 | FPS: 53
Step: 659388/1000000 | Episode: 3930 | Epsilon: 0.010 | FPS: 53
Step: 660966/1000000 | Episode: 3940 | Epsilon: 0.010 | FPS: 53
Step: 662557/1000000 | Episode: 3950 | Epsilon: 0.010 | FPS: 53
Step: 664311/1000000 | Episode: 3960 | Epsilon: 0.010 | FPS: 53
Step: 666049/1000000 | Episode: 3970 | Epsilon: 0.010 | FPS: 53
Step: 667677/1000000 | Episode: 3980 | Epsilon: 0.010 | FPS: 53
Step: 669233/1000000 | Episode: 3990 | Epsilon: 0.010 | FPS: 53
Step: 671113/1000000 | Episode: 4000 | Epsilon: 0.010 | FPS: 53
Step: 672666/1000000 | Episode: 4010 | Epsilon: 0.010 | FPS: 53
Step: 674118/1000000 | Episode: 4020 | Epsilon: 0.010 | FPS: 53
Step: 675872/1000000 | Episode: 4030 | Epsilon: 0.010 | FPS: 53
Step: 677592/1000000 | Episode: 4040 | Epsilon: 0.010 | FPS: 53
Step: 679230/1000000 | Episode: 4050 | Epsilon: 0.010 | FPS: 53
Step: 680719/1000000 | Episode: 4060 | Epsilon: 0.010 | FPS: 53
Step: 682494/1000000 | Episode: 4070 | Epsilon: 0.010 | FPS: 53
Step: 684281/1000000 | Episode: 4080 | Epsilon: 0.010 | FPS: 53
Step: 686262/1000000 | Episode: 4090 | Epsilon: 0.010 | FPS: 53
Step: 687660/1000000 | Episode: 4100 | Epsilon: 0.010 | FPS: 53
Step: 689315/1000000 | Episode: 4110 | Epsilon: 0.010 | FPS: 53
Step: 691216/1000000 | Episode: 4120 | Epsilon: 0.010 | FPS: 53
Step: 692707/1000000 | Episode: 4130 | Epsilon: 0.010 | FPS: 53
Step: 694473/1000000 | Episode: 4140 | Epsilon: 0.010 | FPS: 53
Step: 696211/1000000 | Episode: 4150 | Epsilon: 0.010 | FPS: 53
Step: 697860/1000000 | Episode: 4160 | Epsilon: 0.010 | FPS: 53
Step: 699569/1000000 | Episode: 4170 | Epsilon: 0.010 | FPS: 53

============================================================
Evaluating at step 700000/1000000 (70.0%)
Elapsed: 3h 38m 54s | ETA: 1h 33m 48s | Speed: 53.3 steps/s
Eval - Mean Reward: 2.35 ± 0.54, Mean Length: 175
Achievements unlocked: 5/22
============================================================

Checkpoint saved to logdir/full-enhanced/1/checkpoint_700000.pt
[CHECKPOINT] Saved to logdir/full-enhanced/1/checkpoint_700000.pt
[CHECKPOINT] Total elapsed: 3h 39m 40s | Since last checkpoint: 32m 40s
Step: 701148/1000000 | Episode: 4180 | Epsilon: 0.010 | FPS: 53
Step: 702794/1000000 | Episode: 4190 | Epsilon: 0.010 | FPS: 53
Step: 704240/1000000 | Episode: 4200 | Epsilon: 0.010 | FPS: 53
Step: 705998/1000000 | Episode: 4210 | Epsilon: 0.010 | FPS: 53
Step: 707793/1000000 | Episode: 4220 | Epsilon: 0.010 | FPS: 53
Step: 709019/1000000 | Episode: 4230 | Epsilon: 0.010 | FPS: 53
Step: 710846/1000000 | Episode: 4240 | Epsilon: 0.010 | FPS: 53
Step: 712371/1000000 | Episode: 4250 | Epsilon: 0.010 | FPS: 53
Step: 714322/1000000 | Episode: 4260 | Epsilon: 0.010 | FPS: 53
Step: 716201/1000000 | Episode: 4270 | Epsilon: 0.010 | FPS: 53
Step: 717619/1000000 | Episode: 4280 | Epsilon: 0.010 | FPS: 53
Step: 719520/1000000 | Episode: 4290 | Epsilon: 0.010 | FPS: 53
Step: 721143/1000000 | Episode: 4300 | Epsilon: 0.010 | FPS: 53
Step: 722714/1000000 | Episode: 4310 | Epsilon: 0.010 | FPS: 53
Step: 724415/1000000 | Episode: 4320 | Epsilon: 0.010 | FPS: 53
Step: 726355/1000000 | Episode: 4330 | Epsilon: 0.010 | FPS: 53
Step: 728148/1000000 | Episode: 4340 | Epsilon: 0.010 | FPS: 53
Step: 729934/1000000 | Episode: 4350 | Epsilon: 0.010 | FPS: 53
Step: 731545/1000000 | Episode: 4360 | Epsilon: 0.010 | FPS: 53
Step: 733287/1000000 | Episode: 4370 | Epsilon: 0.010 | FPS: 53
Step: 734962/1000000 | Episode: 4380 | Epsilon: 0.010 | FPS: 53
Step: 736891/1000000 | Episode: 4390 | Epsilon: 0.010 | FPS: 53
Step: 738508/1000000 | Episode: 4400 | Epsilon: 0.010 | FPS: 53
Step: 740255/1000000 | Episode: 4410 | Epsilon: 0.010 | FPS: 53
Step: 741763/1000000 | Episode: 4420 | Epsilon: 0.010 | FPS: 53
Step: 743333/1000000 | Episode: 4430 | Epsilon: 0.010 | FPS: 53
Step: 744885/1000000 | Episode: 4440 | Epsilon: 0.010 | FPS: 53
Step: 746460/1000000 | Episode: 4450 | Epsilon: 0.010 | FPS: 53
Step: 748045/1000000 | Episode: 4460 | Epsilon: 0.010 | FPS: 53
Step: 749627/1000000 | Episode: 4470 | Epsilon: 0.010 | FPS: 53

============================================================
Evaluating at step 750000/1000000 (75.0%)
Elapsed: 3h 55m 21s | ETA: 1h 18m 27s | Speed: 53.1 steps/s
Eval - Mean Reward: 2.35 ± 0.62, Mean Length: 159
Achievements unlocked: 5/22
============================================================

Step: 751365/1000000 | Episode: 4480 | Epsilon: 0.010 | FPS: 53
Step: 752975/1000000 | Episode: 4490 | Epsilon: 0.010 | FPS: 53
Step: 754536/1000000 | Episode: 4500 | Epsilon: 0.010 | FPS: 53
Step: 756074/1000000 | Episode: 4510 | Epsilon: 0.010 | FPS: 53
Step: 757576/1000000 | Episode: 4520 | Epsilon: 0.010 | FPS: 53
Step: 759278/1000000 | Episode: 4530 | Epsilon: 0.010 | FPS: 53
Step: 760905/1000000 | Episode: 4540 | Epsilon: 0.010 | FPS: 53
Step: 762620/1000000 | Episode: 4550 | Epsilon: 0.010 | FPS: 53
Step: 764104/1000000 | Episode: 4560 | Epsilon: 0.010 | FPS: 53
Step: 765602/1000000 | Episode: 4570 | Epsilon: 0.010 | FPS: 53
Step: 767260/1000000 | Episode: 4580 | Epsilon: 0.010 | FPS: 53
Step: 769063/1000000 | Episode: 4590 | Epsilon: 0.010 | FPS: 53
Step: 770458/1000000 | Episode: 4600 | Epsilon: 0.010 | FPS: 53
Step: 772258/1000000 | Episode: 4610 | Epsilon: 0.010 | FPS: 53
Step: 773903/1000000 | Episode: 4620 | Epsilon: 0.010 | FPS: 53
Step: 775408/1000000 | Episode: 4630 | Epsilon: 0.010 | FPS: 53
Step: 777436/1000000 | Episode: 4640 | Epsilon: 0.010 | FPS: 53
Step: 778969/1000000 | Episode: 4650 | Epsilon: 0.010 | FPS: 53
Step: 780422/1000000 | Episode: 4660 | Epsilon: 0.010 | FPS: 53
Step: 781943/1000000 | Episode: 4670 | Epsilon: 0.010 | FPS: 53
Step: 783321/1000000 | Episode: 4680 | Epsilon: 0.010 | FPS: 53
Step: 785086/1000000 | Episode: 4690 | Epsilon: 0.010 | FPS: 53
Step: 786478/1000000 | Episode: 4700 | Epsilon: 0.010 | FPS: 53
Step: 788345/1000000 | Episode: 4710 | Epsilon: 0.010 | FPS: 53
Step: 790154/1000000 | Episode: 4720 | Epsilon: 0.010 | FPS: 53
Step: 791841/1000000 | Episode: 4730 | Epsilon: 0.010 | FPS: 52
Step: 793704/1000000 | Episode: 4740 | Epsilon: 0.010 | FPS: 52
Step: 795562/1000000 | Episode: 4750 | Epsilon: 0.010 | FPS: 52
Step: 796909/1000000 | Episode: 4760 | Epsilon: 0.010 | FPS: 52
Step: 798828/1000000 | Episode: 4770 | Epsilon: 0.010 | FPS: 53

============================================================
Evaluating at step 800000/1000000 (80.0%)
Elapsed: 4h 13m 51s | ETA: 1h 3m 27s | Speed: 52.5 steps/s
Eval - Mean Reward: 2.10 ± 0.45, Mean Length: 135
Achievements unlocked: 5/22
============================================================

Checkpoint saved to logdir/full-enhanced/1/checkpoint_800000.pt
[CHECKPOINT] Saved to logdir/full-enhanced/1/checkpoint_800000.pt
[CHECKPOINT] Total elapsed: 4h 14m 33s | Since last checkpoint: 34m 53s
Step: 800410/1000000 | Episode: 4780 | Epsilon: 0.010 | FPS: 52
Step: 802027/1000000 | Episode: 4790 | Epsilon: 0.010 | FPS: 52
Step: 803565/1000000 | Episode: 4800 | Epsilon: 0.010 | FPS: 52
Step: 805452/1000000 | Episode: 4810 | Epsilon: 0.010 | FPS: 52
Step: 807009/1000000 | Episode: 4820 | Epsilon: 0.010 | FPS: 52
Step: 808960/1000000 | Episode: 4830 | Epsilon: 0.010 | FPS: 52
Step: 810551/1000000 | Episode: 4840 | Epsilon: 0.010 | FPS: 52
Step: 812332/1000000 | Episode: 4850 | Epsilon: 0.010 | FPS: 52
Step: 813762/1000000 | Episode: 4860 | Epsilon: 0.010 | FPS: 52
Step: 815639/1000000 | Episode: 4870 | Epsilon: 0.010 | FPS: 52
Step: 817355/1000000 | Episode: 4880 | Epsilon: 0.010 | FPS: 52
Step: 819195/1000000 | Episode: 4890 | Epsilon: 0.010 | FPS: 52
Step: 821359/1000000 | Episode: 4900 | Epsilon: 0.010 | FPS: 52
Step: 823085/1000000 | Episode: 4910 | Epsilon: 0.010 | FPS: 53
Step: 824845/1000000 | Episode: 4920 | Epsilon: 0.010 | FPS: 53
Step: 826273/1000000 | Episode: 4930 | Epsilon: 0.010 | FPS: 53
Step: 827802/1000000 | Episode: 4940 | Epsilon: 0.010 | FPS: 53
Step: 829626/1000000 | Episode: 4950 | Epsilon: 0.010 | FPS: 53
Step: 831522/1000000 | Episode: 4960 | Epsilon: 0.010 | FPS: 53
Step: 833120/1000000 | Episode: 4970 | Epsilon: 0.010 | FPS: 53
Step: 834821/1000000 | Episode: 4980 | Epsilon: 0.010 | FPS: 53
Step: 836485/1000000 | Episode: 4990 | Epsilon: 0.010 | FPS: 53
Step: 837978/1000000 | Episode: 5000 | Epsilon: 0.010 | FPS: 53
Step: 839853/1000000 | Episode: 5010 | Epsilon: 0.010 | FPS: 53
Step: 841493/1000000 | Episode: 5020 | Epsilon: 0.010 | FPS: 53
Step: 843251/1000000 | Episode: 5030 | Epsilon: 0.010 | FPS: 53
Step: 844973/1000000 | Episode: 5040 | Epsilon: 0.010 | FPS: 53
Step: 846602/1000000 | Episode: 5050 | Epsilon: 0.010 | FPS: 53
Step: 848038/1000000 | Episode: 5060 | Epsilon: 0.010 | FPS: 53
Step: 849777/1000000 | Episode: 5070 | Epsilon: 0.010 | FPS: 53

============================================================
Evaluating at step 850000/1000000 (85.0%)
Elapsed: 4h 29m 50s | ETA: 47m 37s | Speed: 52.5 steps/s
Eval - Mean Reward: 2.55 ± 0.50, Mean Length: 175
Achievements unlocked: 5/22
============================================================

Step: 851420/1000000 | Episode: 5080 | Epsilon: 0.010 | FPS: 52
Step: 853142/1000000 | Episode: 5090 | Epsilon: 0.010 | FPS: 52
Step: 855122/1000000 | Episode: 5100 | Epsilon: 0.010 | FPS: 52
Step: 856574/1000000 | Episode: 5110 | Epsilon: 0.010 | FPS: 52
Step: 858355/1000000 | Episode: 5120 | Epsilon: 0.010 | FPS: 52
Step: 860013/1000000 | Episode: 5130 | Epsilon: 0.010 | FPS: 52
Step: 861534/1000000 | Episode: 5140 | Epsilon: 0.010 | FPS: 52
Step: 863364/1000000 | Episode: 5150 | Epsilon: 0.010 | FPS: 52
Step: 865110/1000000 | Episode: 5160 | Epsilon: 0.010 | FPS: 52
Step: 866713/1000000 | Episode: 5170 | Epsilon: 0.010 | FPS: 52
Step: 868159/1000000 | Episode: 5180 | Epsilon: 0.010 | FPS: 52
Step: 869783/1000000 | Episode: 5190 | Epsilon: 0.010 | FPS: 52
Step: 871257/1000000 | Episode: 5200 | Epsilon: 0.010 | FPS: 52
Step: 872913/1000000 | Episode: 5210 | Epsilon: 0.010 | FPS: 52
Step: 874481/1000000 | Episode: 5220 | Epsilon: 0.010 | FPS: 52
Step: 876689/1000000 | Episode: 5230 | Epsilon: 0.010 | FPS: 53
Step: 878390/1000000 | Episode: 5240 | Epsilon: 0.010 | FPS: 53
Step: 879953/1000000 | Episode: 5250 | Epsilon: 0.010 | FPS: 53
Step: 881653/1000000 | Episode: 5260 | Epsilon: 0.010 | FPS: 53
Step: 882886/1000000 | Episode: 5270 | Epsilon: 0.010 | FPS: 53
Step: 884494/1000000 | Episode: 5280 | Epsilon: 0.010 | FPS: 53
Step: 886196/1000000 | Episode: 5290 | Epsilon: 0.010 | FPS: 53
Step: 887666/1000000 | Episode: 5300 | Epsilon: 0.010 | FPS: 52
Step: 889353/1000000 | Episode: 5310 | Epsilon: 0.010 | FPS: 53
Step: 890938/1000000 | Episode: 5320 | Epsilon: 0.010 | FPS: 53
Step: 892599/1000000 | Episode: 5330 | Epsilon: 0.010 | FPS: 53
Step: 894280/1000000 | Episode: 5340 | Epsilon: 0.010 | FPS: 53
Step: 895987/1000000 | Episode: 5350 | Epsilon: 0.010 | FPS: 53
Step: 897706/1000000 | Episode: 5360 | Epsilon: 0.010 | FPS: 53
Step: 899103/1000000 | Episode: 5370 | Epsilon: 0.010 | FPS: 53

============================================================
Evaluating at step 900000/1000000 (90.0%)
Elapsed: 4h 45m 31s | ETA: 31m 43s | Speed: 52.5 steps/s
Eval - Mean Reward: 2.20 ± 0.30, Mean Length: 154
Achievements unlocked: 4/22
============================================================

Checkpoint saved to logdir/full-enhanced/1/checkpoint_900000.pt
[CHECKPOINT] Saved to logdir/full-enhanced/1/checkpoint_900000.pt
[CHECKPOINT] Total elapsed: 4h 46m 15s | Since last checkpoint: 31m 42s
Step: 900661/1000000 | Episode: 5380 | Epsilon: 0.010 | FPS: 52
Step: 902342/1000000 | Episode: 5390 | Epsilon: 0.010 | FPS: 52
Step: 904303/1000000 | Episode: 5400 | Epsilon: 0.010 | FPS: 52
Step: 906250/1000000 | Episode: 5410 | Epsilon: 0.010 | FPS: 52
Step: 908123/1000000 | Episode: 5420 | Epsilon: 0.010 | FPS: 52
Step: 909633/1000000 | Episode: 5430 | Epsilon: 0.010 | FPS: 52
Step: 911281/1000000 | Episode: 5440 | Epsilon: 0.010 | FPS: 52
Step: 912862/1000000 | Episode: 5450 | Epsilon: 0.010 | FPS: 52
Step: 914396/1000000 | Episode: 5460 | Epsilon: 0.010 | FPS: 52
Step: 915942/1000000 | Episode: 5470 | Epsilon: 0.010 | FPS: 52
Step: 917621/1000000 | Episode: 5480 | Epsilon: 0.010 | FPS: 52
Step: 919282/1000000 | Episode: 5490 | Epsilon: 0.010 | FPS: 52
Step: 920972/1000000 | Episode: 5500 | Epsilon: 0.010 | FPS: 53
Step: 922658/1000000 | Episode: 5510 | Epsilon: 0.010 | FPS: 53
Step: 924357/1000000 | Episode: 5520 | Epsilon: 0.010 | FPS: 52
Step: 926174/1000000 | Episode: 5530 | Epsilon: 0.010 | FPS: 53
Step: 927815/1000000 | Episode: 5540 | Epsilon: 0.010 | FPS: 53
Step: 929416/1000000 | Episode: 5550 | Epsilon: 0.010 | FPS: 53
Step: 931106/1000000 | Episode: 5560 | Epsilon: 0.010 | FPS: 53
Step: 932435/1000000 | Episode: 5570 | Epsilon: 0.010 | FPS: 53
Step: 934300/1000000 | Episode: 5580 | Epsilon: 0.010 | FPS: 53
Step: 935971/1000000 | Episode: 5590 | Epsilon: 0.010 | FPS: 53
Step: 937711/1000000 | Episode: 5600 | Epsilon: 0.010 | FPS: 53
Step: 939315/1000000 | Episode: 5610 | Epsilon: 0.010 | FPS: 53
Step: 940760/1000000 | Episode: 5620 | Epsilon: 0.010 | FPS: 53
Step: 942755/1000000 | Episode: 5630 | Epsilon: 0.010 | FPS: 53
Step: 944036/1000000 | Episode: 5640 | Epsilon: 0.010 | FPS: 53
Step: 945768/1000000 | Episode: 5650 | Epsilon: 0.010 | FPS: 53
Step: 947834/1000000 | Episode: 5660 | Epsilon: 0.010 | FPS: 53
Step: 949402/1000000 | Episode: 5670 | Epsilon: 0.010 | FPS: 53

============================================================
Evaluating at step 950000/1000000 (95.0%)
Elapsed: 5h 0m 46s | ETA: 15m 49s | Speed: 52.6 steps/s
Eval - Mean Reward: 2.35 ± 0.54, Mean Length: 171
Achievements unlocked: 5/22
============================================================

Step: 950991/1000000 | Episode: 5680 | Epsilon: 0.010 | FPS: 53
Step: 952529/1000000 | Episode: 5690 | Epsilon: 0.010 | FPS: 53
Step: 954091/1000000 | Episode: 5700 | Epsilon: 0.010 | FPS: 53
Step: 956044/1000000 | Episode: 5710 | Epsilon: 0.010 | FPS: 53
Step: 957714/1000000 | Episode: 5720 | Epsilon: 0.010 | FPS: 53
Step: 959616/1000000 | Episode: 5730 | Epsilon: 0.010 | FPS: 53
Step: 961098/1000000 | Episode: 5740 | Epsilon: 0.010 | FPS: 53
Step: 962477/1000000 | Episode: 5750 | Epsilon: 0.010 | FPS: 53
Step: 963992/1000000 | Episode: 5760 | Epsilon: 0.010 | FPS: 53
Step: 965641/1000000 | Episode: 5770 | Epsilon: 0.010 | FPS: 53
Step: 967221/1000000 | Episode: 5780 | Epsilon: 0.010 | FPS: 53
Step: 968786/1000000 | Episode: 5790 | Epsilon: 0.010 | FPS: 53
Step: 970527/1000000 | Episode: 5800 | Epsilon: 0.010 | FPS: 53
Step: 972247/1000000 | Episode: 5810 | Epsilon: 0.010 | FPS: 53
Step: 973752/1000000 | Episode: 5820 | Epsilon: 0.010 | FPS: 53
Step: 975286/1000000 | Episode: 5830 | Epsilon: 0.010 | FPS: 53
Step: 976940/1000000 | Episode: 5840 | Epsilon: 0.010 | FPS: 53
Step: 978610/1000000 | Episode: 5850 | Epsilon: 0.010 | FPS: 53
Step: 980333/1000000 | Episode: 5860 | Epsilon: 0.010 | FPS: 53
Step: 981737/1000000 | Episode: 5870 | Epsilon: 0.010 | FPS: 53
Step: 983484/1000000 | Episode: 5880 | Epsilon: 0.010 | FPS: 53
Step: 985094/1000000 | Episode: 5890 | Epsilon: 0.010 | FPS: 53
Step: 986705/1000000 | Episode: 5900 | Epsilon: 0.010 | FPS: 53
Step: 988310/1000000 | Episode: 5910 | Epsilon: 0.010 | FPS: 53
Step: 990459/1000000 | Episode: 5920 | Epsilon: 0.010 | FPS: 53
Step: 991972/1000000 | Episode: 5930 | Epsilon: 0.010 | FPS: 53
Step: 993673/1000000 | Episode: 5940 | Epsilon: 0.010 | FPS: 53
Step: 995219/1000000 | Episode: 5950 | Epsilon: 0.010 | FPS: 53
Step: 996872/1000000 | Episode: 5960 | Epsilon: 0.010 | FPS: 53
Step: 998375/1000000 | Episode: 5970 | Epsilon: 0.010 | FPS: 53

============================================================
Evaluating at step 1000000/1000000 (100.0%)
Elapsed: 5h 15m 39s | ETA: 0s | Speed: 52.8 steps/s
Eval - Mean Reward: 2.45 ± 0.57, Mean Length: 169
Achievements unlocked: 5/22
============================================================

Checkpoint saved to logdir/full-enhanced/1/checkpoint_1000000.pt
[CHECKPOINT] Saved to logdir/full-enhanced/1/checkpoint_1000000.pt
[CHECKPOINT] Total elapsed: 5h 16m 24s | Since last checkpoint: 30m 9s

============================================================
FINAL EVALUATION
Total training time: 5h 16m 26s
============================================================
Final Mean Reward: 2.55 ± 0.59
Final Achievements: 5/22

Final Achievement Success Rates:
  collect_sapling: 100.0%
  place_plant: 100.0%
  wake_up: 100.0%
  eat_cow: 25.0%
  defeat_zombie: 20.0%
Checkpoint saved to logdir/full-enhanced/1/final_model.pt

Saved final model to logdir/full-enhanced/1/final_model.pt
Metrics saved to logdir/full-enhanced/1/metrics.json
Metadata saved to logdir/full-enhanced/1/metadata.json
============================================================
TRAINING COMPLETE!
============================================================

Final Training Statistics:
  Training Time: 5h 16m 26s
  Final Eval Reward: 2.45 ± 0.57
  Best Eval Reward: 2.55
  Total Episodes: 5979
  Final Loss: 0.0063
  Final Epsilon: 0.0100
============================================================
