======================================================================
Experiment: training_run
======================================================================

Start Time: 2025-11-10T03:28:36.002384

Git Info:
  Commit: 2950c37 (test-1)
  WARNING: Uncommitted changes present!

System Info:
  Hostname: dr1-v100s-1
  Platform: Linux-6.8.0-87-generic-x86_64-with-glibc2.39
  CPU Count: 15

GPU Info:
  GPU 0: Tesla V100S-PCIE-32GB
    Memory: 32768 MiB
    Driver: 580.95.05

Package Versions:
  PyTorch: 2.9.0+cu128
  CUDA: 12.8
  NumPy: 2.3.4
  Crafter: unknown

Experiment Arguments:
  batch_size: 32
  buffer_size: 100000
  device: cuda
  double_dqn: True
  dueling: True
  env_name: crafter
  epsilon_decay_steps: 50000
  epsilon_end: 0.01
  epsilon_start: 1.0
  eval_episodes: 20
  eval_interval: 50000
  gamma: 0.99
  grad_clip: 10.0
  hidden_size: 512
  logdir: logdir/dqn-nstep5/1
  lr: 0.0001
  munchausen: False
  munchausen_alpha: 0.9
  munchausen_tau: 0.03
  n_step: 5
  resume: None
  save_freq: 100000
  seed: 1
  steps: 1000000
  target_update_freq: 2500
  training_starts: 5000
  update_freq: 4
======================================================================

Step: 1592/1000000 | Episode: 10 | Epsilon: 0.968 | FPS: 90
Step: 3166/1000000 | Episode: 20 | Epsilon: 0.937 | FPS: 84
Step: 4982/1000000 | Episode: 30 | Epsilon: 0.901 | FPS: 89
Step: 6769/1000000 | Episode: 40 | Epsilon: 0.866 | FPS: 84
Step: 8282/1000000 | Episode: 50 | Epsilon: 0.836 | FPS: 80
Step: 10089/1000000 | Episode: 60 | Epsilon: 0.800 | FPS: 77
Step: 11809/1000000 | Episode: 70 | Epsilon: 0.766 | FPS: 76
Step: 13530/1000000 | Episode: 80 | Epsilon: 0.732 | FPS: 75
Step: 15286/1000000 | Episode: 90 | Epsilon: 0.697 | FPS: 74
Step: 17136/1000000 | Episode: 100 | Epsilon: 0.661 | FPS: 71
Step: 19101/1000000 | Episode: 110 | Epsilon: 0.622 | FPS: 71
Step: 20745/1000000 | Episode: 120 | Epsilon: 0.589 | FPS: 71
Step: 22575/1000000 | Episode: 130 | Epsilon: 0.553 | FPS: 70
Step: 24429/1000000 | Episode: 140 | Epsilon: 0.516 | FPS: 70
Step: 26159/1000000 | Episode: 150 | Epsilon: 0.482 | FPS: 70
Step: 28013/1000000 | Episode: 160 | Epsilon: 0.445 | FPS: 69
Step: 29720/1000000 | Episode: 170 | Epsilon: 0.412 | FPS: 69
Step: 31537/1000000 | Episode: 180 | Epsilon: 0.376 | FPS: 69
Step: 33037/1000000 | Episode: 190 | Epsilon: 0.346 | FPS: 68
Step: 34873/1000000 | Episode: 200 | Epsilon: 0.310 | FPS: 67
Step: 36711/1000000 | Episode: 210 | Epsilon: 0.273 | FPS: 66
Step: 38472/1000000 | Episode: 220 | Epsilon: 0.238 | FPS: 66
Step: 40167/1000000 | Episode: 230 | Epsilon: 0.205 | FPS: 66
Step: 41954/1000000 | Episode: 240 | Epsilon: 0.169 | FPS: 65
Step: 44051/1000000 | Episode: 250 | Epsilon: 0.128 | FPS: 65
Step: 46090/1000000 | Episode: 260 | Epsilon: 0.087 | FPS: 65
Step: 47717/1000000 | Episode: 270 | Epsilon: 0.055 | FPS: 64
Step: 49620/1000000 | Episode: 280 | Epsilon: 0.018 | FPS: 63

============================================================
Evaluating at step 50000/1000000 (5.0%)
Elapsed: 13m 9s | ETA: 4h 10m 5s | Speed: 63.3 steps/s
Eval - Mean Reward: 2.25 ± 0.65, Mean Length: 162
Achievements unlocked: 6/22
============================================================

Step: 51487/1000000 | Episode: 290 | Epsilon: 0.010 | FPS: 60
Step: 53338/1000000 | Episode: 300 | Epsilon: 0.010 | FPS: 61
Step: 55011/1000000 | Episode: 310 | Epsilon: 0.010 | FPS: 60
Step: 56621/1000000 | Episode: 320 | Epsilon: 0.010 | FPS: 60
Step: 58517/1000000 | Episode: 330 | Epsilon: 0.010 | FPS: 60
Step: 60007/1000000 | Episode: 340 | Epsilon: 0.010 | FPS: 60
Step: 61751/1000000 | Episode: 350 | Epsilon: 0.010 | FPS: 60
Step: 63768/1000000 | Episode: 360 | Epsilon: 0.010 | FPS: 60
Step: 65289/1000000 | Episode: 370 | Epsilon: 0.010 | FPS: 60
Step: 67374/1000000 | Episode: 380 | Epsilon: 0.010 | FPS: 60
Step: 69326/1000000 | Episode: 390 | Epsilon: 0.010 | FPS: 59
Step: 70860/1000000 | Episode: 400 | Epsilon: 0.010 | FPS: 59
Step: 72856/1000000 | Episode: 410 | Epsilon: 0.010 | FPS: 59
Step: 74620/1000000 | Episode: 420 | Epsilon: 0.010 | FPS: 59
Step: 76480/1000000 | Episode: 430 | Epsilon: 0.010 | FPS: 59
Step: 78237/1000000 | Episode: 440 | Epsilon: 0.010 | FPS: 58
Step: 80021/1000000 | Episode: 450 | Epsilon: 0.010 | FPS: 57
Step: 82098/1000000 | Episode: 460 | Epsilon: 0.010 | FPS: 57
Step: 83973/1000000 | Episode: 470 | Epsilon: 0.010 | FPS: 57
Step: 85681/1000000 | Episode: 480 | Epsilon: 0.010 | FPS: 57
Step: 87638/1000000 | Episode: 490 | Epsilon: 0.010 | FPS: 57
Step: 89473/1000000 | Episode: 500 | Epsilon: 0.010 | FPS: 57
Step: 91485/1000000 | Episode: 510 | Epsilon: 0.010 | FPS: 57
Step: 93054/1000000 | Episode: 520 | Epsilon: 0.010 | FPS: 56
Step: 94922/1000000 | Episode: 530 | Epsilon: 0.010 | FPS: 56
Step: 96807/1000000 | Episode: 540 | Epsilon: 0.010 | FPS: 56
Step: 98518/1000000 | Episode: 550 | Epsilon: 0.010 | FPS: 56

============================================================
Evaluating at step 100000/1000000 (10.0%)
Elapsed: 29m 34s | ETA: 4h 26m 14s | Speed: 56.3 steps/s
Eval - Mean Reward: 2.75 ± 0.96, Mean Length: 164
Achievements unlocked: 9/22
============================================================

[CHECKPOINT] Saved to logdir/dqn-nstep5/1/checkpoint_100000.pt
[CHECKPOINT] Total elapsed: 30m 17s | Since last checkpoint: 30m 17s
Step: 100338/1000000 | Episode: 560 | Epsilon: 0.010 | FPS: 55
Step: 101752/1000000 | Episode: 570 | Epsilon: 0.010 | FPS: 55
Step: 103699/1000000 | Episode: 580 | Epsilon: 0.010 | FPS: 55
Step: 105434/1000000 | Episode: 590 | Epsilon: 0.010 | FPS: 55
Step: 107044/1000000 | Episode: 600 | Epsilon: 0.010 | FPS: 55
Step: 108770/1000000 | Episode: 610 | Epsilon: 0.010 | FPS: 55
Step: 110661/1000000 | Episode: 620 | Epsilon: 0.010 | FPS: 55
Step: 112482/1000000 | Episode: 630 | Epsilon: 0.010 | FPS: 55
Step: 114423/1000000 | Episode: 640 | Epsilon: 0.010 | FPS: 55
Step: 116159/1000000 | Episode: 650 | Epsilon: 0.010 | FPS: 56
Step: 117960/1000000 | Episode: 660 | Epsilon: 0.010 | FPS: 56
Step: 119450/1000000 | Episode: 670 | Epsilon: 0.010 | FPS: 56
Step: 121026/1000000 | Episode: 680 | Epsilon: 0.010 | FPS: 56
Step: 122762/1000000 | Episode: 690 | Epsilon: 0.010 | FPS: 56
Step: 124643/1000000 | Episode: 700 | Epsilon: 0.010 | FPS: 56
Step: 126574/1000000 | Episode: 710 | Epsilon: 0.010 | FPS: 56
Step: 128230/1000000 | Episode: 720 | Epsilon: 0.010 | FPS: 56
Step: 129921/1000000 | Episode: 730 | Epsilon: 0.010 | FPS: 56
Step: 131649/1000000 | Episode: 740 | Epsilon: 0.010 | FPS: 56
Step: 133258/1000000 | Episode: 750 | Epsilon: 0.010 | FPS: 56
Step: 135079/1000000 | Episode: 760 | Epsilon: 0.010 | FPS: 56
Step: 136842/1000000 | Episode: 770 | Epsilon: 0.010 | FPS: 56
Step: 138722/1000000 | Episode: 780 | Epsilon: 0.010 | FPS: 56
Step: 140556/1000000 | Episode: 790 | Epsilon: 0.010 | FPS: 56
Step: 142486/1000000 | Episode: 800 | Epsilon: 0.010 | FPS: 56
Step: 144615/1000000 | Episode: 810 | Epsilon: 0.010 | FPS: 56
Step: 146118/1000000 | Episode: 820 | Epsilon: 0.010 | FPS: 56
Step: 147899/1000000 | Episode: 830 | Epsilon: 0.010 | FPS: 56
Step: 149984/1000000 | Episode: 840 | Epsilon: 0.010 | FPS: 56

============================================================
Evaluating at step 150000/1000000 (15.0%)
Elapsed: 44m 30s | ETA: 4h 12m 15s | Speed: 56.2 steps/s
Eval - Mean Reward: 3.25 ± 0.73, Mean Length: 180
Achievements unlocked: 8/22
============================================================

Step: 152001/1000000 | Episode: 850 | Epsilon: 0.010 | FPS: 55
Step: 153797/1000000 | Episode: 860 | Epsilon: 0.010 | FPS: 55
Step: 155388/1000000 | Episode: 870 | Epsilon: 0.010 | FPS: 55
Step: 157113/1000000 | Episode: 880 | Epsilon: 0.010 | FPS: 55
Step: 158827/1000000 | Episode: 890 | Epsilon: 0.010 | FPS: 55
Step: 160930/1000000 | Episode: 900 | Epsilon: 0.010 | FPS: 55
Step: 162699/1000000 | Episode: 910 | Epsilon: 0.010 | FPS: 56
Step: 164542/1000000 | Episode: 920 | Epsilon: 0.010 | FPS: 56
Step: 166495/1000000 | Episode: 930 | Epsilon: 0.010 | FPS: 56
Step: 168330/1000000 | Episode: 940 | Epsilon: 0.010 | FPS: 56
Step: 169982/1000000 | Episode: 950 | Epsilon: 0.010 | FPS: 56
Step: 171862/1000000 | Episode: 960 | Epsilon: 0.010 | FPS: 56
Step: 174002/1000000 | Episode: 970 | Epsilon: 0.010 | FPS: 56
Step: 175837/1000000 | Episode: 980 | Epsilon: 0.010 | FPS: 56
Step: 177463/1000000 | Episode: 990 | Epsilon: 0.010 | FPS: 55
Step: 179040/1000000 | Episode: 1000 | Epsilon: 0.010 | FPS: 55
Step: 180541/1000000 | Episode: 1010 | Epsilon: 0.010 | FPS: 55
Step: 182492/1000000 | Episode: 1020 | Epsilon: 0.010 | FPS: 55
Step: 184386/1000000 | Episode: 1030 | Epsilon: 0.010 | FPS: 56
Step: 186010/1000000 | Episode: 1040 | Epsilon: 0.010 | FPS: 56
Step: 187660/1000000 | Episode: 1050 | Epsilon: 0.010 | FPS: 56
Step: 189322/1000000 | Episode: 1060 | Epsilon: 0.010 | FPS: 56
Step: 191126/1000000 | Episode: 1070 | Epsilon: 0.010 | FPS: 56
Step: 193006/1000000 | Episode: 1080 | Epsilon: 0.010 | FPS: 56
Step: 194550/1000000 | Episode: 1090 | Epsilon: 0.010 | FPS: 56
Step: 196058/1000000 | Episode: 1100 | Epsilon: 0.010 | FPS: 56
Step: 197641/1000000 | Episode: 1110 | Epsilon: 0.010 | FPS: 56
Step: 199328/1000000 | Episode: 1120 | Epsilon: 0.010 | FPS: 56

============================================================
Evaluating at step 200000/1000000 (20.0%)
Elapsed: 59m 47s | ETA: 3h 59m 11s | Speed: 55.7 steps/s
Eval - Mean Reward: 3.40 ± 0.95, Mean Length: 178
Achievements unlocked: 7/22
============================================================

[CHECKPOINT] Saved to logdir/dqn-nstep5/1/checkpoint_200000.pt
[CHECKPOINT] Total elapsed: 1h 0m 30s | Since last checkpoint: 30m 13s
Step: 200830/1000000 | Episode: 1130 | Epsilon: 0.010 | FPS: 55
Step: 202895/1000000 | Episode: 1140 | Epsilon: 0.010 | FPS: 55
Step: 204805/1000000 | Episode: 1150 | Epsilon: 0.010 | FPS: 55
Step: 206630/1000000 | Episode: 1160 | Epsilon: 0.010 | FPS: 55
Step: 208354/1000000 | Episode: 1170 | Epsilon: 0.010 | FPS: 55
Step: 209920/1000000 | Episode: 1180 | Epsilon: 0.010 | FPS: 55
Step: 211561/1000000 | Episode: 1190 | Epsilon: 0.010 | FPS: 55
Step: 213454/1000000 | Episode: 1200 | Epsilon: 0.010 | FPS: 55
Step: 214925/1000000 | Episode: 1210 | Epsilon: 0.010 | FPS: 55
Step: 216705/1000000 | Episode: 1220 | Epsilon: 0.010 | FPS: 55
Step: 218928/1000000 | Episode: 1230 | Epsilon: 0.010 | FPS: 55
Step: 220553/1000000 | Episode: 1240 | Epsilon: 0.010 | FPS: 55
Step: 222305/1000000 | Episode: 1250 | Epsilon: 0.010 | FPS: 55
Step: 224027/1000000 | Episode: 1260 | Epsilon: 0.010 | FPS: 55
Step: 225891/1000000 | Episode: 1270 | Epsilon: 0.010 | FPS: 55
Step: 227665/1000000 | Episode: 1280 | Epsilon: 0.010 | FPS: 55
Step: 229333/1000000 | Episode: 1290 | Epsilon: 0.010 | FPS: 55
Step: 231389/1000000 | Episode: 1300 | Epsilon: 0.010 | FPS: 55
Step: 233233/1000000 | Episode: 1310 | Epsilon: 0.010 | FPS: 55
Step: 234903/1000000 | Episode: 1320 | Epsilon: 0.010 | FPS: 55
Step: 236499/1000000 | Episode: 1330 | Epsilon: 0.010 | FPS: 55
Step: 238303/1000000 | Episode: 1340 | Epsilon: 0.010 | FPS: 55
Step: 240127/1000000 | Episode: 1350 | Epsilon: 0.010 | FPS: 55
Step: 242085/1000000 | Episode: 1360 | Epsilon: 0.010 | FPS: 55
Step: 243808/1000000 | Episode: 1370 | Epsilon: 0.010 | FPS: 55
Step: 245734/1000000 | Episode: 1380 | Epsilon: 0.010 | FPS: 55
Step: 247338/1000000 | Episode: 1390 | Epsilon: 0.010 | FPS: 55
Step: 249180/1000000 | Episode: 1400 | Epsilon: 0.010 | FPS: 55

============================================================
Evaluating at step 250000/1000000 (25.0%)
Elapsed: 1h 15m 20s | ETA: 3h 46m 0s | Speed: 55.3 steps/s
Eval - Mean Reward: 3.75 ± 0.96, Mean Length: 154
Achievements unlocked: 8/22
============================================================

Step: 251112/1000000 | Episode: 1410 | Epsilon: 0.010 | FPS: 55
Step: 253006/1000000 | Episode: 1420 | Epsilon: 0.010 | FPS: 55
Step: 254708/1000000 | Episode: 1430 | Epsilon: 0.010 | FPS: 55
Step: 256534/1000000 | Episode: 1440 | Epsilon: 0.010 | FPS: 55
Step: 258547/1000000 | Episode: 1450 | Epsilon: 0.010 | FPS: 55
Step: 260390/1000000 | Episode: 1460 | Epsilon: 0.010 | FPS: 55
Step: 262140/1000000 | Episode: 1470 | Epsilon: 0.010 | FPS: 55
Step: 263962/1000000 | Episode: 1480 | Epsilon: 0.010 | FPS: 55
Step: 265886/1000000 | Episode: 1490 | Epsilon: 0.010 | FPS: 55
Step: 267993/1000000 | Episode: 1500 | Epsilon: 0.010 | FPS: 55
Step: 269713/1000000 | Episode: 1510 | Epsilon: 0.010 | FPS: 55
Step: 271463/1000000 | Episode: 1520 | Epsilon: 0.010 | FPS: 55
Step: 273054/1000000 | Episode: 1530 | Epsilon: 0.010 | FPS: 55
Step: 274884/1000000 | Episode: 1540 | Epsilon: 0.010 | FPS: 55
Step: 276555/1000000 | Episode: 1550 | Epsilon: 0.010 | FPS: 55
Step: 278435/1000000 | Episode: 1560 | Epsilon: 0.010 | FPS: 55
Step: 280254/1000000 | Episode: 1570 | Epsilon: 0.010 | FPS: 55
Step: 282293/1000000 | Episode: 1580 | Epsilon: 0.010 | FPS: 55
Step: 284042/1000000 | Episode: 1590 | Epsilon: 0.010 | FPS: 55
Step: 286129/1000000 | Episode: 1600 | Epsilon: 0.010 | FPS: 55
Step: 287947/1000000 | Episode: 1610 | Epsilon: 0.010 | FPS: 55
Step: 289933/1000000 | Episode: 1620 | Epsilon: 0.010 | FPS: 55
Step: 291430/1000000 | Episode: 1630 | Epsilon: 0.010 | FPS: 55
Step: 293300/1000000 | Episode: 1640 | Epsilon: 0.010 | FPS: 55
Step: 294999/1000000 | Episode: 1650 | Epsilon: 0.010 | FPS: 55
Step: 296833/1000000 | Episode: 1660 | Epsilon: 0.010 | FPS: 55
Step: 298583/1000000 | Episode: 1670 | Epsilon: 0.010 | FPS: 55

============================================================
Evaluating at step 300000/1000000 (30.0%)
Elapsed: 1h 30m 30s | ETA: 3h 31m 11s | Speed: 55.2 steps/s
Eval - Mean Reward: 3.95 ± 0.91, Mean Length: 190
Achievements unlocked: 9/22
============================================================

[CHECKPOINT] Saved to logdir/dqn-nstep5/1/checkpoint_300000.pt
[CHECKPOINT] Total elapsed: 1h 31m 15s | Since last checkpoint: 30m 45s
Step: 300457/1000000 | Episode: 1680 | Epsilon: 0.010 | FPS: 55
Step: 302262/1000000 | Episode: 1690 | Epsilon: 0.010 | FPS: 55
Step: 303974/1000000 | Episode: 1700 | Epsilon: 0.010 | FPS: 55
Step: 305715/1000000 | Episode: 1710 | Epsilon: 0.010 | FPS: 55
Step: 307207/1000000 | Episode: 1720 | Epsilon: 0.010 | FPS: 55
Step: 308895/1000000 | Episode: 1730 | Epsilon: 0.010 | FPS: 55
Step: 310796/1000000 | Episode: 1740 | Epsilon: 0.010 | FPS: 55
Step: 312318/1000000 | Episode: 1750 | Epsilon: 0.010 | FPS: 55
Step: 314201/1000000 | Episode: 1760 | Epsilon: 0.010 | FPS: 55
Step: 315990/1000000 | Episode: 1770 | Epsilon: 0.010 | FPS: 55
Step: 317951/1000000 | Episode: 1780 | Epsilon: 0.010 | FPS: 55
Step: 319339/1000000 | Episode: 1790 | Epsilon: 0.010 | FPS: 55
Step: 321445/1000000 | Episode: 1800 | Epsilon: 0.010 | FPS: 55
Step: 323170/1000000 | Episode: 1810 | Epsilon: 0.010 | FPS: 55
Step: 324799/1000000 | Episode: 1820 | Epsilon: 0.010 | FPS: 55
Step: 326898/1000000 | Episode: 1830 | Epsilon: 0.010 | FPS: 55
Step: 328881/1000000 | Episode: 1840 | Epsilon: 0.010 | FPS: 55
Step: 330686/1000000 | Episode: 1850 | Epsilon: 0.010 | FPS: 55
Step: 332471/1000000 | Episode: 1860 | Epsilon: 0.010 | FPS: 55
Step: 334051/1000000 | Episode: 1870 | Epsilon: 0.010 | FPS: 55
Step: 335674/1000000 | Episode: 1880 | Epsilon: 0.010 | FPS: 55
Step: 337203/1000000 | Episode: 1890 | Epsilon: 0.010 | FPS: 55
Step: 338984/1000000 | Episode: 1900 | Epsilon: 0.010 | FPS: 55
Step: 340863/1000000 | Episode: 1910 | Epsilon: 0.010 | FPS: 55
Step: 342515/1000000 | Episode: 1920 | Epsilon: 0.010 | FPS: 55
Step: 344062/1000000 | Episode: 1930 | Epsilon: 0.010 | FPS: 55
Step: 345751/1000000 | Episode: 1940 | Epsilon: 0.010 | FPS: 55
Step: 347435/1000000 | Episode: 1950 | Epsilon: 0.010 | FPS: 55
Step: 349358/1000000 | Episode: 1960 | Epsilon: 0.010 | FPS: 55

============================================================
Evaluating at step 350000/1000000 (35.0%)
Elapsed: 1h 45m 48s | ETA: 3h 16m 29s | Speed: 55.1 steps/s
Eval - Mean Reward: 3.55 ± 1.02, Mean Length: 165
Achievements unlocked: 7/22
============================================================

Step: 351164/1000000 | Episode: 1970 | Epsilon: 0.010 | FPS: 55
Step: 353059/1000000 | Episode: 1980 | Epsilon: 0.010 | FPS: 55
Step: 354746/1000000 | Episode: 1990 | Epsilon: 0.010 | FPS: 55
Step: 356428/1000000 | Episode: 2000 | Epsilon: 0.010 | FPS: 55
Step: 358053/1000000 | Episode: 2010 | Epsilon: 0.010 | FPS: 55
Step: 359858/1000000 | Episode: 2020 | Epsilon: 0.010 | FPS: 55
Step: 361220/1000000 | Episode: 2030 | Epsilon: 0.010 | FPS: 55
Step: 362871/1000000 | Episode: 2040 | Epsilon: 0.010 | FPS: 55
Step: 364641/1000000 | Episode: 2050 | Epsilon: 0.010 | FPS: 55
Step: 366444/1000000 | Episode: 2060 | Epsilon: 0.010 | FPS: 55
Step: 368225/1000000 | Episode: 2070 | Epsilon: 0.010 | FPS: 55
Step: 369835/1000000 | Episode: 2080 | Epsilon: 0.010 | FPS: 55
Step: 371684/1000000 | Episode: 2090 | Epsilon: 0.010 | FPS: 55
Step: 373720/1000000 | Episode: 2100 | Epsilon: 0.010 | FPS: 55
Step: 375316/1000000 | Episode: 2110 | Epsilon: 0.010 | FPS: 55
Step: 377062/1000000 | Episode: 2120 | Epsilon: 0.010 | FPS: 55
Step: 378714/1000000 | Episode: 2130 | Epsilon: 0.010 | FPS: 55
Step: 380485/1000000 | Episode: 2140 | Epsilon: 0.010 | FPS: 55
Step: 382114/1000000 | Episode: 2150 | Epsilon: 0.010 | FPS: 55
Step: 383965/1000000 | Episode: 2160 | Epsilon: 0.010 | FPS: 55
Step: 385537/1000000 | Episode: 2170 | Epsilon: 0.010 | FPS: 55
Step: 387446/1000000 | Episode: 2180 | Epsilon: 0.010 | FPS: 55
Step: 389288/1000000 | Episode: 2190 | Epsilon: 0.010 | FPS: 55
Step: 391010/1000000 | Episode: 2200 | Epsilon: 0.010 | FPS: 55
Step: 393054/1000000 | Episode: 2210 | Epsilon: 0.010 | FPS: 55
Step: 394945/1000000 | Episode: 2220 | Epsilon: 0.010 | FPS: 55
Step: 396472/1000000 | Episode: 2230 | Epsilon: 0.010 | FPS: 55
Step: 398407/1000000 | Episode: 2240 | Epsilon: 0.010 | FPS: 55

============================================================
Evaluating at step 400000/1000000 (40.0%)
Elapsed: 2h 0m 50s | ETA: 3h 1m 15s | Speed: 55.2 steps/s
Eval - Mean Reward: 4.00 ± 1.04, Mean Length: 200
Achievements unlocked: 8/22
============================================================

[CHECKPOINT] Saved to logdir/dqn-nstep5/1/checkpoint_400000.pt
[CHECKPOINT] Total elapsed: 2h 1m 34s | Since last checkpoint: 30m 18s
Step: 400252/1000000 | Episode: 2250 | Epsilon: 0.010 | FPS: 55
Step: 402263/1000000 | Episode: 2260 | Epsilon: 0.010 | FPS: 55
Step: 403945/1000000 | Episode: 2270 | Epsilon: 0.010 | FPS: 55
Step: 405720/1000000 | Episode: 2280 | Epsilon: 0.010 | FPS: 55
Step: 407601/1000000 | Episode: 2290 | Epsilon: 0.010 | FPS: 55
Step: 409468/1000000 | Episode: 2300 | Epsilon: 0.010 | FPS: 55
Step: 410898/1000000 | Episode: 2310 | Epsilon: 0.010 | FPS: 55
Step: 412544/1000000 | Episode: 2320 | Epsilon: 0.010 | FPS: 55
Step: 414266/1000000 | Episode: 2330 | Epsilon: 0.010 | FPS: 55
Step: 415954/1000000 | Episode: 2340 | Epsilon: 0.010 | FPS: 55
Step: 417764/1000000 | Episode: 2350 | Epsilon: 0.010 | FPS: 55
Step: 419808/1000000 | Episode: 2360 | Epsilon: 0.010 | FPS: 55
Step: 421798/1000000 | Episode: 2370 | Epsilon: 0.010 | FPS: 55
Step: 423406/1000000 | Episode: 2380 | Epsilon: 0.010 | FPS: 55
Step: 425312/1000000 | Episode: 2390 | Epsilon: 0.010 | FPS: 55
Step: 427187/1000000 | Episode: 2400 | Epsilon: 0.010 | FPS: 55
Step: 428612/1000000 | Episode: 2410 | Epsilon: 0.010 | FPS: 55
Step: 429972/1000000 | Episode: 2420 | Epsilon: 0.010 | FPS: 55
Step: 431763/1000000 | Episode: 2430 | Epsilon: 0.010 | FPS: 55
Step: 433478/1000000 | Episode: 2440 | Epsilon: 0.010 | FPS: 55
Step: 435274/1000000 | Episode: 2450 | Epsilon: 0.010 | FPS: 55
Step: 437077/1000000 | Episode: 2460 | Epsilon: 0.010 | FPS: 55
Step: 438771/1000000 | Episode: 2470 | Epsilon: 0.010 | FPS: 55
Step: 440704/1000000 | Episode: 2480 | Epsilon: 0.010 | FPS: 55
Step: 442291/1000000 | Episode: 2490 | Epsilon: 0.010 | FPS: 55
Step: 444027/1000000 | Episode: 2500 | Epsilon: 0.010 | FPS: 55
Step: 445754/1000000 | Episode: 2510 | Epsilon: 0.010 | FPS: 55
Step: 447713/1000000 | Episode: 2520 | Epsilon: 0.010 | FPS: 55
Step: 449042/1000000 | Episode: 2530 | Epsilon: 0.010 | FPS: 55

============================================================
Evaluating at step 450000/1000000 (45.0%)
Elapsed: 2h 16m 6s | ETA: 2h 46m 21s | Speed: 55.1 steps/s
Eval - Mean Reward: 3.80 ± 0.90, Mean Length: 180
Achievements unlocked: 8/22
============================================================

Step: 450984/1000000 | Episode: 2540 | Epsilon: 0.010 | FPS: 55
Step: 452848/1000000 | Episode: 2550 | Epsilon: 0.010 | FPS: 55
Step: 454444/1000000 | Episode: 2560 | Epsilon: 0.010 | FPS: 55
Step: 456028/1000000 | Episode: 2570 | Epsilon: 0.010 | FPS: 55
Step: 457747/1000000 | Episode: 2580 | Epsilon: 0.010 | FPS: 55
Step: 459590/1000000 | Episode: 2590 | Epsilon: 0.010 | FPS: 55
Step: 461164/1000000 | Episode: 2600 | Epsilon: 0.010 | FPS: 55
Step: 462593/1000000 | Episode: 2610 | Epsilon: 0.010 | FPS: 55
Step: 464292/1000000 | Episode: 2620 | Epsilon: 0.010 | FPS: 55
Step: 465762/1000000 | Episode: 2630 | Epsilon: 0.010 | FPS: 55
Step: 467727/1000000 | Episode: 2640 | Epsilon: 0.010 | FPS: 55
Step: 469762/1000000 | Episode: 2650 | Epsilon: 0.010 | FPS: 55
Step: 471384/1000000 | Episode: 2660 | Epsilon: 0.010 | FPS: 55
Step: 473336/1000000 | Episode: 2670 | Epsilon: 0.010 | FPS: 55
Step: 475084/1000000 | Episode: 2680 | Epsilon: 0.010 | FPS: 55
Step: 477192/1000000 | Episode: 2690 | Epsilon: 0.010 | FPS: 55
Step: 479221/1000000 | Episode: 2700 | Epsilon: 0.010 | FPS: 55
Step: 481148/1000000 | Episode: 2710 | Epsilon: 0.010 | FPS: 55
Step: 482696/1000000 | Episode: 2720 | Epsilon: 0.010 | FPS: 55
Step: 484624/1000000 | Episode: 2730 | Epsilon: 0.010 | FPS: 55
Step: 486331/1000000 | Episode: 2740 | Epsilon: 0.010 | FPS: 55
Step: 488003/1000000 | Episode: 2750 | Epsilon: 0.010 | FPS: 55
Step: 489668/1000000 | Episode: 2760 | Epsilon: 0.010 | FPS: 55
Step: 491584/1000000 | Episode: 2770 | Epsilon: 0.010 | FPS: 55
Step: 493231/1000000 | Episode: 2780 | Epsilon: 0.010 | FPS: 55
Step: 495174/1000000 | Episode: 2790 | Epsilon: 0.010 | FPS: 55
Step: 497023/1000000 | Episode: 2800 | Epsilon: 0.010 | FPS: 55
Step: 498686/1000000 | Episode: 2810 | Epsilon: 0.010 | FPS: 55

============================================================
Evaluating at step 500000/1000000 (50.0%)
Elapsed: 2h 31m 26s | ETA: 2h 31m 26s | Speed: 55.0 steps/s
Eval - Mean Reward: 3.80 ± 1.31, Mean Length: 170
Achievements unlocked: 9/22
============================================================

[CHECKPOINT] Saved to logdir/dqn-nstep5/1/checkpoint_500000.pt
[CHECKPOINT] Total elapsed: 2h 32m 8s | Since last checkpoint: 30m 33s
Step: 500264/1000000 | Episode: 2820 | Epsilon: 0.010 | FPS: 55
Step: 502305/1000000 | Episode: 2830 | Epsilon: 0.010 | FPS: 55
Step: 504426/1000000 | Episode: 2840 | Epsilon: 0.010 | FPS: 55
Step: 506095/1000000 | Episode: 2850 | Epsilon: 0.010 | FPS: 55
Step: 507697/1000000 | Episode: 2860 | Epsilon: 0.010 | FPS: 55
Step: 509517/1000000 | Episode: 2870 | Epsilon: 0.010 | FPS: 55
Step: 511257/1000000 | Episode: 2880 | Epsilon: 0.010 | FPS: 55
Step: 513024/1000000 | Episode: 2890 | Epsilon: 0.010 | FPS: 55
Step: 514898/1000000 | Episode: 2900 | Epsilon: 0.010 | FPS: 55
Step: 516887/1000000 | Episode: 2910 | Epsilon: 0.010 | FPS: 55
Step: 518702/1000000 | Episode: 2920 | Epsilon: 0.010 | FPS: 55
Step: 520858/1000000 | Episode: 2930 | Epsilon: 0.010 | FPS: 55
Step: 522476/1000000 | Episode: 2940 | Epsilon: 0.010 | FPS: 55
Step: 524232/1000000 | Episode: 2950 | Epsilon: 0.010 | FPS: 55
Step: 526313/1000000 | Episode: 2960 | Epsilon: 0.010 | FPS: 55
Step: 528115/1000000 | Episode: 2970 | Epsilon: 0.010 | FPS: 55
Step: 529912/1000000 | Episode: 2980 | Epsilon: 0.010 | FPS: 55
Step: 531838/1000000 | Episode: 2990 | Epsilon: 0.010 | FPS: 55
Step: 533787/1000000 | Episode: 3000 | Epsilon: 0.010 | FPS: 55
Step: 535808/1000000 | Episode: 3010 | Epsilon: 0.010 | FPS: 55
Step: 537682/1000000 | Episode: 3020 | Epsilon: 0.010 | FPS: 55
Step: 539723/1000000 | Episode: 3030 | Epsilon: 0.010 | FPS: 55
Step: 541490/1000000 | Episode: 3040 | Epsilon: 0.010 | FPS: 55
Step: 543154/1000000 | Episode: 3050 | Epsilon: 0.010 | FPS: 55
Step: 545098/1000000 | Episode: 3060 | Epsilon: 0.010 | FPS: 55
Step: 546925/1000000 | Episode: 3070 | Epsilon: 0.010 | FPS: 55
Step: 548683/1000000 | Episode: 3080 | Epsilon: 0.010 | FPS: 55

============================================================
Evaluating at step 550000/1000000 (55.0%)
Elapsed: 2h 46m 6s | ETA: 2h 15m 54s | Speed: 55.2 steps/s
Eval - Mean Reward: 3.65 ± 0.97, Mean Length: 177
Achievements unlocked: 8/22
============================================================

Step: 550425/1000000 | Episode: 3090 | Epsilon: 0.010 | FPS: 55
Step: 552088/1000000 | Episode: 3100 | Epsilon: 0.010 | FPS: 55
Step: 553968/1000000 | Episode: 3110 | Epsilon: 0.010 | FPS: 55
Step: 555622/1000000 | Episode: 3120 | Epsilon: 0.010 | FPS: 55
Step: 557321/1000000 | Episode: 3130 | Epsilon: 0.010 | FPS: 55
Step: 559069/1000000 | Episode: 3140 | Epsilon: 0.010 | FPS: 55
Step: 560848/1000000 | Episode: 3150 | Epsilon: 0.010 | FPS: 55
Step: 562688/1000000 | Episode: 3160 | Epsilon: 0.010 | FPS: 55
Step: 564472/1000000 | Episode: 3170 | Epsilon: 0.010 | FPS: 55
Step: 566238/1000000 | Episode: 3180 | Epsilon: 0.010 | FPS: 55
Step: 568267/1000000 | Episode: 3190 | Epsilon: 0.010 | FPS: 55
Step: 570280/1000000 | Episode: 3200 | Epsilon: 0.010 | FPS: 55
Step: 572078/1000000 | Episode: 3210 | Epsilon: 0.010 | FPS: 55
Step: 574203/1000000 | Episode: 3220 | Epsilon: 0.010 | FPS: 55
Step: 576108/1000000 | Episode: 3230 | Epsilon: 0.010 | FPS: 55
Step: 577878/1000000 | Episode: 3240 | Epsilon: 0.010 | FPS: 55
Step: 579634/1000000 | Episode: 3250 | Epsilon: 0.010 | FPS: 55
Step: 581320/1000000 | Episode: 3260 | Epsilon: 0.010 | FPS: 55
Step: 583204/1000000 | Episode: 3270 | Epsilon: 0.010 | FPS: 55
Step: 585129/1000000 | Episode: 3280 | Epsilon: 0.010 | FPS: 55
Step: 587385/1000000 | Episode: 3290 | Epsilon: 0.010 | FPS: 55
Step: 589269/1000000 | Episode: 3300 | Epsilon: 0.010 | FPS: 55
Step: 591149/1000000 | Episode: 3310 | Epsilon: 0.010 | FPS: 55
Step: 592859/1000000 | Episode: 3320 | Epsilon: 0.010 | FPS: 55
Step: 594707/1000000 | Episode: 3330 | Epsilon: 0.010 | FPS: 55
Step: 596479/1000000 | Episode: 3340 | Epsilon: 0.010 | FPS: 55
Step: 598266/1000000 | Episode: 3350 | Epsilon: 0.010 | FPS: 55

============================================================
Evaluating at step 600000/1000000 (60.0%)
Elapsed: 3h 0m 46s | ETA: 2h 0m 31s | Speed: 55.3 steps/s
Eval - Mean Reward: 4.15 ± 1.16, Mean Length: 175
Achievements unlocked: 8/22
============================================================

[CHECKPOINT] Saved to logdir/dqn-nstep5/1/checkpoint_600000.pt
[CHECKPOINT] Total elapsed: 3h 1m 30s | Since last checkpoint: 29m 22s
Step: 600387/1000000 | Episode: 3360 | Epsilon: 0.010 | FPS: 55
Step: 601870/1000000 | Episode: 3370 | Epsilon: 0.010 | FPS: 55
Step: 603825/1000000 | Episode: 3380 | Epsilon: 0.010 | FPS: 55
Step: 605714/1000000 | Episode: 3390 | Epsilon: 0.010 | FPS: 55
Step: 607307/1000000 | Episode: 3400 | Epsilon: 0.010 | FPS: 55
Step: 608827/1000000 | Episode: 3410 | Epsilon: 0.010 | FPS: 55
Step: 610514/1000000 | Episode: 3420 | Epsilon: 0.010 | FPS: 55
Step: 612238/1000000 | Episode: 3430 | Epsilon: 0.010 | FPS: 55
Step: 613932/1000000 | Episode: 3440 | Epsilon: 0.010 | FPS: 55
Step: 615725/1000000 | Episode: 3450 | Epsilon: 0.010 | FPS: 55
Step: 617753/1000000 | Episode: 3460 | Epsilon: 0.010 | FPS: 55
Step: 619344/1000000 | Episode: 3470 | Epsilon: 0.010 | FPS: 55
Step: 621103/1000000 | Episode: 3480 | Epsilon: 0.010 | FPS: 55
Step: 623061/1000000 | Episode: 3490 | Epsilon: 0.010 | FPS: 55
Step: 625100/1000000 | Episode: 3500 | Epsilon: 0.010 | FPS: 55
Step: 627006/1000000 | Episode: 3510 | Epsilon: 0.010 | FPS: 55
Step: 628851/1000000 | Episode: 3520 | Epsilon: 0.010 | FPS: 55
Step: 630909/1000000 | Episode: 3530 | Epsilon: 0.010 | FPS: 55
Step: 633084/1000000 | Episode: 3540 | Epsilon: 0.010 | FPS: 55
Step: 634695/1000000 | Episode: 3550 | Epsilon: 0.010 | FPS: 55
Step: 636488/1000000 | Episode: 3560 | Epsilon: 0.010 | FPS: 55
Step: 638601/1000000 | Episode: 3570 | Epsilon: 0.010 | FPS: 55
Step: 640193/1000000 | Episode: 3580 | Epsilon: 0.010 | FPS: 55
Step: 642014/1000000 | Episode: 3590 | Epsilon: 0.010 | FPS: 55
Step: 643670/1000000 | Episode: 3600 | Epsilon: 0.010 | FPS: 55
Step: 645391/1000000 | Episode: 3610 | Epsilon: 0.010 | FPS: 55
Step: 647310/1000000 | Episode: 3620 | Epsilon: 0.010 | FPS: 55
Step: 648998/1000000 | Episode: 3630 | Epsilon: 0.010 | FPS: 55

============================================================
Evaluating at step 650000/1000000 (65.0%)
Elapsed: 3h 15m 20s | ETA: 1h 45m 11s | Speed: 55.5 steps/s
Eval - Mean Reward: 4.15 ± 0.92, Mean Length: 172
Achievements unlocked: 9/22
============================================================

Step: 650759/1000000 | Episode: 3640 | Epsilon: 0.010 | FPS: 55
Step: 652575/1000000 | Episode: 3650 | Epsilon: 0.010 | FPS: 55
Step: 654507/1000000 | Episode: 3660 | Epsilon: 0.010 | FPS: 55
Step: 656077/1000000 | Episode: 3670 | Epsilon: 0.010 | FPS: 55
Step: 657809/1000000 | Episode: 3680 | Epsilon: 0.010 | FPS: 55
Step: 659541/1000000 | Episode: 3690 | Epsilon: 0.010 | FPS: 55
Step: 661171/1000000 | Episode: 3700 | Epsilon: 0.010 | FPS: 55
Step: 662943/1000000 | Episode: 3710 | Epsilon: 0.010 | FPS: 55
Step: 664755/1000000 | Episode: 3720 | Epsilon: 0.010 | FPS: 55
Step: 666346/1000000 | Episode: 3730 | Epsilon: 0.010 | FPS: 55
Step: 667957/1000000 | Episode: 3740 | Epsilon: 0.010 | FPS: 55
Step: 669708/1000000 | Episode: 3750 | Epsilon: 0.010 | FPS: 55
Step: 671288/1000000 | Episode: 3760 | Epsilon: 0.010 | FPS: 55
Step: 672894/1000000 | Episode: 3770 | Epsilon: 0.010 | FPS: 55
Step: 674766/1000000 | Episode: 3780 | Epsilon: 0.010 | FPS: 55
Step: 676578/1000000 | Episode: 3790 | Epsilon: 0.010 | FPS: 55
Step: 678280/1000000 | Episode: 3800 | Epsilon: 0.010 | FPS: 55
Step: 680109/1000000 | Episode: 3810 | Epsilon: 0.010 | FPS: 55
Step: 681503/1000000 | Episode: 3820 | Epsilon: 0.010 | FPS: 55
Step: 683366/1000000 | Episode: 3830 | Epsilon: 0.010 | FPS: 55
Step: 685169/1000000 | Episode: 3840 | Epsilon: 0.010 | FPS: 55
Step: 686723/1000000 | Episode: 3850 | Epsilon: 0.010 | FPS: 55
Step: 688316/1000000 | Episode: 3860 | Epsilon: 0.010 | FPS: 56
Step: 689881/1000000 | Episode: 3870 | Epsilon: 0.010 | FPS: 56
Step: 691584/1000000 | Episode: 3880 | Epsilon: 0.010 | FPS: 56
Step: 693146/1000000 | Episode: 3890 | Epsilon: 0.010 | FPS: 55
Step: 694868/1000000 | Episode: 3900 | Epsilon: 0.010 | FPS: 55
Step: 696622/1000000 | Episode: 3910 | Epsilon: 0.010 | FPS: 55
Step: 698568/1000000 | Episode: 3920 | Epsilon: 0.010 | FPS: 55

============================================================
Evaluating at step 700000/1000000 (70.0%)
Elapsed: 3h 30m 9s | ETA: 1h 30m 3s | Speed: 55.5 steps/s
Eval - Mean Reward: 4.30 ± 0.81, Mean Length: 188
Achievements unlocked: 9/22
============================================================

[CHECKPOINT] Saved to logdir/dqn-nstep5/1/checkpoint_700000.pt
[CHECKPOINT] Total elapsed: 3h 30m 52s | Since last checkpoint: 29m 22s
Step: 700310/1000000 | Episode: 3930 | Epsilon: 0.010 | FPS: 55
Step: 701920/1000000 | Episode: 3940 | Epsilon: 0.010 | FPS: 55
Step: 703509/1000000 | Episode: 3950 | Epsilon: 0.010 | FPS: 55
Step: 705035/1000000 | Episode: 3960 | Epsilon: 0.010 | FPS: 55
Step: 707108/1000000 | Episode: 3970 | Epsilon: 0.010 | FPS: 55
Step: 709117/1000000 | Episode: 3980 | Epsilon: 0.010 | FPS: 55
Step: 710858/1000000 | Episode: 3990 | Epsilon: 0.010 | FPS: 55
Step: 712621/1000000 | Episode: 4000 | Epsilon: 0.010 | FPS: 55
Step: 714347/1000000 | Episode: 4010 | Epsilon: 0.010 | FPS: 55
Step: 716546/1000000 | Episode: 4020 | Epsilon: 0.010 | FPS: 55
Step: 718438/1000000 | Episode: 4030 | Epsilon: 0.010 | FPS: 55
Step: 720179/1000000 | Episode: 4040 | Epsilon: 0.010 | FPS: 55
Step: 722066/1000000 | Episode: 4050 | Epsilon: 0.010 | FPS: 55
Step: 723590/1000000 | Episode: 4060 | Epsilon: 0.010 | FPS: 55
Step: 725509/1000000 | Episode: 4070 | Epsilon: 0.010 | FPS: 55
Step: 727187/1000000 | Episode: 4080 | Epsilon: 0.010 | FPS: 55
Step: 729017/1000000 | Episode: 4090 | Epsilon: 0.010 | FPS: 55
Step: 730540/1000000 | Episode: 4100 | Epsilon: 0.010 | FPS: 55
Step: 732425/1000000 | Episode: 4110 | Epsilon: 0.010 | FPS: 55
Step: 734099/1000000 | Episode: 4120 | Epsilon: 0.010 | FPS: 55
Step: 735832/1000000 | Episode: 4130 | Epsilon: 0.010 | FPS: 56
Step: 737644/1000000 | Episode: 4140 | Epsilon: 0.010 | FPS: 56
Step: 739445/1000000 | Episode: 4150 | Epsilon: 0.010 | FPS: 56
Step: 741259/1000000 | Episode: 4160 | Epsilon: 0.010 | FPS: 56
Step: 743332/1000000 | Episode: 4170 | Epsilon: 0.010 | FPS: 56
Step: 745150/1000000 | Episode: 4180 | Epsilon: 0.010 | FPS: 56
Step: 746887/1000000 | Episode: 4190 | Epsilon: 0.010 | FPS: 56
Step: 748675/1000000 | Episode: 4200 | Epsilon: 0.010 | FPS: 56

============================================================
Evaluating at step 750000/1000000 (75.0%)
Elapsed: 3h 44m 33s | ETA: 1h 14m 51s | Speed: 55.7 steps/s
Eval - Mean Reward: 4.10 ± 0.89, Mean Length: 172
Achievements unlocked: 8/22
============================================================

Step: 750661/1000000 | Episode: 4210 | Epsilon: 0.010 | FPS: 55
Step: 752529/1000000 | Episode: 4220 | Epsilon: 0.010 | FPS: 56
Step: 754104/1000000 | Episode: 4230 | Epsilon: 0.010 | FPS: 56
Step: 755806/1000000 | Episode: 4240 | Epsilon: 0.010 | FPS: 56
Step: 757551/1000000 | Episode: 4250 | Epsilon: 0.010 | FPS: 56
Step: 759383/1000000 | Episode: 4260 | Epsilon: 0.010 | FPS: 56
Step: 761197/1000000 | Episode: 4270 | Epsilon: 0.010 | FPS: 56
Step: 763237/1000000 | Episode: 4280 | Epsilon: 0.010 | FPS: 56
Step: 765136/1000000 | Episode: 4290 | Epsilon: 0.010 | FPS: 56
Step: 767198/1000000 | Episode: 4300 | Epsilon: 0.010 | FPS: 56
Step: 769069/1000000 | Episode: 4310 | Epsilon: 0.010 | FPS: 56
Step: 770877/1000000 | Episode: 4320 | Epsilon: 0.010 | FPS: 56
Step: 772645/1000000 | Episode: 4330 | Epsilon: 0.010 | FPS: 56
Step: 774568/1000000 | Episode: 4340 | Epsilon: 0.010 | FPS: 56
Step: 776452/1000000 | Episode: 4350 | Epsilon: 0.010 | FPS: 56
Step: 778260/1000000 | Episode: 4360 | Epsilon: 0.010 | FPS: 56
Step: 780303/1000000 | Episode: 4370 | Epsilon: 0.010 | FPS: 56
Step: 781883/1000000 | Episode: 4380 | Epsilon: 0.010 | FPS: 56
Step: 783714/1000000 | Episode: 4390 | Epsilon: 0.010 | FPS: 56
Step: 785620/1000000 | Episode: 4400 | Epsilon: 0.010 | FPS: 56
Step: 787667/1000000 | Episode: 4410 | Epsilon: 0.010 | FPS: 56
Step: 789528/1000000 | Episode: 4420 | Epsilon: 0.010 | FPS: 56
Step: 790993/1000000 | Episode: 4430 | Epsilon: 0.010 | FPS: 56
Step: 792886/1000000 | Episode: 4440 | Epsilon: 0.010 | FPS: 56
Step: 794428/1000000 | Episode: 4450 | Epsilon: 0.010 | FPS: 56
Step: 796352/1000000 | Episode: 4460 | Epsilon: 0.010 | FPS: 56
Step: 798019/1000000 | Episode: 4470 | Epsilon: 0.010 | FPS: 56
Step: 799972/1000000 | Episode: 4480 | Epsilon: 0.010 | FPS: 56

============================================================
Evaluating at step 800000/1000000 (80.0%)
Elapsed: 3h 58m 42s | ETA: 59m 40s | Speed: 55.9 steps/s
Eval - Mean Reward: 4.00 ± 1.09, Mean Length: 158
Achievements unlocked: 8/22
============================================================

[CHECKPOINT] Saved to logdir/dqn-nstep5/1/checkpoint_800000.pt
[CHECKPOINT] Total elapsed: 3h 59m 25s | Since last checkpoint: 28m 32s
Step: 801583/1000000 | Episode: 4490 | Epsilon: 0.010 | FPS: 56
Step: 803499/1000000 | Episode: 4500 | Epsilon: 0.010 | FPS: 56
Step: 805121/1000000 | Episode: 4510 | Epsilon: 0.010 | FPS: 56
Step: 806781/1000000 | Episode: 4520 | Epsilon: 0.010 | FPS: 56
Step: 808666/1000000 | Episode: 4530 | Epsilon: 0.010 | FPS: 56
Step: 810408/1000000 | Episode: 4540 | Epsilon: 0.010 | FPS: 56
Step: 812009/1000000 | Episode: 4550 | Epsilon: 0.010 | FPS: 56
Step: 813740/1000000 | Episode: 4560 | Epsilon: 0.010 | FPS: 56
Step: 815471/1000000 | Episode: 4570 | Epsilon: 0.010 | FPS: 56
Step: 817182/1000000 | Episode: 4580 | Epsilon: 0.010 | FPS: 56
Step: 819150/1000000 | Episode: 4590 | Epsilon: 0.010 | FPS: 56
Step: 820707/1000000 | Episode: 4600 | Epsilon: 0.010 | FPS: 56
Step: 822622/1000000 | Episode: 4610 | Epsilon: 0.010 | FPS: 56
Step: 824532/1000000 | Episode: 4620 | Epsilon: 0.010 | FPS: 56
Step: 826143/1000000 | Episode: 4630 | Epsilon: 0.010 | FPS: 56
Step: 828039/1000000 | Episode: 4640 | Epsilon: 0.010 | FPS: 56
Step: 829934/1000000 | Episode: 4650 | Epsilon: 0.010 | FPS: 56
Step: 831762/1000000 | Episode: 4660 | Epsilon: 0.010 | FPS: 56
Step: 833286/1000000 | Episode: 4670 | Epsilon: 0.010 | FPS: 56
Step: 835035/1000000 | Episode: 4680 | Epsilon: 0.010 | FPS: 56
Step: 836985/1000000 | Episode: 4690 | Epsilon: 0.010 | FPS: 56
Step: 838865/1000000 | Episode: 4700 | Epsilon: 0.010 | FPS: 56
Step: 840435/1000000 | Episode: 4710 | Epsilon: 0.010 | FPS: 56
Step: 842224/1000000 | Episode: 4720 | Epsilon: 0.010 | FPS: 56
Step: 844060/1000000 | Episode: 4730 | Epsilon: 0.010 | FPS: 56
Step: 845800/1000000 | Episode: 4740 | Epsilon: 0.010 | FPS: 56
Step: 847651/1000000 | Episode: 4750 | Epsilon: 0.010 | FPS: 56
Step: 849374/1000000 | Episode: 4760 | Epsilon: 0.010 | FPS: 56

============================================================
Evaluating at step 850000/1000000 (85.0%)
Elapsed: 4h 13m 21s | ETA: 44m 42s | Speed: 55.9 steps/s
Eval - Mean Reward: 4.45 ± 0.91, Mean Length: 190
Achievements unlocked: 9/22
============================================================

Step: 850994/1000000 | Episode: 4770 | Epsilon: 0.010 | FPS: 56
Step: 853009/1000000 | Episode: 4780 | Epsilon: 0.010 | FPS: 56
Step: 854804/1000000 | Episode: 4790 | Epsilon: 0.010 | FPS: 56
Step: 856423/1000000 | Episode: 4800 | Epsilon: 0.010 | FPS: 56
Step: 858129/1000000 | Episode: 4810 | Epsilon: 0.010 | FPS: 56
Step: 859836/1000000 | Episode: 4820 | Epsilon: 0.010 | FPS: 56
Step: 861741/1000000 | Episode: 4830 | Epsilon: 0.010 | FPS: 56
Step: 863343/1000000 | Episode: 4840 | Epsilon: 0.010 | FPS: 56
Step: 865359/1000000 | Episode: 4850 | Epsilon: 0.010 | FPS: 56
Step: 867132/1000000 | Episode: 4860 | Epsilon: 0.010 | FPS: 56
Step: 868902/1000000 | Episode: 4870 | Epsilon: 0.010 | FPS: 56
Step: 870499/1000000 | Episode: 4880 | Epsilon: 0.010 | FPS: 56
Step: 872130/1000000 | Episode: 4890 | Epsilon: 0.010 | FPS: 56
Step: 874174/1000000 | Episode: 4900 | Epsilon: 0.010 | FPS: 56
Step: 875944/1000000 | Episode: 4910 | Epsilon: 0.010 | FPS: 56
Step: 877648/1000000 | Episode: 4920 | Epsilon: 0.010 | FPS: 56
Step: 879366/1000000 | Episode: 4930 | Epsilon: 0.010 | FPS: 56
Step: 881049/1000000 | Episode: 4940 | Epsilon: 0.010 | FPS: 56
Step: 882868/1000000 | Episode: 4950 | Epsilon: 0.010 | FPS: 56
Step: 884460/1000000 | Episode: 4960 | Epsilon: 0.010 | FPS: 56
Step: 886506/1000000 | Episode: 4970 | Epsilon: 0.010 | FPS: 56
Step: 888433/1000000 | Episode: 4980 | Epsilon: 0.010 | FPS: 56
Step: 890035/1000000 | Episode: 4990 | Epsilon: 0.010 | FPS: 56
Step: 891707/1000000 | Episode: 5000 | Epsilon: 0.010 | FPS: 56
Step: 893299/1000000 | Episode: 5010 | Epsilon: 0.010 | FPS: 56
Step: 895339/1000000 | Episode: 5020 | Epsilon: 0.010 | FPS: 56
Step: 897133/1000000 | Episode: 5030 | Epsilon: 0.010 | FPS: 56
Step: 899105/1000000 | Episode: 5040 | Epsilon: 0.010 | FPS: 56

============================================================
Evaluating at step 900000/1000000 (90.0%)
Elapsed: 4h 28m 16s | ETA: 29m 48s | Speed: 55.9 steps/s
Eval - Mean Reward: 4.00 ± 1.04, Mean Length: 189
Achievements unlocked: 8/22
============================================================

[CHECKPOINT] Saved to logdir/dqn-nstep5/1/checkpoint_900000.pt
[CHECKPOINT] Total elapsed: 4h 29m 5s | Since last checkpoint: 29m 39s
Step: 900874/1000000 | Episode: 5050 | Epsilon: 0.010 | FPS: 56
Step: 902847/1000000 | Episode: 5060 | Epsilon: 0.010 | FPS: 56
Step: 904997/1000000 | Episode: 5070 | Epsilon: 0.010 | FPS: 56
Step: 906589/1000000 | Episode: 5080 | Epsilon: 0.010 | FPS: 56
Step: 908250/1000000 | Episode: 5090 | Epsilon: 0.010 | FPS: 56
Step: 909900/1000000 | Episode: 5100 | Epsilon: 0.010 | FPS: 56
Step: 911592/1000000 | Episode: 5110 | Epsilon: 0.010 | FPS: 56
Step: 913495/1000000 | Episode: 5120 | Epsilon: 0.010 | FPS: 56
Step: 915102/1000000 | Episode: 5130 | Epsilon: 0.010 | FPS: 56
Step: 916572/1000000 | Episode: 5140 | Epsilon: 0.010 | FPS: 56
Step: 918470/1000000 | Episode: 5150 | Epsilon: 0.010 | FPS: 56
Step: 920206/1000000 | Episode: 5160 | Epsilon: 0.010 | FPS: 56
Step: 921923/1000000 | Episode: 5170 | Epsilon: 0.010 | FPS: 56
Step: 923613/1000000 | Episode: 5180 | Epsilon: 0.010 | FPS: 56
Step: 925578/1000000 | Episode: 5190 | Epsilon: 0.010 | FPS: 56
Step: 927350/1000000 | Episode: 5200 | Epsilon: 0.010 | FPS: 56
Step: 929318/1000000 | Episode: 5210 | Epsilon: 0.010 | FPS: 56
Step: 931010/1000000 | Episode: 5220 | Epsilon: 0.010 | FPS: 56
Step: 932749/1000000 | Episode: 5230 | Epsilon: 0.010 | FPS: 56
Step: 934881/1000000 | Episode: 5240 | Epsilon: 0.010 | FPS: 56
Step: 936808/1000000 | Episode: 5250 | Epsilon: 0.010 | FPS: 56
Step: 938692/1000000 | Episode: 5260 | Epsilon: 0.010 | FPS: 56
Step: 940397/1000000 | Episode: 5270 | Epsilon: 0.010 | FPS: 56
Step: 941989/1000000 | Episode: 5280 | Epsilon: 0.010 | FPS: 56
Step: 943893/1000000 | Episode: 5290 | Epsilon: 0.010 | FPS: 56
Step: 945954/1000000 | Episode: 5300 | Epsilon: 0.010 | FPS: 56
Step: 947606/1000000 | Episode: 5310 | Epsilon: 0.010 | FPS: 56
Step: 949438/1000000 | Episode: 5320 | Epsilon: 0.010 | FPS: 56

============================================================
Evaluating at step 950000/1000000 (95.0%)
Elapsed: 4h 44m 9s | ETA: 14m 57s | Speed: 55.7 steps/s
Eval - Mean Reward: 4.10 ± 1.34, Mean Length: 180
Achievements unlocked: 9/22
============================================================

Step: 951265/1000000 | Episode: 5330 | Epsilon: 0.010 | FPS: 56
Step: 952951/1000000 | Episode: 5340 | Epsilon: 0.010 | FPS: 56
Step: 955022/1000000 | Episode: 5350 | Epsilon: 0.010 | FPS: 56
Step: 956330/1000000 | Episode: 5360 | Epsilon: 0.010 | FPS: 56
Step: 958008/1000000 | Episode: 5370 | Epsilon: 0.010 | FPS: 56
Step: 959502/1000000 | Episode: 5380 | Epsilon: 0.010 | FPS: 56
Step: 961167/1000000 | Episode: 5390 | Epsilon: 0.010 | FPS: 56
Step: 963138/1000000 | Episode: 5400 | Epsilon: 0.010 | FPS: 56
Step: 965034/1000000 | Episode: 5410 | Epsilon: 0.010 | FPS: 56
Step: 966647/1000000 | Episode: 5420 | Epsilon: 0.010 | FPS: 56
Step: 968335/1000000 | Episode: 5430 | Epsilon: 0.010 | FPS: 56
Step: 970162/1000000 | Episode: 5440 | Epsilon: 0.010 | FPS: 56
Step: 971926/1000000 | Episode: 5450 | Epsilon: 0.010 | FPS: 56
Step: 973672/1000000 | Episode: 5460 | Epsilon: 0.010 | FPS: 56
Step: 975632/1000000 | Episode: 5470 | Epsilon: 0.010 | FPS: 56
Step: 977370/1000000 | Episode: 5480 | Epsilon: 0.010 | FPS: 56
Step: 979277/1000000 | Episode: 5490 | Epsilon: 0.010 | FPS: 56
Step: 980869/1000000 | Episode: 5500 | Epsilon: 0.010 | FPS: 56
Step: 982469/1000000 | Episode: 5510 | Epsilon: 0.010 | FPS: 56
Step: 984252/1000000 | Episode: 5520 | Epsilon: 0.010 | FPS: 56
Step: 985939/1000000 | Episode: 5530 | Epsilon: 0.010 | FPS: 56
Step: 987411/1000000 | Episode: 5540 | Epsilon: 0.010 | FPS: 56
Step: 988813/1000000 | Episode: 5550 | Epsilon: 0.010 | FPS: 56
Step: 990929/1000000 | Episode: 5560 | Epsilon: 0.010 | FPS: 56
Step: 992648/1000000 | Episode: 5570 | Epsilon: 0.010 | FPS: 56
Step: 994425/1000000 | Episode: 5580 | Epsilon: 0.010 | FPS: 56
Step: 996269/1000000 | Episode: 5590 | Epsilon: 0.010 | FPS: 56
Step: 998219/1000000 | Episode: 5600 | Epsilon: 0.010 | FPS: 56

============================================================
Evaluating at step 1000000/1000000 (100.0%)
Elapsed: 4h 59m 7s | ETA: 0s | Speed: 55.7 steps/s
Eval - Mean Reward: 4.05 ± 0.97, Mean Length: 194
Achievements unlocked: 8/22
============================================================

[CHECKPOINT] Saved to logdir/dqn-nstep5/1/checkpoint_1000000.pt
[CHECKPOINT] Total elapsed: 4h 59m 59s | Since last checkpoint: 30m 54s

============================================================
FINAL EVALUATION
Total training time: 5h 0m 1s
============================================================
Final Mean Reward: 4.10 ± 0.89
Final Achievements: 8/22

Final Achievement Success Rates:
  place_plant: 100.0%
  collect_sapling: 100.0%
  wake_up: 95.0%
  collect_wood: 90.0%
  place_table: 55.0%
  defeat_zombie: 35.0%
  collect_drink: 15.0%
  eat_cow: 10.0%

Saved final model to logdir/dqn-nstep5/1/final_model.pt
Metrics saved to logdir/dqn-nstep5/1/metrics.json
Metadata saved to logdir/dqn-nstep5/1/metadata.json
============================================================
TRAINING COMPLETE!
============================================================

Final Training Statistics:
  Training Time: 5h 0m 1s
  Final Eval Reward: 4.05 ± 0.97
  Best Eval Reward: 4.45
  Total Episodes: 5609
  Final Loss: 0.0105
  Final Epsilon: 0.0100
============================================================
