======================================================================
Experiment: training_run
======================================================================

Start Time: 2025-11-10T03:28:37.787342

Git Info:
  Commit: 2950c37 (test-1)
  WARNING: Uncommitted changes present!

System Info:
  Hostname: dr1-v100s-1
  Platform: Linux-6.8.0-87-generic-x86_64-with-glibc2.39
  CPU Count: 15

GPU Info:
  GPU 0: Tesla V100S-PCIE-32GB
    Memory: 32768 MiB
    Driver: 580.95.05

Package Versions:
  PyTorch: 2.9.0+cu128
  CUDA: 12.8
  NumPy: 2.3.4
  Crafter: unknown

Experiment Arguments:
  batch_size: 32
  buffer_size: 100000
  device: cuda
  double_dqn: True
  dueling: True
  env_name: crafter
  epsilon_decay_steps: 50000
  epsilon_end: 0.01
  epsilon_start: 1.0
  eval_episodes: 20
  eval_interval: 50000
  gamma: 0.99
  grad_clip: 10.0
  hidden_size: 512
  logdir: logdir/dqn-nstep5/2
  lr: 0.0001
  munchausen: False
  munchausen_alpha: 0.9
  munchausen_tau: 0.03
  n_step: 5
  resume: None
  save_freq: 100000
  seed: 2
  steps: 1000000
  target_update_freq: 2500
  training_starts: 5000
  update_freq: 4
======================================================================

Step: 1596/1000000 | Episode: 10 | Epsilon: 0.968 | FPS: 85
Step: 3369/1000000 | Episode: 20 | Epsilon: 0.933 | FPS: 91
Step: 5265/1000000 | Episode: 30 | Epsilon: 0.896 | FPS: 91
Step: 6959/1000000 | Episode: 40 | Epsilon: 0.862 | FPS: 83
Step: 8770/1000000 | Episode: 50 | Epsilon: 0.826 | FPS: 79
Step: 10480/1000000 | Episode: 60 | Epsilon: 0.792 | FPS: 77
Step: 11925/1000000 | Episode: 70 | Epsilon: 0.764 | FPS: 71
Step: 13552/1000000 | Episode: 80 | Epsilon: 0.732 | FPS: 70
Step: 14950/1000000 | Episode: 90 | Epsilon: 0.704 | FPS: 69
Step: 16705/1000000 | Episode: 100 | Epsilon: 0.669 | FPS: 69
Step: 18183/1000000 | Episode: 110 | Epsilon: 0.640 | FPS: 68
Step: 20061/1000000 | Episode: 120 | Epsilon: 0.603 | FPS: 68
Step: 21595/1000000 | Episode: 130 | Epsilon: 0.572 | FPS: 68
Step: 23131/1000000 | Episode: 140 | Epsilon: 0.542 | FPS: 68
Step: 24777/1000000 | Episode: 150 | Epsilon: 0.509 | FPS: 67
Step: 26535/1000000 | Episode: 160 | Epsilon: 0.475 | FPS: 65
Step: 28068/1000000 | Episode: 170 | Epsilon: 0.444 | FPS: 64
Step: 29867/1000000 | Episode: 180 | Epsilon: 0.409 | FPS: 64
Step: 31629/1000000 | Episode: 190 | Epsilon: 0.374 | FPS: 62
Step: 33379/1000000 | Episode: 200 | Epsilon: 0.339 | FPS: 62
Step: 35001/1000000 | Episode: 210 | Epsilon: 0.307 | FPS: 62
Step: 37002/1000000 | Episode: 220 | Epsilon: 0.267 | FPS: 62
Step: 38516/1000000 | Episode: 230 | Epsilon: 0.237 | FPS: 62
Step: 40032/1000000 | Episode: 240 | Epsilon: 0.207 | FPS: 61
Step: 41868/1000000 | Episode: 250 | Epsilon: 0.171 | FPS: 61
Step: 43592/1000000 | Episode: 260 | Epsilon: 0.137 | FPS: 61
Step: 45551/1000000 | Episode: 270 | Epsilon: 0.098 | FPS: 61
Step: 47812/1000000 | Episode: 280 | Epsilon: 0.053 | FPS: 62
Step: 49704/1000000 | Episode: 290 | Epsilon: 0.016 | FPS: 62

============================================================
Evaluating at step 50000/1000000 (5.0%)
Elapsed: 13m 29s | ETA: 4h 16m 18s | Speed: 61.8 steps/s
Eval - Mean Reward: 2.70 ± 0.66, Mean Length: 187
Achievements unlocked: 6/22
============================================================

Step: 51382/1000000 | Episode: 300 | Epsilon: 0.010 | FPS: 59
Step: 52915/1000000 | Episode: 310 | Epsilon: 0.010 | FPS: 59
Step: 54774/1000000 | Episode: 320 | Epsilon: 0.010 | FPS: 59
Step: 56565/1000000 | Episode: 330 | Epsilon: 0.010 | FPS: 59
Step: 58321/1000000 | Episode: 340 | Epsilon: 0.010 | FPS: 58
Step: 59974/1000000 | Episode: 350 | Epsilon: 0.010 | FPS: 58
Step: 61747/1000000 | Episode: 360 | Epsilon: 0.010 | FPS: 58
Step: 63079/1000000 | Episode: 370 | Epsilon: 0.010 | FPS: 58
Step: 64744/1000000 | Episode: 380 | Epsilon: 0.010 | FPS: 58
Step: 66668/1000000 | Episode: 390 | Epsilon: 0.010 | FPS: 58
Step: 68148/1000000 | Episode: 400 | Epsilon: 0.010 | FPS: 58
Step: 69742/1000000 | Episode: 410 | Epsilon: 0.010 | FPS: 58
Step: 71540/1000000 | Episode: 420 | Epsilon: 0.010 | FPS: 58
Step: 73521/1000000 | Episode: 430 | Epsilon: 0.010 | FPS: 58
Step: 75332/1000000 | Episode: 440 | Epsilon: 0.010 | FPS: 58
Step: 77112/1000000 | Episode: 450 | Epsilon: 0.010 | FPS: 58
Step: 78913/1000000 | Episode: 460 | Epsilon: 0.010 | FPS: 58
Step: 80578/1000000 | Episode: 470 | Epsilon: 0.010 | FPS: 57
Step: 82294/1000000 | Episode: 480 | Epsilon: 0.010 | FPS: 57
Step: 83821/1000000 | Episode: 490 | Epsilon: 0.010 | FPS: 57
Step: 85526/1000000 | Episode: 500 | Epsilon: 0.010 | FPS: 57
Step: 87391/1000000 | Episode: 510 | Epsilon: 0.010 | FPS: 57
Step: 89224/1000000 | Episode: 520 | Epsilon: 0.010 | FPS: 57
Step: 91016/1000000 | Episode: 530 | Epsilon: 0.010 | FPS: 57
Step: 93071/1000000 | Episode: 540 | Epsilon: 0.010 | FPS: 57
Step: 94816/1000000 | Episode: 550 | Epsilon: 0.010 | FPS: 57
Step: 96476/1000000 | Episode: 560 | Epsilon: 0.010 | FPS: 57
Step: 98487/1000000 | Episode: 570 | Epsilon: 0.010 | FPS: 57

============================================================
Evaluating at step 100000/1000000 (10.0%)
Elapsed: 29m 29s | ETA: 4h 25m 22s | Speed: 56.5 steps/s
Eval - Mean Reward: 2.90 ± 0.87, Mean Length: 160
Achievements unlocked: 6/22
============================================================

[CHECKPOINT] Saved to logdir/dqn-nstep5/2/checkpoint_100000.pt
[CHECKPOINT] Total elapsed: 30m 10s | Since last checkpoint: 30m 10s
Step: 100087/1000000 | Episode: 580 | Epsilon: 0.010 | FPS: 55
Step: 101930/1000000 | Episode: 590 | Epsilon: 0.010 | FPS: 55
Step: 103767/1000000 | Episode: 600 | Epsilon: 0.010 | FPS: 55
Step: 105239/1000000 | Episode: 610 | Epsilon: 0.010 | FPS: 55
Step: 106877/1000000 | Episode: 620 | Epsilon: 0.010 | FPS: 55
Step: 108804/1000000 | Episode: 630 | Epsilon: 0.010 | FPS: 55
Step: 110624/1000000 | Episode: 640 | Epsilon: 0.010 | FPS: 55
Step: 112419/1000000 | Episode: 650 | Epsilon: 0.010 | FPS: 55
Step: 114072/1000000 | Episode: 660 | Epsilon: 0.010 | FPS: 55
Step: 115947/1000000 | Episode: 670 | Epsilon: 0.010 | FPS: 56
Step: 117608/1000000 | Episode: 680 | Epsilon: 0.010 | FPS: 55
Step: 119730/1000000 | Episode: 690 | Epsilon: 0.010 | FPS: 56
Step: 121139/1000000 | Episode: 700 | Epsilon: 0.010 | FPS: 56
Step: 122780/1000000 | Episode: 710 | Epsilon: 0.010 | FPS: 56
Step: 124670/1000000 | Episode: 720 | Epsilon: 0.010 | FPS: 56
Step: 126304/1000000 | Episode: 730 | Epsilon: 0.010 | FPS: 56
Step: 127935/1000000 | Episode: 740 | Epsilon: 0.010 | FPS: 56
Step: 129666/1000000 | Episode: 750 | Epsilon: 0.010 | FPS: 56
Step: 131416/1000000 | Episode: 760 | Epsilon: 0.010 | FPS: 56
Step: 132929/1000000 | Episode: 770 | Epsilon: 0.010 | FPS: 56
Step: 135148/1000000 | Episode: 780 | Epsilon: 0.010 | FPS: 56
Step: 136801/1000000 | Episode: 790 | Epsilon: 0.010 | FPS: 56
Step: 138488/1000000 | Episode: 800 | Epsilon: 0.010 | FPS: 56
Step: 140642/1000000 | Episode: 810 | Epsilon: 0.010 | FPS: 56
Step: 142507/1000000 | Episode: 820 | Epsilon: 0.010 | FPS: 56
Step: 144190/1000000 | Episode: 830 | Epsilon: 0.010 | FPS: 56
Step: 146101/1000000 | Episode: 840 | Epsilon: 0.010 | FPS: 55
Step: 147844/1000000 | Episode: 850 | Epsilon: 0.010 | FPS: 55
Step: 149621/1000000 | Episode: 860 | Epsilon: 0.010 | FPS: 55

============================================================
Evaluating at step 150000/1000000 (15.0%)
Elapsed: 45m 31s | ETA: 4h 17m 58s | Speed: 54.9 steps/s
Eval - Mean Reward: 3.60 ± 0.97, Mean Length: 170
Achievements unlocked: 7/22
============================================================

Step: 151603/1000000 | Episode: 870 | Epsilon: 0.010 | FPS: 54
Step: 153492/1000000 | Episode: 880 | Epsilon: 0.010 | FPS: 54
Step: 155249/1000000 | Episode: 890 | Epsilon: 0.010 | FPS: 54
Step: 157194/1000000 | Episode: 900 | Epsilon: 0.010 | FPS: 54
Step: 158924/1000000 | Episode: 910 | Epsilon: 0.010 | FPS: 54
Step: 160857/1000000 | Episode: 920 | Epsilon: 0.010 | FPS: 54
Step: 162599/1000000 | Episode: 930 | Epsilon: 0.010 | FPS: 54
Step: 164311/1000000 | Episode: 940 | Epsilon: 0.010 | FPS: 54
Step: 166236/1000000 | Episode: 950 | Epsilon: 0.010 | FPS: 54
Step: 167843/1000000 | Episode: 960 | Epsilon: 0.010 | FPS: 54
Step: 169629/1000000 | Episode: 970 | Epsilon: 0.010 | FPS: 54
Step: 171485/1000000 | Episode: 980 | Epsilon: 0.010 | FPS: 55
Step: 173134/1000000 | Episode: 990 | Epsilon: 0.010 | FPS: 54
Step: 175181/1000000 | Episode: 1000 | Epsilon: 0.010 | FPS: 54
Step: 177348/1000000 | Episode: 1010 | Epsilon: 0.010 | FPS: 55
Step: 179047/1000000 | Episode: 1020 | Epsilon: 0.010 | FPS: 55
Step: 180569/1000000 | Episode: 1030 | Epsilon: 0.010 | FPS: 55
Step: 182592/1000000 | Episode: 1040 | Epsilon: 0.010 | FPS: 55
Step: 184475/1000000 | Episode: 1050 | Epsilon: 0.010 | FPS: 55
Step: 185967/1000000 | Episode: 1060 | Epsilon: 0.010 | FPS: 55
Step: 187727/1000000 | Episode: 1070 | Epsilon: 0.010 | FPS: 55
Step: 189463/1000000 | Episode: 1080 | Epsilon: 0.010 | FPS: 55
Step: 191313/1000000 | Episode: 1090 | Epsilon: 0.010 | FPS: 55
Step: 192997/1000000 | Episode: 1100 | Epsilon: 0.010 | FPS: 55
Step: 194470/1000000 | Episode: 1110 | Epsilon: 0.010 | FPS: 55
Step: 196265/1000000 | Episode: 1120 | Epsilon: 0.010 | FPS: 55
Step: 197949/1000000 | Episode: 1130 | Epsilon: 0.010 | FPS: 55
Step: 199930/1000000 | Episode: 1140 | Epsilon: 0.010 | FPS: 55

============================================================
Evaluating at step 200000/1000000 (20.0%)
Elapsed: 1h 0m 25s | ETA: 4h 1m 41s | Speed: 55.2 steps/s
Eval - Mean Reward: 3.80 ± 1.10, Mean Length: 164
Achievements unlocked: 8/22
============================================================

[CHECKPOINT] Saved to logdir/dqn-nstep5/2/checkpoint_200000.pt
[CHECKPOINT] Total elapsed: 1h 1m 12s | Since last checkpoint: 31m 1s
Step: 201797/1000000 | Episode: 1150 | Epsilon: 0.010 | FPS: 54
Step: 203848/1000000 | Episode: 1160 | Epsilon: 0.010 | FPS: 55
Step: 205406/1000000 | Episode: 1170 | Epsilon: 0.010 | FPS: 55
Step: 207003/1000000 | Episode: 1180 | Epsilon: 0.010 | FPS: 55
Step: 208634/1000000 | Episode: 1190 | Epsilon: 0.010 | FPS: 55
Step: 210473/1000000 | Episode: 1200 | Epsilon: 0.010 | FPS: 55
Step: 212463/1000000 | Episode: 1210 | Epsilon: 0.010 | FPS: 55
Step: 213927/1000000 | Episode: 1220 | Epsilon: 0.010 | FPS: 55
Step: 215728/1000000 | Episode: 1230 | Epsilon: 0.010 | FPS: 54
Step: 217682/1000000 | Episode: 1240 | Epsilon: 0.010 | FPS: 54
Step: 219300/1000000 | Episode: 1250 | Epsilon: 0.010 | FPS: 54
Step: 221181/1000000 | Episode: 1260 | Epsilon: 0.010 | FPS: 55
Step: 223032/1000000 | Episode: 1270 | Epsilon: 0.010 | FPS: 55
Step: 224705/1000000 | Episode: 1280 | Epsilon: 0.010 | FPS: 55
Step: 226522/1000000 | Episode: 1290 | Epsilon: 0.010 | FPS: 55
Step: 228291/1000000 | Episode: 1300 | Epsilon: 0.010 | FPS: 55
Step: 230265/1000000 | Episode: 1310 | Epsilon: 0.010 | FPS: 55
Step: 231877/1000000 | Episode: 1320 | Epsilon: 0.010 | FPS: 55
Step: 233502/1000000 | Episode: 1330 | Epsilon: 0.010 | FPS: 55
Step: 235360/1000000 | Episode: 1340 | Epsilon: 0.010 | FPS: 55
Step: 237251/1000000 | Episode: 1350 | Epsilon: 0.010 | FPS: 55
Step: 239020/1000000 | Episode: 1360 | Epsilon: 0.010 | FPS: 55
Step: 241020/1000000 | Episode: 1370 | Epsilon: 0.010 | FPS: 55
Step: 242840/1000000 | Episode: 1380 | Epsilon: 0.010 | FPS: 55
Step: 244668/1000000 | Episode: 1390 | Epsilon: 0.010 | FPS: 55
Step: 246263/1000000 | Episode: 1400 | Epsilon: 0.010 | FPS: 55
Step: 247907/1000000 | Episode: 1410 | Epsilon: 0.010 | FPS: 55
Step: 249493/1000000 | Episode: 1420 | Epsilon: 0.010 | FPS: 54

============================================================
Evaluating at step 250000/1000000 (25.0%)
Elapsed: 1h 16m 33s | ETA: 3h 49m 39s | Speed: 54.4 steps/s
Eval - Mean Reward: 4.35 ± 0.89, Mean Length: 181
Achievements unlocked: 9/22
============================================================

Step: 251144/1000000 | Episode: 1430 | Epsilon: 0.010 | FPS: 53
Step: 253092/1000000 | Episode: 1440 | Epsilon: 0.010 | FPS: 53
Step: 254926/1000000 | Episode: 1450 | Epsilon: 0.010 | FPS: 53
Step: 256751/1000000 | Episode: 1460 | Epsilon: 0.010 | FPS: 53
Step: 258444/1000000 | Episode: 1470 | Epsilon: 0.010 | FPS: 53
Step: 260037/1000000 | Episode: 1480 | Epsilon: 0.010 | FPS: 53
Step: 262125/1000000 | Episode: 1490 | Epsilon: 0.010 | FPS: 53
Step: 264171/1000000 | Episode: 1500 | Epsilon: 0.010 | FPS: 53
Step: 265726/1000000 | Episode: 1510 | Epsilon: 0.010 | FPS: 53
Step: 267331/1000000 | Episode: 1520 | Epsilon: 0.010 | FPS: 53
Step: 268827/1000000 | Episode: 1530 | Epsilon: 0.010 | FPS: 53
Step: 270436/1000000 | Episode: 1540 | Epsilon: 0.010 | FPS: 53
Step: 272246/1000000 | Episode: 1550 | Epsilon: 0.010 | FPS: 54
Step: 273959/1000000 | Episode: 1560 | Epsilon: 0.010 | FPS: 54
Step: 275469/1000000 | Episode: 1570 | Epsilon: 0.010 | FPS: 54
Step: 277231/1000000 | Episode: 1580 | Epsilon: 0.010 | FPS: 54
Step: 279284/1000000 | Episode: 1590 | Epsilon: 0.010 | FPS: 54
Step: 280928/1000000 | Episode: 1600 | Epsilon: 0.010 | FPS: 54
Step: 283044/1000000 | Episode: 1610 | Epsilon: 0.010 | FPS: 54
Step: 284885/1000000 | Episode: 1620 | Epsilon: 0.010 | FPS: 54
Step: 286327/1000000 | Episode: 1630 | Epsilon: 0.010 | FPS: 54
Step: 288004/1000000 | Episode: 1640 | Epsilon: 0.010 | FPS: 54
Step: 290105/1000000 | Episode: 1650 | Epsilon: 0.010 | FPS: 54
Step: 291940/1000000 | Episode: 1660 | Epsilon: 0.010 | FPS: 54
Step: 293613/1000000 | Episode: 1670 | Epsilon: 0.010 | FPS: 54
Step: 295680/1000000 | Episode: 1680 | Epsilon: 0.010 | FPS: 54
Step: 297120/1000000 | Episode: 1690 | Epsilon: 0.010 | FPS: 54
Step: 298848/1000000 | Episode: 1700 | Epsilon: 0.010 | FPS: 54

============================================================
Evaluating at step 300000/1000000 (30.0%)
Elapsed: 1h 32m 48s | ETA: 3h 36m 32s | Speed: 53.9 steps/s
Eval - Mean Reward: 4.55 ± 0.97, Mean Length: 192
Achievements unlocked: 9/22
============================================================

[CHECKPOINT] Saved to logdir/dqn-nstep5/2/checkpoint_300000.pt
[CHECKPOINT] Total elapsed: 1h 33m 35s | Since last checkpoint: 32m 23s
Step: 300724/1000000 | Episode: 1710 | Epsilon: 0.010 | FPS: 53
Step: 302607/1000000 | Episode: 1720 | Epsilon: 0.010 | FPS: 53
Step: 304523/1000000 | Episode: 1730 | Epsilon: 0.010 | FPS: 54
Step: 306270/1000000 | Episode: 1740 | Epsilon: 0.010 | FPS: 54
Step: 308133/1000000 | Episode: 1750 | Epsilon: 0.010 | FPS: 54
Step: 310085/1000000 | Episode: 1760 | Epsilon: 0.010 | FPS: 54
Step: 311635/1000000 | Episode: 1770 | Epsilon: 0.010 | FPS: 54
Step: 313463/1000000 | Episode: 1780 | Epsilon: 0.010 | FPS: 54
Step: 315397/1000000 | Episode: 1790 | Epsilon: 0.010 | FPS: 54
Step: 317479/1000000 | Episode: 1800 | Epsilon: 0.010 | FPS: 54
Step: 319368/1000000 | Episode: 1810 | Epsilon: 0.010 | FPS: 54
Step: 321063/1000000 | Episode: 1820 | Epsilon: 0.010 | FPS: 54
Step: 322797/1000000 | Episode: 1830 | Epsilon: 0.010 | FPS: 54
Step: 324463/1000000 | Episode: 1840 | Epsilon: 0.010 | FPS: 54
Step: 326278/1000000 | Episode: 1850 | Epsilon: 0.010 | FPS: 54
Step: 328180/1000000 | Episode: 1860 | Epsilon: 0.010 | FPS: 54
Step: 329824/1000000 | Episode: 1870 | Epsilon: 0.010 | FPS: 54
Step: 331663/1000000 | Episode: 1880 | Epsilon: 0.010 | FPS: 54
Step: 333732/1000000 | Episode: 1890 | Epsilon: 0.010 | FPS: 54
Step: 335629/1000000 | Episode: 1900 | Epsilon: 0.010 | FPS: 54
Step: 337460/1000000 | Episode: 1910 | Epsilon: 0.010 | FPS: 54
Step: 339226/1000000 | Episode: 1920 | Epsilon: 0.010 | FPS: 54
Step: 341090/1000000 | Episode: 1930 | Epsilon: 0.010 | FPS: 54
Step: 343039/1000000 | Episode: 1940 | Epsilon: 0.010 | FPS: 54
Step: 344695/1000000 | Episode: 1950 | Epsilon: 0.010 | FPS: 54
Step: 346499/1000000 | Episode: 1960 | Epsilon: 0.010 | FPS: 54
Step: 348248/1000000 | Episode: 1970 | Epsilon: 0.010 | FPS: 54
Step: 349791/1000000 | Episode: 1980 | Epsilon: 0.010 | FPS: 54

============================================================
Evaluating at step 350000/1000000 (35.0%)
Elapsed: 1h 48m 28s | ETA: 3h 21m 27s | Speed: 53.8 steps/s
Eval - Mean Reward: 4.45 ± 1.15, Mean Length: 182
Achievements unlocked: 9/22
============================================================

Step: 351631/1000000 | Episode: 1990 | Epsilon: 0.010 | FPS: 53
Step: 353180/1000000 | Episode: 2000 | Epsilon: 0.010 | FPS: 53
Step: 355207/1000000 | Episode: 2010 | Epsilon: 0.010 | FPS: 53
Step: 357038/1000000 | Episode: 2020 | Epsilon: 0.010 | FPS: 54
Step: 358711/1000000 | Episode: 2030 | Epsilon: 0.010 | FPS: 53
Step: 360420/1000000 | Episode: 2040 | Epsilon: 0.010 | FPS: 53
Step: 362157/1000000 | Episode: 2050 | Epsilon: 0.010 | FPS: 54
Step: 364242/1000000 | Episode: 2060 | Epsilon: 0.010 | FPS: 54
Step: 366491/1000000 | Episode: 2070 | Epsilon: 0.010 | FPS: 53
Step: 368359/1000000 | Episode: 2080 | Epsilon: 0.010 | FPS: 53
Step: 370172/1000000 | Episode: 2090 | Epsilon: 0.010 | FPS: 53
Step: 371844/1000000 | Episode: 2100 | Epsilon: 0.010 | FPS: 53
Step: 373815/1000000 | Episode: 2110 | Epsilon: 0.010 | FPS: 53
Step: 375541/1000000 | Episode: 2120 | Epsilon: 0.010 | FPS: 53
Step: 377604/1000000 | Episode: 2130 | Epsilon: 0.010 | FPS: 53
Step: 379394/1000000 | Episode: 2140 | Epsilon: 0.010 | FPS: 53
Step: 381317/1000000 | Episode: 2150 | Epsilon: 0.010 | FPS: 53
Step: 382868/1000000 | Episode: 2160 | Epsilon: 0.010 | FPS: 53
Step: 384635/1000000 | Episode: 2170 | Epsilon: 0.010 | FPS: 53
Step: 386170/1000000 | Episode: 2180 | Epsilon: 0.010 | FPS: 53
Step: 387988/1000000 | Episode: 2190 | Epsilon: 0.010 | FPS: 53
Step: 389734/1000000 | Episode: 2200 | Epsilon: 0.010 | FPS: 53
Step: 391410/1000000 | Episode: 2210 | Epsilon: 0.010 | FPS: 54
Step: 393431/1000000 | Episode: 2220 | Epsilon: 0.010 | FPS: 54
Step: 395369/1000000 | Episode: 2230 | Epsilon: 0.010 | FPS: 54
Step: 397343/1000000 | Episode: 2240 | Epsilon: 0.010 | FPS: 54
Step: 399232/1000000 | Episode: 2250 | Epsilon: 0.010 | FPS: 54

============================================================
Evaluating at step 400000/1000000 (40.0%)
Elapsed: 2h 4m 9s | ETA: 3h 6m 14s | Speed: 53.7 steps/s
Eval - Mean Reward: 4.30 ± 1.08, Mean Length: 189
Achievements unlocked: 8/22
============================================================

[CHECKPOINT] Saved to logdir/dqn-nstep5/2/checkpoint_400000.pt
[CHECKPOINT] Total elapsed: 2h 4m 57s | Since last checkpoint: 31m 22s
Step: 401079/1000000 | Episode: 2260 | Epsilon: 0.010 | FPS: 53
Step: 403066/1000000 | Episode: 2270 | Epsilon: 0.010 | FPS: 53
Step: 405017/1000000 | Episode: 2280 | Epsilon: 0.010 | FPS: 53
Step: 406786/1000000 | Episode: 2290 | Epsilon: 0.010 | FPS: 53
Step: 408712/1000000 | Episode: 2300 | Epsilon: 0.010 | FPS: 53
Step: 410391/1000000 | Episode: 2310 | Epsilon: 0.010 | FPS: 53
Step: 412403/1000000 | Episode: 2320 | Epsilon: 0.010 | FPS: 53
Step: 414200/1000000 | Episode: 2330 | Epsilon: 0.010 | FPS: 53
Step: 415917/1000000 | Episode: 2340 | Epsilon: 0.010 | FPS: 53
Step: 417681/1000000 | Episode: 2350 | Epsilon: 0.010 | FPS: 54
Step: 419360/1000000 | Episode: 2360 | Epsilon: 0.010 | FPS: 54
Step: 421205/1000000 | Episode: 2370 | Epsilon: 0.010 | FPS: 54
Step: 422786/1000000 | Episode: 2380 | Epsilon: 0.010 | FPS: 54
Step: 424540/1000000 | Episode: 2390 | Epsilon: 0.010 | FPS: 54
Step: 426359/1000000 | Episode: 2400 | Epsilon: 0.010 | FPS: 54
Step: 427938/1000000 | Episode: 2410 | Epsilon: 0.010 | FPS: 54
Step: 429763/1000000 | Episode: 2420 | Epsilon: 0.010 | FPS: 54
Step: 431831/1000000 | Episode: 2430 | Epsilon: 0.010 | FPS: 54
Step: 433539/1000000 | Episode: 2440 | Epsilon: 0.010 | FPS: 54
Step: 435368/1000000 | Episode: 2450 | Epsilon: 0.010 | FPS: 54
Step: 437049/1000000 | Episode: 2460 | Epsilon: 0.010 | FPS: 54
Step: 438857/1000000 | Episode: 2470 | Epsilon: 0.010 | FPS: 54
Step: 440715/1000000 | Episode: 2480 | Epsilon: 0.010 | FPS: 54
Step: 442665/1000000 | Episode: 2490 | Epsilon: 0.010 | FPS: 54
Step: 444615/1000000 | Episode: 2500 | Epsilon: 0.010 | FPS: 54
Step: 446486/1000000 | Episode: 2510 | Epsilon: 0.010 | FPS: 54
Step: 448702/1000000 | Episode: 2520 | Epsilon: 0.010 | FPS: 54

============================================================
Evaluating at step 450000/1000000 (45.0%)
Elapsed: 2h 19m 14s | ETA: 2h 50m 10s | Speed: 53.9 steps/s
Eval - Mean Reward: 3.90 ± 1.29, Mean Length: 166
Achievements unlocked: 9/22
============================================================

Step: 450346/1000000 | Episode: 2530 | Epsilon: 0.010 | FPS: 54
Step: 452257/1000000 | Episode: 2540 | Epsilon: 0.010 | FPS: 54
Step: 453967/1000000 | Episode: 2550 | Epsilon: 0.010 | FPS: 54
Step: 456045/1000000 | Episode: 2560 | Epsilon: 0.010 | FPS: 54
Step: 457619/1000000 | Episode: 2570 | Epsilon: 0.010 | FPS: 54
Step: 459110/1000000 | Episode: 2580 | Epsilon: 0.010 | FPS: 54
Step: 460915/1000000 | Episode: 2590 | Epsilon: 0.010 | FPS: 54
Step: 462653/1000000 | Episode: 2600 | Epsilon: 0.010 | FPS: 54
Step: 464386/1000000 | Episode: 2610 | Epsilon: 0.010 | FPS: 54
Step: 466383/1000000 | Episode: 2620 | Epsilon: 0.010 | FPS: 54
Step: 468280/1000000 | Episode: 2630 | Epsilon: 0.010 | FPS: 54
Step: 469816/1000000 | Episode: 2640 | Epsilon: 0.010 | FPS: 54
Step: 471522/1000000 | Episode: 2650 | Epsilon: 0.010 | FPS: 54
Step: 473529/1000000 | Episode: 2660 | Epsilon: 0.010 | FPS: 54
Step: 475409/1000000 | Episode: 2670 | Epsilon: 0.010 | FPS: 54
Step: 476921/1000000 | Episode: 2680 | Epsilon: 0.010 | FPS: 54
Step: 478822/1000000 | Episode: 2690 | Epsilon: 0.010 | FPS: 54
Step: 480722/1000000 | Episode: 2700 | Epsilon: 0.010 | FPS: 54
Step: 482403/1000000 | Episode: 2710 | Epsilon: 0.010 | FPS: 54
Step: 484094/1000000 | Episode: 2720 | Epsilon: 0.010 | FPS: 54
Step: 486044/1000000 | Episode: 2730 | Epsilon: 0.010 | FPS: 54
Step: 487786/1000000 | Episode: 2740 | Epsilon: 0.010 | FPS: 54
Step: 489663/1000000 | Episode: 2750 | Epsilon: 0.010 | FPS: 54
Step: 491437/1000000 | Episode: 2760 | Epsilon: 0.010 | FPS: 54
Step: 492849/1000000 | Episode: 2770 | Epsilon: 0.010 | FPS: 54
Step: 494657/1000000 | Episode: 2780 | Epsilon: 0.010 | FPS: 54
Step: 496491/1000000 | Episode: 2790 | Epsilon: 0.010 | FPS: 54
Step: 498407/1000000 | Episode: 2800 | Epsilon: 0.010 | FPS: 54

============================================================
Evaluating at step 500000/1000000 (50.0%)
Elapsed: 2h 33m 52s | ETA: 2h 33m 52s | Speed: 54.2 steps/s
Eval - Mean Reward: 4.00 ± 1.14, Mean Length: 184
Achievements unlocked: 8/22
============================================================

[CHECKPOINT] Saved to logdir/dqn-nstep5/2/checkpoint_500000.pt
[CHECKPOINT] Total elapsed: 2h 34m 36s | Since last checkpoint: 29m 38s
Step: 500262/1000000 | Episode: 2810 | Epsilon: 0.010 | FPS: 54
Step: 502133/1000000 | Episode: 2820 | Epsilon: 0.010 | FPS: 54
Step: 503917/1000000 | Episode: 2830 | Epsilon: 0.010 | FPS: 54
Step: 505704/1000000 | Episode: 2840 | Epsilon: 0.010 | FPS: 54
Step: 507763/1000000 | Episode: 2850 | Epsilon: 0.010 | FPS: 54
Step: 509356/1000000 | Episode: 2860 | Epsilon: 0.010 | FPS: 54
Step: 511009/1000000 | Episode: 2870 | Epsilon: 0.010 | FPS: 54
Step: 512960/1000000 | Episode: 2880 | Epsilon: 0.010 | FPS: 54
Step: 514617/1000000 | Episode: 2890 | Epsilon: 0.010 | FPS: 54
Step: 516368/1000000 | Episode: 2900 | Epsilon: 0.010 | FPS: 54
Step: 518142/1000000 | Episode: 2910 | Epsilon: 0.010 | FPS: 54
Step: 519796/1000000 | Episode: 2920 | Epsilon: 0.010 | FPS: 54
Step: 521731/1000000 | Episode: 2930 | Epsilon: 0.010 | FPS: 54
Step: 523322/1000000 | Episode: 2940 | Epsilon: 0.010 | FPS: 54
Step: 525389/1000000 | Episode: 2950 | Epsilon: 0.010 | FPS: 54
Step: 527308/1000000 | Episode: 2960 | Epsilon: 0.010 | FPS: 54
Step: 528817/1000000 | Episode: 2970 | Epsilon: 0.010 | FPS: 54
Step: 530837/1000000 | Episode: 2980 | Epsilon: 0.010 | FPS: 54
Step: 532762/1000000 | Episode: 2990 | Epsilon: 0.010 | FPS: 54
Step: 534597/1000000 | Episode: 3000 | Epsilon: 0.010 | FPS: 54
Step: 536466/1000000 | Episode: 3010 | Epsilon: 0.010 | FPS: 54
Step: 537777/1000000 | Episode: 3020 | Epsilon: 0.010 | FPS: 54
Step: 539454/1000000 | Episode: 3030 | Epsilon: 0.010 | FPS: 54
Step: 541200/1000000 | Episode: 3040 | Epsilon: 0.010 | FPS: 54
Step: 542940/1000000 | Episode: 3050 | Epsilon: 0.010 | FPS: 54
Step: 544849/1000000 | Episode: 3060 | Epsilon: 0.010 | FPS: 54
Step: 546549/1000000 | Episode: 3070 | Epsilon: 0.010 | FPS: 54
Step: 548208/1000000 | Episode: 3080 | Epsilon: 0.010 | FPS: 54
Step: 549897/1000000 | Episode: 3090 | Epsilon: 0.010 | FPS: 54

============================================================
Evaluating at step 550000/1000000 (55.0%)
Elapsed: 2h 49m 35s | ETA: 2h 18m 45s | Speed: 54.1 steps/s
Eval - Mean Reward: 3.85 ± 1.13, Mean Length: 187
Achievements unlocked: 8/22
============================================================

Step: 551779/1000000 | Episode: 3100 | Epsilon: 0.010 | FPS: 54
Step: 553645/1000000 | Episode: 3110 | Epsilon: 0.010 | FPS: 54
Step: 555610/1000000 | Episode: 3120 | Epsilon: 0.010 | FPS: 54
Step: 557521/1000000 | Episode: 3130 | Epsilon: 0.010 | FPS: 54
Step: 559326/1000000 | Episode: 3140 | Epsilon: 0.010 | FPS: 54
Step: 561302/1000000 | Episode: 3150 | Epsilon: 0.010 | FPS: 54
Step: 563316/1000000 | Episode: 3160 | Epsilon: 0.010 | FPS: 54
Step: 565147/1000000 | Episode: 3170 | Epsilon: 0.010 | FPS: 54
Step: 566845/1000000 | Episode: 3180 | Epsilon: 0.010 | FPS: 54
Step: 568646/1000000 | Episode: 3190 | Epsilon: 0.010 | FPS: 54
Step: 570252/1000000 | Episode: 3200 | Epsilon: 0.010 | FPS: 54
Step: 572282/1000000 | Episode: 3210 | Epsilon: 0.010 | FPS: 54
Step: 573732/1000000 | Episode: 3220 | Epsilon: 0.010 | FPS: 54
Step: 575635/1000000 | Episode: 3230 | Epsilon: 0.010 | FPS: 54
Step: 577531/1000000 | Episode: 3240 | Epsilon: 0.010 | FPS: 54
Step: 579214/1000000 | Episode: 3250 | Epsilon: 0.010 | FPS: 54
Step: 581205/1000000 | Episode: 3260 | Epsilon: 0.010 | FPS: 54
Step: 583184/1000000 | Episode: 3270 | Epsilon: 0.010 | FPS: 54
Step: 584988/1000000 | Episode: 3280 | Epsilon: 0.010 | FPS: 54
Step: 586675/1000000 | Episode: 3290 | Epsilon: 0.010 | FPS: 54
Step: 588475/1000000 | Episode: 3300 | Epsilon: 0.010 | FPS: 54
Step: 590115/1000000 | Episode: 3310 | Epsilon: 0.010 | FPS: 54
Step: 591735/1000000 | Episode: 3320 | Epsilon: 0.010 | FPS: 54
Step: 593343/1000000 | Episode: 3330 | Epsilon: 0.010 | FPS: 54
Step: 595049/1000000 | Episode: 3340 | Epsilon: 0.010 | FPS: 54
Step: 597033/1000000 | Episode: 3350 | Epsilon: 0.010 | FPS: 54
Step: 598707/1000000 | Episode: 3360 | Epsilon: 0.010 | FPS: 54

============================================================
Evaluating at step 600000/1000000 (60.0%)
Elapsed: 3h 3m 38s | ETA: 2h 2m 25s | Speed: 54.5 steps/s
Eval - Mean Reward: 4.30 ± 0.98, Mean Length: 165
Achievements unlocked: 9/22
============================================================

[CHECKPOINT] Saved to logdir/dqn-nstep5/2/checkpoint_600000.pt
[CHECKPOINT] Total elapsed: 3h 4m 21s | Since last checkpoint: 29m 45s
Step: 600279/1000000 | Episode: 3370 | Epsilon: 0.010 | FPS: 54
Step: 601935/1000000 | Episode: 3380 | Epsilon: 0.010 | FPS: 54
Step: 603782/1000000 | Episode: 3390 | Epsilon: 0.010 | FPS: 54
Step: 605781/1000000 | Episode: 3400 | Epsilon: 0.010 | FPS: 54
Step: 607736/1000000 | Episode: 3410 | Epsilon: 0.010 | FPS: 54
Step: 609388/1000000 | Episode: 3420 | Epsilon: 0.010 | FPS: 54
Step: 611027/1000000 | Episode: 3430 | Epsilon: 0.010 | FPS: 54
Step: 612601/1000000 | Episode: 3440 | Epsilon: 0.010 | FPS: 54
Step: 614267/1000000 | Episode: 3450 | Epsilon: 0.010 | FPS: 54
Step: 616054/1000000 | Episode: 3460 | Epsilon: 0.010 | FPS: 54
Step: 618003/1000000 | Episode: 3470 | Epsilon: 0.010 | FPS: 54
Step: 619703/1000000 | Episode: 3480 | Epsilon: 0.010 | FPS: 54
Step: 621633/1000000 | Episode: 3490 | Epsilon: 0.010 | FPS: 54
Step: 623426/1000000 | Episode: 3500 | Epsilon: 0.010 | FPS: 55
Step: 625337/1000000 | Episode: 3510 | Epsilon: 0.010 | FPS: 55
Step: 626999/1000000 | Episode: 3520 | Epsilon: 0.010 | FPS: 55
Step: 628847/1000000 | Episode: 3530 | Epsilon: 0.010 | FPS: 55
Step: 631009/1000000 | Episode: 3540 | Epsilon: 0.010 | FPS: 55
Step: 632792/1000000 | Episode: 3550 | Epsilon: 0.010 | FPS: 55
Step: 634674/1000000 | Episode: 3560 | Epsilon: 0.010 | FPS: 55
Step: 636100/1000000 | Episode: 3570 | Epsilon: 0.010 | FPS: 55
Step: 637962/1000000 | Episode: 3580 | Epsilon: 0.010 | FPS: 55
Step: 639827/1000000 | Episode: 3590 | Epsilon: 0.010 | FPS: 55
Step: 641431/1000000 | Episode: 3600 | Epsilon: 0.010 | FPS: 55
Step: 643357/1000000 | Episode: 3610 | Epsilon: 0.010 | FPS: 55
Step: 645396/1000000 | Episode: 3620 | Epsilon: 0.010 | FPS: 55
Step: 647160/1000000 | Episode: 3630 | Epsilon: 0.010 | FPS: 55
Step: 648717/1000000 | Episode: 3640 | Epsilon: 0.010 | FPS: 55

============================================================
Evaluating at step 650000/1000000 (65.0%)
Elapsed: 3h 17m 45s | ETA: 1h 46m 29s | Speed: 54.8 steps/s
Eval - Mean Reward: 4.45 ± 1.06, Mean Length: 194
Achievements unlocked: 9/22
============================================================

Step: 650497/1000000 | Episode: 3650 | Epsilon: 0.010 | FPS: 55
Step: 652050/1000000 | Episode: 3660 | Epsilon: 0.010 | FPS: 55
Step: 653755/1000000 | Episode: 3670 | Epsilon: 0.010 | FPS: 55
Step: 655409/1000000 | Episode: 3680 | Epsilon: 0.010 | FPS: 55
Step: 657026/1000000 | Episode: 3690 | Epsilon: 0.010 | FPS: 55
Step: 658887/1000000 | Episode: 3700 | Epsilon: 0.010 | FPS: 55
Step: 660788/1000000 | Episode: 3710 | Epsilon: 0.010 | FPS: 55
Step: 662455/1000000 | Episode: 3720 | Epsilon: 0.010 | FPS: 55
Step: 664548/1000000 | Episode: 3730 | Epsilon: 0.010 | FPS: 55
Step: 666559/1000000 | Episode: 3740 | Epsilon: 0.010 | FPS: 55
Step: 668390/1000000 | Episode: 3750 | Epsilon: 0.010 | FPS: 55
Step: 670375/1000000 | Episode: 3760 | Epsilon: 0.010 | FPS: 55
Step: 672009/1000000 | Episode: 3770 | Epsilon: 0.010 | FPS: 55
Step: 674108/1000000 | Episode: 3780 | Epsilon: 0.010 | FPS: 55
Step: 675735/1000000 | Episode: 3790 | Epsilon: 0.010 | FPS: 55
Step: 677761/1000000 | Episode: 3800 | Epsilon: 0.010 | FPS: 55
Step: 679844/1000000 | Episode: 3810 | Epsilon: 0.010 | FPS: 55
Step: 681820/1000000 | Episode: 3820 | Epsilon: 0.010 | FPS: 55
Step: 683596/1000000 | Episode: 3830 | Epsilon: 0.010 | FPS: 55
Step: 685086/1000000 | Episode: 3840 | Epsilon: 0.010 | FPS: 55
Step: 687101/1000000 | Episode: 3850 | Epsilon: 0.010 | FPS: 55
Step: 688949/1000000 | Episode: 3860 | Epsilon: 0.010 | FPS: 55
Step: 690731/1000000 | Episode: 3870 | Epsilon: 0.010 | FPS: 55
Step: 692513/1000000 | Episode: 3880 | Epsilon: 0.010 | FPS: 55
Step: 694455/1000000 | Episode: 3890 | Epsilon: 0.010 | FPS: 55
Step: 696238/1000000 | Episode: 3900 | Epsilon: 0.010 | FPS: 55
Step: 698114/1000000 | Episode: 3910 | Epsilon: 0.010 | FPS: 55
Step: 699727/1000000 | Episode: 3920 | Epsilon: 0.010 | FPS: 55

============================================================
Evaluating at step 700000/1000000 (70.0%)
Elapsed: 3h 32m 54s | ETA: 1h 31m 14s | Speed: 54.8 steps/s
Eval - Mean Reward: 4.30 ± 1.36, Mean Length: 187
Achievements unlocked: 8/22
============================================================

[CHECKPOINT] Saved to logdir/dqn-nstep5/2/checkpoint_700000.pt
[CHECKPOINT] Total elapsed: 3h 33m 41s | Since last checkpoint: 29m 20s
Step: 701232/1000000 | Episode: 3930 | Epsilon: 0.010 | FPS: 55
Step: 702958/1000000 | Episode: 3940 | Epsilon: 0.010 | FPS: 55
Step: 705109/1000000 | Episode: 3950 | Epsilon: 0.010 | FPS: 55
Step: 707104/1000000 | Episode: 3960 | Epsilon: 0.010 | FPS: 55
Step: 708762/1000000 | Episode: 3970 | Epsilon: 0.010 | FPS: 55
Step: 710703/1000000 | Episode: 3980 | Epsilon: 0.010 | FPS: 55
Step: 712493/1000000 | Episode: 3990 | Epsilon: 0.010 | FPS: 55
Step: 714284/1000000 | Episode: 4000 | Epsilon: 0.010 | FPS: 55
Step: 716206/1000000 | Episode: 4010 | Epsilon: 0.010 | FPS: 55
Step: 718090/1000000 | Episode: 4020 | Epsilon: 0.010 | FPS: 55
Step: 720010/1000000 | Episode: 4030 | Epsilon: 0.010 | FPS: 55
Step: 722084/1000000 | Episode: 4040 | Epsilon: 0.010 | FPS: 55
Step: 723744/1000000 | Episode: 4050 | Epsilon: 0.010 | FPS: 55
Step: 725645/1000000 | Episode: 4060 | Epsilon: 0.010 | FPS: 55
Step: 727255/1000000 | Episode: 4070 | Epsilon: 0.010 | FPS: 55
Step: 728881/1000000 | Episode: 4080 | Epsilon: 0.010 | FPS: 55
Step: 730352/1000000 | Episode: 4090 | Epsilon: 0.010 | FPS: 55
Step: 732396/1000000 | Episode: 4100 | Epsilon: 0.010 | FPS: 55
Step: 734210/1000000 | Episode: 4110 | Epsilon: 0.010 | FPS: 55
Step: 735854/1000000 | Episode: 4120 | Epsilon: 0.010 | FPS: 55
Step: 737815/1000000 | Episode: 4130 | Epsilon: 0.010 | FPS: 55
Step: 739475/1000000 | Episode: 4140 | Epsilon: 0.010 | FPS: 55
Step: 741247/1000000 | Episode: 4150 | Epsilon: 0.010 | FPS: 55
Step: 743086/1000000 | Episode: 4160 | Epsilon: 0.010 | FPS: 55
Step: 744772/1000000 | Episode: 4170 | Epsilon: 0.010 | FPS: 55
Step: 746534/1000000 | Episode: 4180 | Epsilon: 0.010 | FPS: 55
Step: 748302/1000000 | Episode: 4190 | Epsilon: 0.010 | FPS: 55
Step: 749926/1000000 | Episode: 4200 | Epsilon: 0.010 | FPS: 55

============================================================
Evaluating at step 750000/1000000 (75.0%)
Elapsed: 3h 47m 14s | ETA: 1h 15m 44s | Speed: 55.0 steps/s
Eval - Mean Reward: 3.95 ± 1.39, Mean Length: 186
Achievements unlocked: 8/22
============================================================

Step: 752009/1000000 | Episode: 4210 | Epsilon: 0.010 | FPS: 55
Step: 753827/1000000 | Episode: 4220 | Epsilon: 0.010 | FPS: 55
Step: 755567/1000000 | Episode: 4230 | Epsilon: 0.010 | FPS: 55
Step: 757269/1000000 | Episode: 4240 | Epsilon: 0.010 | FPS: 55
Step: 759067/1000000 | Episode: 4250 | Epsilon: 0.010 | FPS: 55
Step: 760835/1000000 | Episode: 4260 | Epsilon: 0.010 | FPS: 55
Step: 762903/1000000 | Episode: 4270 | Epsilon: 0.010 | FPS: 55
Step: 764686/1000000 | Episode: 4280 | Epsilon: 0.010 | FPS: 55
Step: 766727/1000000 | Episode: 4290 | Epsilon: 0.010 | FPS: 55
Step: 768461/1000000 | Episode: 4300 | Epsilon: 0.010 | FPS: 55
Step: 770207/1000000 | Episode: 4310 | Epsilon: 0.010 | FPS: 55
Step: 772163/1000000 | Episode: 4320 | Epsilon: 0.010 | FPS: 55
Step: 774111/1000000 | Episode: 4330 | Epsilon: 0.010 | FPS: 55
Step: 775812/1000000 | Episode: 4340 | Epsilon: 0.010 | FPS: 55
Step: 777773/1000000 | Episode: 4350 | Epsilon: 0.010 | FPS: 55
Step: 779627/1000000 | Episode: 4360 | Epsilon: 0.010 | FPS: 55
Step: 781687/1000000 | Episode: 4370 | Epsilon: 0.010 | FPS: 55
Step: 783590/1000000 | Episode: 4380 | Epsilon: 0.010 | FPS: 55
Step: 785226/1000000 | Episode: 4390 | Epsilon: 0.010 | FPS: 55
Step: 787087/1000000 | Episode: 4400 | Epsilon: 0.010 | FPS: 55
Step: 789029/1000000 | Episode: 4410 | Epsilon: 0.010 | FPS: 55
Step: 790815/1000000 | Episode: 4420 | Epsilon: 0.010 | FPS: 55
Step: 792821/1000000 | Episode: 4430 | Epsilon: 0.010 | FPS: 55
Step: 794531/1000000 | Episode: 4440 | Epsilon: 0.010 | FPS: 55
Step: 796049/1000000 | Episode: 4450 | Epsilon: 0.010 | FPS: 55
Step: 798006/1000000 | Episode: 4460 | Epsilon: 0.010 | FPS: 55
Step: 799813/1000000 | Episode: 4470 | Epsilon: 0.010 | FPS: 55

============================================================
Evaluating at step 800000/1000000 (80.0%)
Elapsed: 4h 2m 1s | ETA: 1h 0m 30s | Speed: 55.1 steps/s
Eval - Mean Reward: 4.00 ± 1.18, Mean Length: 192
Achievements unlocked: 8/22
============================================================

[CHECKPOINT] Saved to logdir/dqn-nstep5/2/checkpoint_800000.pt
[CHECKPOINT] Total elapsed: 4h 2m 48s | Since last checkpoint: 29m 7s
Step: 801420/1000000 | Episode: 4480 | Epsilon: 0.010 | FPS: 55
Step: 803192/1000000 | Episode: 4490 | Epsilon: 0.010 | FPS: 55
Step: 804737/1000000 | Episode: 4500 | Epsilon: 0.010 | FPS: 55
Step: 806772/1000000 | Episode: 4510 | Epsilon: 0.010 | FPS: 55
Step: 808516/1000000 | Episode: 4520 | Epsilon: 0.010 | FPS: 55
Step: 810306/1000000 | Episode: 4530 | Epsilon: 0.010 | FPS: 55
Step: 812259/1000000 | Episode: 4540 | Epsilon: 0.010 | FPS: 55
Step: 813928/1000000 | Episode: 4550 | Epsilon: 0.010 | FPS: 55
Step: 815574/1000000 | Episode: 4560 | Epsilon: 0.010 | FPS: 55
Step: 817778/1000000 | Episode: 4570 | Epsilon: 0.010 | FPS: 55
Step: 819691/1000000 | Episode: 4580 | Epsilon: 0.010 | FPS: 55
Step: 821631/1000000 | Episode: 4590 | Epsilon: 0.010 | FPS: 55
Step: 823786/1000000 | Episode: 4600 | Epsilon: 0.010 | FPS: 55
Step: 825610/1000000 | Episode: 4610 | Epsilon: 0.010 | FPS: 55
Step: 827635/1000000 | Episode: 4620 | Epsilon: 0.010 | FPS: 55
Step: 829323/1000000 | Episode: 4630 | Epsilon: 0.010 | FPS: 55
Step: 831244/1000000 | Episode: 4640 | Epsilon: 0.010 | FPS: 55
Step: 833109/1000000 | Episode: 4650 | Epsilon: 0.010 | FPS: 55
Step: 834599/1000000 | Episode: 4660 | Epsilon: 0.010 | FPS: 55
Step: 836613/1000000 | Episode: 4670 | Epsilon: 0.010 | FPS: 55
Step: 838317/1000000 | Episode: 4680 | Epsilon: 0.010 | FPS: 55
Step: 840437/1000000 | Episode: 4690 | Epsilon: 0.010 | FPS: 55
Step: 842688/1000000 | Episode: 4700 | Epsilon: 0.010 | FPS: 55
Step: 844682/1000000 | Episode: 4710 | Epsilon: 0.010 | FPS: 55
Step: 846524/1000000 | Episode: 4720 | Epsilon: 0.010 | FPS: 55
Step: 848268/1000000 | Episode: 4730 | Epsilon: 0.010 | FPS: 55

============================================================
Evaluating at step 850000/1000000 (85.0%)
Elapsed: 4h 16m 8s | ETA: 45m 12s | Speed: 55.3 steps/s
Eval - Mean Reward: 4.35 ± 1.04, Mean Length: 189
Achievements unlocked: 8/22
============================================================

Step: 850231/1000000 | Episode: 4740 | Epsilon: 0.010 | FPS: 55
Step: 852420/1000000 | Episode: 4750 | Epsilon: 0.010 | FPS: 55
Step: 854405/1000000 | Episode: 4760 | Epsilon: 0.010 | FPS: 55
Step: 856609/1000000 | Episode: 4770 | Epsilon: 0.010 | FPS: 55
Step: 858579/1000000 | Episode: 4780 | Epsilon: 0.010 | FPS: 55
Step: 860359/1000000 | Episode: 4790 | Epsilon: 0.010 | FPS: 55
Step: 862065/1000000 | Episode: 4800 | Epsilon: 0.010 | FPS: 55
Step: 863999/1000000 | Episode: 4810 | Epsilon: 0.010 | FPS: 55
Step: 865757/1000000 | Episode: 4820 | Epsilon: 0.010 | FPS: 55
Step: 867577/1000000 | Episode: 4830 | Epsilon: 0.010 | FPS: 55
Step: 869529/1000000 | Episode: 4840 | Epsilon: 0.010 | FPS: 55
Step: 871606/1000000 | Episode: 4850 | Epsilon: 0.010 | FPS: 55
Step: 873550/1000000 | Episode: 4860 | Epsilon: 0.010 | FPS: 55
Step: 875392/1000000 | Episode: 4870 | Epsilon: 0.010 | FPS: 55
Step: 877187/1000000 | Episode: 4880 | Epsilon: 0.010 | FPS: 55
Step: 879217/1000000 | Episode: 4890 | Epsilon: 0.010 | FPS: 55
Step: 881222/1000000 | Episode: 4900 | Epsilon: 0.010 | FPS: 55
Step: 883002/1000000 | Episode: 4910 | Epsilon: 0.010 | FPS: 55
Step: 884979/1000000 | Episode: 4920 | Epsilon: 0.010 | FPS: 55
Step: 886639/1000000 | Episode: 4930 | Epsilon: 0.010 | FPS: 55
Step: 888427/1000000 | Episode: 4940 | Epsilon: 0.010 | FPS: 55
Step: 890347/1000000 | Episode: 4950 | Epsilon: 0.010 | FPS: 55
Step: 892180/1000000 | Episode: 4960 | Epsilon: 0.010 | FPS: 55
Step: 894296/1000000 | Episode: 4970 | Epsilon: 0.010 | FPS: 55
Step: 896392/1000000 | Episode: 4980 | Epsilon: 0.010 | FPS: 55
Step: 898533/1000000 | Episode: 4990 | Epsilon: 0.010 | FPS: 56

============================================================
Evaluating at step 900000/1000000 (90.0%)
Elapsed: 4h 30m 6s | ETA: 30m 0s | Speed: 55.5 steps/s
Eval - Mean Reward: 4.00 ± 1.34, Mean Length: 189
Achievements unlocked: 8/22
============================================================

[CHECKPOINT] Saved to logdir/dqn-nstep5/2/checkpoint_900000.pt
[CHECKPOINT] Total elapsed: 4h 30m 50s | Since last checkpoint: 28m 1s
Step: 900247/1000000 | Episode: 5000 | Epsilon: 0.010 | FPS: 55
Step: 902104/1000000 | Episode: 5010 | Epsilon: 0.010 | FPS: 55
Step: 904286/1000000 | Episode: 5020 | Epsilon: 0.010 | FPS: 55
Step: 906013/1000000 | Episode: 5030 | Epsilon: 0.010 | FPS: 55
Step: 907969/1000000 | Episode: 5040 | Epsilon: 0.010 | FPS: 55
Step: 909830/1000000 | Episode: 5050 | Epsilon: 0.010 | FPS: 55
Step: 911911/1000000 | Episode: 5060 | Epsilon: 0.010 | FPS: 55
Step: 913784/1000000 | Episode: 5070 | Epsilon: 0.010 | FPS: 55
Step: 915967/1000000 | Episode: 5080 | Epsilon: 0.010 | FPS: 55
Step: 917959/1000000 | Episode: 5090 | Epsilon: 0.010 | FPS: 56
Step: 919962/1000000 | Episode: 5100 | Epsilon: 0.010 | FPS: 56
Step: 921892/1000000 | Episode: 5110 | Epsilon: 0.010 | FPS: 56
Step: 923871/1000000 | Episode: 5120 | Epsilon: 0.010 | FPS: 56
Step: 925679/1000000 | Episode: 5130 | Epsilon: 0.010 | FPS: 56
Step: 927476/1000000 | Episode: 5140 | Epsilon: 0.010 | FPS: 56
Step: 929061/1000000 | Episode: 5150 | Epsilon: 0.010 | FPS: 56
Step: 930954/1000000 | Episode: 5160 | Epsilon: 0.010 | FPS: 56
Step: 932771/1000000 | Episode: 5170 | Epsilon: 0.010 | FPS: 56
Step: 934716/1000000 | Episode: 5180 | Epsilon: 0.010 | FPS: 56
Step: 936591/1000000 | Episode: 5190 | Epsilon: 0.010 | FPS: 56
Step: 938391/1000000 | Episode: 5200 | Epsilon: 0.010 | FPS: 56
Step: 940339/1000000 | Episode: 5210 | Epsilon: 0.010 | FPS: 56
Step: 942096/1000000 | Episode: 5220 | Epsilon: 0.010 | FPS: 56
Step: 944194/1000000 | Episode: 5230 | Epsilon: 0.010 | FPS: 56
Step: 946241/1000000 | Episode: 5240 | Epsilon: 0.010 | FPS: 56
Step: 948142/1000000 | Episode: 5250 | Epsilon: 0.010 | FPS: 56
Step: 949975/1000000 | Episode: 5260 | Epsilon: 0.010 | FPS: 56

============================================================
Evaluating at step 950000/1000000 (95.0%)
Elapsed: 4h 44m 56s | ETA: 14m 59s | Speed: 55.6 steps/s
Eval - Mean Reward: 4.50 ± 1.36, Mean Length: 205
Achievements unlocked: 9/22
============================================================

Step: 951872/1000000 | Episode: 5270 | Epsilon: 0.010 | FPS: 55
Step: 953636/1000000 | Episode: 5280 | Epsilon: 0.010 | FPS: 55
Step: 955601/1000000 | Episode: 5290 | Epsilon: 0.010 | FPS: 55
Step: 957708/1000000 | Episode: 5300 | Epsilon: 0.010 | FPS: 55
Step: 959739/1000000 | Episode: 5310 | Epsilon: 0.010 | FPS: 55
Step: 961474/1000000 | Episode: 5320 | Epsilon: 0.010 | FPS: 55
Step: 963581/1000000 | Episode: 5330 | Epsilon: 0.010 | FPS: 55
Step: 965438/1000000 | Episode: 5340 | Epsilon: 0.010 | FPS: 55
Step: 967445/1000000 | Episode: 5350 | Epsilon: 0.010 | FPS: 55
Step: 969159/1000000 | Episode: 5360 | Epsilon: 0.010 | FPS: 55
Step: 971145/1000000 | Episode: 5370 | Epsilon: 0.010 | FPS: 55
Step: 973108/1000000 | Episode: 5380 | Epsilon: 0.010 | FPS: 55
Step: 975052/1000000 | Episode: 5390 | Epsilon: 0.010 | FPS: 56
Step: 976928/1000000 | Episode: 5400 | Epsilon: 0.010 | FPS: 56
Step: 978672/1000000 | Episode: 5410 | Epsilon: 0.010 | FPS: 56
Step: 981039/1000000 | Episode: 5420 | Epsilon: 0.010 | FPS: 56
Step: 983133/1000000 | Episode: 5430 | Epsilon: 0.010 | FPS: 56
Step: 985221/1000000 | Episode: 5440 | Epsilon: 0.010 | FPS: 56
Step: 986794/1000000 | Episode: 5450 | Epsilon: 0.010 | FPS: 56
Step: 988827/1000000 | Episode: 5460 | Epsilon: 0.010 | FPS: 56
Step: 990842/1000000 | Episode: 5470 | Epsilon: 0.010 | FPS: 56
Step: 992845/1000000 | Episode: 5480 | Epsilon: 0.010 | FPS: 56
Step: 994288/1000000 | Episode: 5490 | Epsilon: 0.010 | FPS: 56
Step: 996129/1000000 | Episode: 5500 | Epsilon: 0.010 | FPS: 56
Step: 997892/1000000 | Episode: 5510 | Epsilon: 0.010 | FPS: 56
Step: 999527/1000000 | Episode: 5520 | Epsilon: 0.010 | FPS: 56

============================================================
Evaluating at step 1000000/1000000 (100.0%)
Elapsed: 4h 59m 43s | ETA: 0s | Speed: 55.6 steps/s
Eval - Mean Reward: 3.75 ± 1.01, Mean Length: 180
Achievements unlocked: 8/22
============================================================

[CHECKPOINT] Saved to logdir/dqn-nstep5/2/checkpoint_1000000.pt
[CHECKPOINT] Total elapsed: 5h 0m 30s | Since last checkpoint: 29m 40s

============================================================
FINAL EVALUATION
Total training time: 5h 0m 32s
============================================================
Final Mean Reward: 4.30 ± 0.93
Final Achievements: 8/22

Final Achievement Success Rates:
  wake_up: 100.0%
  collect_sapling: 100.0%
  place_plant: 100.0%
  collect_wood: 80.0%
  place_table: 60.0%
  defeat_zombie: 60.0%
  eat_cow: 10.0%
  collect_drink: 10.0%

Saved final model to logdir/dqn-nstep5/2/final_model.pt
Metrics saved to logdir/dqn-nstep5/2/metrics.json
Metadata saved to logdir/dqn-nstep5/2/metadata.json
============================================================
TRAINING COMPLETE!
============================================================

Final Training Statistics:
  Training Time: 5h 0m 32s
  Final Eval Reward: 3.75 ± 1.01
  Best Eval Reward: 4.55
  Total Episodes: 5523
  Final Loss: 0.0367
  Final Epsilon: 0.0100
============================================================
