======================================================================
Experiment: training_run
======================================================================

Start Time: 2025-11-10T13:51:50.129836

Git Info:
  Commit: 2950c37 (test-1)
  WARNING: Uncommitted changes present!

System Info:
  Hostname: dr1-v100s-1
  Platform: Linux-6.8.0-87-generic-x86_64-with-glibc2.39
  CPU Count: 15

GPU Info:
  GPU 0: Tesla V100S-PCIE-32GB
    Memory: 32768 MiB
    Driver: 580.95.05

Package Versions:
  PyTorch: 2.9.0+cu128
  CUDA: 12.8
  NumPy: 2.3.4
  Crafter: unknown

Experiment Arguments:
  batch_size: 32
  buffer_size: 100000
  device: cuda
  double_dqn: True
  dueling: True
  env_name: crafter
  epsilon_decay_steps: 200000
  epsilon_end: 0.05
  epsilon_start: 1.0
  eval_episodes: 20
  eval_interval: 50000
  gamma: 0.99
  grad_clip: 10.0
  hidden_size: 512
  logdir: logdir_extended_exploration/enhanced-dqn-extended/2
  lr: 0.0001
  munchausen: False
  munchausen_alpha: 0.9
  munchausen_tau: 0.03
  n_step: 1
  resume: None
  save_freq: 100000
  seed: 2
  steps: 1000000
  target_update_freq: 2500
  training_starts: 5000
  update_freq: 4
======================================================================

Step: 1480/1000000 | Episode: 10 | Epsilon: 0.993 | FPS: 74
Step: 3099/1000000 | Episode: 20 | Epsilon: 0.985 | FPS: 80
Step: 4685/1000000 | Episode: 30 | Epsilon: 0.978 | FPS: 80
Step: 6487/1000000 | Episode: 40 | Epsilon: 0.969 | FPS: 79
Step: 8382/1000000 | Episode: 50 | Epsilon: 0.960 | FPS: 79
Step: 9968/1000000 | Episode: 60 | Epsilon: 0.953 | FPS: 75
Step: 11364/1000000 | Episode: 70 | Epsilon: 0.946 | FPS: 73
Step: 12906/1000000 | Episode: 80 | Epsilon: 0.939 | FPS: 72
Step: 14699/1000000 | Episode: 90 | Epsilon: 0.930 | FPS: 72
Step: 16237/1000000 | Episode: 100 | Epsilon: 0.923 | FPS: 71
Step: 18038/1000000 | Episode: 110 | Epsilon: 0.914 | FPS: 70
Step: 19692/1000000 | Episode: 120 | Epsilon: 0.906 | FPS: 70
Step: 21224/1000000 | Episode: 130 | Epsilon: 0.899 | FPS: 69
Step: 22619/1000000 | Episode: 140 | Epsilon: 0.893 | FPS: 69
Step: 24179/1000000 | Episode: 150 | Epsilon: 0.885 | FPS: 67
Step: 25830/1000000 | Episode: 160 | Epsilon: 0.877 | FPS: 65
Step: 27460/1000000 | Episode: 170 | Epsilon: 0.870 | FPS: 64
Step: 29150/1000000 | Episode: 180 | Epsilon: 0.862 | FPS: 63
Step: 30716/1000000 | Episode: 190 | Epsilon: 0.854 | FPS: 63
Step: 32512/1000000 | Episode: 200 | Epsilon: 0.846 | FPS: 63
Step: 34355/1000000 | Episode: 210 | Epsilon: 0.837 | FPS: 64
Step: 36509/1000000 | Episode: 220 | Epsilon: 0.827 | FPS: 65
Step: 38245/1000000 | Episode: 230 | Epsilon: 0.818 | FPS: 65
Step: 40041/1000000 | Episode: 240 | Epsilon: 0.810 | FPS: 65
Step: 41588/1000000 | Episode: 250 | Epsilon: 0.802 | FPS: 65
Step: 43446/1000000 | Episode: 260 | Epsilon: 0.794 | FPS: 65
Step: 45316/1000000 | Episode: 270 | Epsilon: 0.785 | FPS: 66
Step: 47888/1000000 | Episode: 280 | Epsilon: 0.773 | FPS: 66
Step: 49530/1000000 | Episode: 290 | Epsilon: 0.765 | FPS: 66

============================================================
Evaluating at step 50000/1000000 (5.0%)
Elapsed: 12m 32s | ETA: 3h 58m 12s | Speed: 66.5 steps/s
Eval - Mean Reward: 1.45 ± 0.57, Mean Length: 170
Achievements unlocked: 6/22
============================================================

Step: 51311/1000000 | Episode: 300 | Epsilon: 0.756 | FPS: 63
Step: 52960/1000000 | Episode: 310 | Epsilon: 0.748 | FPS: 63
Step: 54828/1000000 | Episode: 320 | Epsilon: 0.740 | FPS: 63
Step: 56894/1000000 | Episode: 330 | Epsilon: 0.730 | FPS: 63
Step: 58761/1000000 | Episode: 340 | Epsilon: 0.721 | FPS: 62
Step: 60557/1000000 | Episode: 350 | Epsilon: 0.712 | FPS: 63
Step: 62272/1000000 | Episode: 360 | Epsilon: 0.704 | FPS: 63
Step: 63657/1000000 | Episode: 370 | Epsilon: 0.698 | FPS: 62
Step: 65073/1000000 | Episode: 380 | Epsilon: 0.691 | FPS: 62
Step: 66720/1000000 | Episode: 390 | Epsilon: 0.683 | FPS: 63
Step: 68348/1000000 | Episode: 400 | Epsilon: 0.675 | FPS: 63
Step: 70135/1000000 | Episode: 410 | Epsilon: 0.667 | FPS: 62
Step: 71891/1000000 | Episode: 420 | Epsilon: 0.659 | FPS: 63
Step: 73338/1000000 | Episode: 430 | Epsilon: 0.652 | FPS: 62
Step: 75016/1000000 | Episode: 440 | Epsilon: 0.644 | FPS: 62
Step: 76744/1000000 | Episode: 450 | Epsilon: 0.635 | FPS: 62
Step: 78449/1000000 | Episode: 460 | Epsilon: 0.627 | FPS: 62
Step: 80299/1000000 | Episode: 470 | Epsilon: 0.619 | FPS: 62
Step: 81829/1000000 | Episode: 480 | Epsilon: 0.611 | FPS: 62
Step: 83621/1000000 | Episode: 490 | Epsilon: 0.603 | FPS: 62
Step: 85102/1000000 | Episode: 500 | Epsilon: 0.596 | FPS: 62
Step: 86763/1000000 | Episode: 510 | Epsilon: 0.588 | FPS: 62
Step: 88536/1000000 | Episode: 520 | Epsilon: 0.579 | FPS: 62
Step: 90237/1000000 | Episode: 530 | Epsilon: 0.571 | FPS: 62
Step: 91959/1000000 | Episode: 540 | Epsilon: 0.563 | FPS: 62
Step: 93765/1000000 | Episode: 550 | Epsilon: 0.555 | FPS: 62
Step: 95443/1000000 | Episode: 560 | Epsilon: 0.547 | FPS: 62
Step: 97272/1000000 | Episode: 570 | Epsilon: 0.538 | FPS: 62
Step: 99164/1000000 | Episode: 580 | Epsilon: 0.529 | FPS: 62

============================================================
Evaluating at step 100000/1000000 (10.0%)
Elapsed: 26m 47s | ETA: 4h 1m 7s | Speed: 62.2 steps/s
Eval - Mean Reward: 1.50 ± 1.43, Mean Length: 171
Achievements unlocked: 6/22
============================================================

[CHECKPOINT] Saved to logdir_extended_exploration/enhanced-dqn-extended/2/checkpoint_100000.pt
[CHECKPOINT] Total elapsed: 27m 31s | Since last checkpoint: 27m 31s
Step: 100868/1000000 | Episode: 590 | Epsilon: 0.521 | FPS: 61
Step: 102432/1000000 | Episode: 600 | Epsilon: 0.513 | FPS: 60
Step: 104174/1000000 | Episode: 610 | Epsilon: 0.505 | FPS: 60
Step: 105896/1000000 | Episode: 620 | Epsilon: 0.497 | FPS: 60
Step: 107289/1000000 | Episode: 630 | Epsilon: 0.490 | FPS: 60
Step: 108890/1000000 | Episode: 640 | Epsilon: 0.483 | FPS: 60
Step: 110468/1000000 | Episode: 650 | Epsilon: 0.475 | FPS: 60
Step: 112441/1000000 | Episode: 660 | Epsilon: 0.466 | FPS: 60
Step: 114289/1000000 | Episode: 670 | Epsilon: 0.457 | FPS: 60
Step: 115830/1000000 | Episode: 680 | Epsilon: 0.450 | FPS: 60
Step: 117519/1000000 | Episode: 690 | Epsilon: 0.442 | FPS: 60
Step: 119457/1000000 | Episode: 700 | Epsilon: 0.433 | FPS: 60
Step: 121218/1000000 | Episode: 710 | Epsilon: 0.424 | FPS: 60
Step: 123113/1000000 | Episode: 720 | Epsilon: 0.415 | FPS: 61
Step: 124765/1000000 | Episode: 730 | Epsilon: 0.407 | FPS: 61
Step: 126859/1000000 | Episode: 740 | Epsilon: 0.397 | FPS: 61
Step: 128849/1000000 | Episode: 750 | Epsilon: 0.388 | FPS: 61
Step: 130523/1000000 | Episode: 760 | Epsilon: 0.380 | FPS: 61
Step: 132249/1000000 | Episode: 770 | Epsilon: 0.372 | FPS: 61
Step: 133925/1000000 | Episode: 780 | Epsilon: 0.364 | FPS: 61
Step: 135566/1000000 | Episode: 790 | Epsilon: 0.356 | FPS: 61
Step: 137243/1000000 | Episode: 800 | Epsilon: 0.348 | FPS: 61
Step: 139035/1000000 | Episode: 810 | Epsilon: 0.340 | FPS: 61
Step: 140506/1000000 | Episode: 820 | Epsilon: 0.333 | FPS: 60
Step: 142299/1000000 | Episode: 830 | Epsilon: 0.324 | FPS: 60
Step: 143989/1000000 | Episode: 840 | Epsilon: 0.316 | FPS: 60
Step: 145561/1000000 | Episode: 850 | Epsilon: 0.309 | FPS: 59
Step: 147011/1000000 | Episode: 860 | Epsilon: 0.302 | FPS: 59
Step: 148707/1000000 | Episode: 870 | Epsilon: 0.294 | FPS: 59

============================================================
Evaluating at step 150000/1000000 (15.0%)
Elapsed: 42m 39s | ETA: 4h 1m 45s | Speed: 58.6 steps/s
Eval - Mean Reward: 2.10 ± 1.18, Mean Length: 160
Achievements unlocked: 7/22
============================================================

Step: 150462/1000000 | Episode: 880 | Epsilon: 0.285 | FPS: 58
Step: 152386/1000000 | Episode: 890 | Epsilon: 0.276 | FPS: 58
Step: 153831/1000000 | Episode: 900 | Epsilon: 0.269 | FPS: 58
Step: 155585/1000000 | Episode: 910 | Epsilon: 0.261 | FPS: 58
Step: 157221/1000000 | Episode: 920 | Epsilon: 0.253 | FPS: 58
Step: 159010/1000000 | Episode: 930 | Epsilon: 0.245 | FPS: 58
Step: 160568/1000000 | Episode: 940 | Epsilon: 0.237 | FPS: 58
Step: 162362/1000000 | Episode: 950 | Epsilon: 0.229 | FPS: 58
Step: 164272/1000000 | Episode: 960 | Epsilon: 0.220 | FPS: 58
Step: 165937/1000000 | Episode: 970 | Epsilon: 0.212 | FPS: 58
Step: 167892/1000000 | Episode: 980 | Epsilon: 0.203 | FPS: 58
Step: 169452/1000000 | Episode: 990 | Epsilon: 0.195 | FPS: 58
Step: 171507/1000000 | Episode: 1000 | Epsilon: 0.185 | FPS: 58
Step: 173406/1000000 | Episode: 1010 | Epsilon: 0.176 | FPS: 58
Step: 175205/1000000 | Episode: 1020 | Epsilon: 0.168 | FPS: 58
Step: 177192/1000000 | Episode: 1030 | Epsilon: 0.158 | FPS: 58
Step: 179109/1000000 | Episode: 1040 | Epsilon: 0.149 | FPS: 58
Step: 180988/1000000 | Episode: 1050 | Epsilon: 0.140 | FPS: 58
Step: 182562/1000000 | Episode: 1060 | Epsilon: 0.133 | FPS: 58
Step: 184338/1000000 | Episode: 1070 | Epsilon: 0.124 | FPS: 59
Step: 186204/1000000 | Episode: 1080 | Epsilon: 0.116 | FPS: 59
Step: 188350/1000000 | Episode: 1090 | Epsilon: 0.105 | FPS: 59
Step: 190244/1000000 | Episode: 1100 | Epsilon: 0.096 | FPS: 59
Step: 192040/1000000 | Episode: 1110 | Epsilon: 0.088 | FPS: 59
Step: 194007/1000000 | Episode: 1120 | Epsilon: 0.078 | FPS: 59
Step: 195714/1000000 | Episode: 1130 | Epsilon: 0.070 | FPS: 59
Step: 197529/1000000 | Episode: 1140 | Epsilon: 0.062 | FPS: 59
Step: 199581/1000000 | Episode: 1150 | Epsilon: 0.052 | FPS: 59

============================================================
Evaluating at step 200000/1000000 (20.0%)
Elapsed: 56m 32s | ETA: 3h 46m 11s | Speed: 58.9 steps/s
Eval - Mean Reward: 2.95 ± 1.06, Mean Length: 208
Achievements unlocked: 9/22
============================================================

[CHECKPOINT] Saved to logdir_extended_exploration/enhanced-dqn-extended/2/checkpoint_200000.pt
[CHECKPOINT] Total elapsed: 57m 21s | Since last checkpoint: 29m 50s
Step: 201492/1000000 | Episode: 1160 | Epsilon: 0.050 | FPS: 58
Step: 203324/1000000 | Episode: 1170 | Epsilon: 0.050 | FPS: 58
Step: 205281/1000000 | Episode: 1180 | Epsilon: 0.050 | FPS: 58
Step: 206889/1000000 | Episode: 1190 | Epsilon: 0.050 | FPS: 58
Step: 208991/1000000 | Episode: 1200 | Epsilon: 0.050 | FPS: 58
Step: 210780/1000000 | Episode: 1210 | Epsilon: 0.050 | FPS: 58
Step: 212531/1000000 | Episode: 1220 | Epsilon: 0.050 | FPS: 58
Step: 214102/1000000 | Episode: 1230 | Epsilon: 0.050 | FPS: 58
Step: 215987/1000000 | Episode: 1240 | Epsilon: 0.050 | FPS: 58
Step: 217795/1000000 | Episode: 1250 | Epsilon: 0.050 | FPS: 58
Step: 219486/1000000 | Episode: 1260 | Epsilon: 0.050 | FPS: 58
Step: 221320/1000000 | Episode: 1270 | Epsilon: 0.050 | FPS: 57
Step: 223073/1000000 | Episode: 1280 | Epsilon: 0.050 | FPS: 57
Step: 224715/1000000 | Episode: 1290 | Epsilon: 0.050 | FPS: 57
Step: 226387/1000000 | Episode: 1300 | Epsilon: 0.050 | FPS: 57
Step: 228263/1000000 | Episode: 1310 | Epsilon: 0.050 | FPS: 56
Step: 229852/1000000 | Episode: 1320 | Epsilon: 0.050 | FPS: 56
Step: 231703/1000000 | Episode: 1330 | Epsilon: 0.050 | FPS: 56
Step: 233823/1000000 | Episode: 1340 | Epsilon: 0.050 | FPS: 56
Step: 235647/1000000 | Episode: 1350 | Epsilon: 0.050 | FPS: 56
Step: 237586/1000000 | Episode: 1360 | Epsilon: 0.050 | FPS: 56
Step: 239581/1000000 | Episode: 1370 | Epsilon: 0.050 | FPS: 56
Step: 241317/1000000 | Episode: 1380 | Epsilon: 0.050 | FPS: 56
Step: 243179/1000000 | Episode: 1390 | Epsilon: 0.050 | FPS: 56
Step: 245040/1000000 | Episode: 1400 | Epsilon: 0.050 | FPS: 56
Step: 246825/1000000 | Episode: 1410 | Epsilon: 0.050 | FPS: 55
Step: 248728/1000000 | Episode: 1420 | Epsilon: 0.050 | FPS: 55

============================================================
Evaluating at step 250000/1000000 (25.0%)
Elapsed: 1h 15m 16s | ETA: 3h 45m 49s | Speed: 55.4 steps/s
Eval - Mean Reward: 3.80 ± 1.00, Mean Length: 211
Achievements unlocked: 7/22
============================================================

Step: 250509/1000000 | Episode: 1430 | Epsilon: 0.050 | FPS: 55
Step: 252377/1000000 | Episode: 1440 | Epsilon: 0.050 | FPS: 55
Step: 254388/1000000 | Episode: 1450 | Epsilon: 0.050 | FPS: 55
Step: 256362/1000000 | Episode: 1460 | Epsilon: 0.050 | FPS: 55
Step: 258128/1000000 | Episode: 1470 | Epsilon: 0.050 | FPS: 55
Step: 259842/1000000 | Episode: 1480 | Epsilon: 0.050 | FPS: 55
Step: 261523/1000000 | Episode: 1490 | Epsilon: 0.050 | FPS: 55
Step: 263263/1000000 | Episode: 1500 | Epsilon: 0.050 | FPS: 55
Step: 265158/1000000 | Episode: 1510 | Epsilon: 0.050 | FPS: 55
Step: 266984/1000000 | Episode: 1520 | Epsilon: 0.050 | FPS: 55
Step: 268674/1000000 | Episode: 1530 | Epsilon: 0.050 | FPS: 55
Step: 270487/1000000 | Episode: 1540 | Epsilon: 0.050 | FPS: 55
Step: 272293/1000000 | Episode: 1550 | Epsilon: 0.050 | FPS: 55
Step: 274075/1000000 | Episode: 1560 | Epsilon: 0.050 | FPS: 55
Step: 276107/1000000 | Episode: 1570 | Epsilon: 0.050 | FPS: 55
Step: 277835/1000000 | Episode: 1580 | Epsilon: 0.050 | FPS: 55
Step: 279935/1000000 | Episode: 1590 | Epsilon: 0.050 | FPS: 55
Step: 281793/1000000 | Episode: 1600 | Epsilon: 0.050 | FPS: 55
Step: 283675/1000000 | Episode: 1610 | Epsilon: 0.050 | FPS: 55
Step: 285424/1000000 | Episode: 1620 | Epsilon: 0.050 | FPS: 55
Step: 287203/1000000 | Episode: 1630 | Epsilon: 0.050 | FPS: 55
Step: 289081/1000000 | Episode: 1640 | Epsilon: 0.050 | FPS: 55
Step: 290977/1000000 | Episode: 1650 | Epsilon: 0.050 | FPS: 55
Step: 292836/1000000 | Episode: 1660 | Epsilon: 0.050 | FPS: 55
Step: 294747/1000000 | Episode: 1670 | Epsilon: 0.050 | FPS: 55
Step: 296957/1000000 | Episode: 1680 | Epsilon: 0.050 | FPS: 55
Step: 298490/1000000 | Episode: 1690 | Epsilon: 0.050 | FPS: 55
Step: 299980/1000000 | Episode: 1700 | Epsilon: 0.050 | FPS: 55

============================================================
Evaluating at step 300000/1000000 (30.0%)
Elapsed: 1h 30m 46s | ETA: 3h 31m 48s | Speed: 55.1 steps/s
Eval - Mean Reward: 3.40 ± 1.19, Mean Length: 190
Achievements unlocked: 7/22
============================================================

[CHECKPOINT] Saved to logdir_extended_exploration/enhanced-dqn-extended/2/checkpoint_300000.pt
[CHECKPOINT] Total elapsed: 1h 31m 32s | Since last checkpoint: 34m 11s
Step: 302319/1000000 | Episode: 1710 | Epsilon: 0.050 | FPS: 55
Step: 303946/1000000 | Episode: 1720 | Epsilon: 0.050 | FPS: 54
Step: 305921/1000000 | Episode: 1730 | Epsilon: 0.050 | FPS: 54
Step: 307883/1000000 | Episode: 1740 | Epsilon: 0.050 | FPS: 54
Step: 309795/1000000 | Episode: 1750 | Epsilon: 0.050 | FPS: 54
Step: 311725/1000000 | Episode: 1760 | Epsilon: 0.050 | FPS: 54
Step: 313481/1000000 | Episode: 1770 | Epsilon: 0.050 | FPS: 54
Step: 315185/1000000 | Episode: 1780 | Epsilon: 0.050 | FPS: 54
Step: 316838/1000000 | Episode: 1790 | Epsilon: 0.050 | FPS: 54
Step: 318787/1000000 | Episode: 1800 | Epsilon: 0.050 | FPS: 54
Step: 320905/1000000 | Episode: 1810 | Epsilon: 0.050 | FPS: 54
Step: 322954/1000000 | Episode: 1820 | Epsilon: 0.050 | FPS: 54
Step: 324502/1000000 | Episode: 1830 | Epsilon: 0.050 | FPS: 54
Step: 326184/1000000 | Episode: 1840 | Epsilon: 0.050 | FPS: 54
Step: 327712/1000000 | Episode: 1850 | Epsilon: 0.050 | FPS: 54
Step: 329397/1000000 | Episode: 1860 | Epsilon: 0.050 | FPS: 54
Step: 331417/1000000 | Episode: 1870 | Epsilon: 0.050 | FPS: 54
Step: 333086/1000000 | Episode: 1880 | Epsilon: 0.050 | FPS: 54
Step: 335345/1000000 | Episode: 1890 | Epsilon: 0.050 | FPS: 54
Step: 337519/1000000 | Episode: 1900 | Epsilon: 0.050 | FPS: 54
Step: 339621/1000000 | Episode: 1910 | Epsilon: 0.050 | FPS: 54
Step: 341523/1000000 | Episode: 1920 | Epsilon: 0.050 | FPS: 54
Step: 343552/1000000 | Episode: 1930 | Epsilon: 0.050 | FPS: 54
Step: 345390/1000000 | Episode: 1940 | Epsilon: 0.050 | FPS: 54
Step: 347321/1000000 | Episode: 1950 | Epsilon: 0.050 | FPS: 54
Step: 348953/1000000 | Episode: 1960 | Epsilon: 0.050 | FPS: 54

============================================================
Evaluating at step 350000/1000000 (35.0%)
Elapsed: 1h 48m 23s | ETA: 3h 21m 18s | Speed: 53.8 steps/s
Eval - Mean Reward: 4.15 ± 1.16, Mean Length: 174
Achievements unlocked: 9/22
============================================================

Step: 350698/1000000 | Episode: 1970 | Epsilon: 0.050 | FPS: 53
Step: 352719/1000000 | Episode: 1980 | Epsilon: 0.050 | FPS: 54
Step: 354731/1000000 | Episode: 1990 | Epsilon: 0.050 | FPS: 54
Step: 357214/1000000 | Episode: 2000 | Epsilon: 0.050 | FPS: 54
Step: 359140/1000000 | Episode: 2010 | Epsilon: 0.050 | FPS: 54
Step: 361281/1000000 | Episode: 2020 | Epsilon: 0.050 | FPS: 54
Step: 363011/1000000 | Episode: 2030 | Epsilon: 0.050 | FPS: 54
Step: 364735/1000000 | Episode: 2040 | Epsilon: 0.050 | FPS: 54
Step: 366690/1000000 | Episode: 2050 | Epsilon: 0.050 | FPS: 54
Step: 368438/1000000 | Episode: 2060 | Epsilon: 0.050 | FPS: 54
Step: 370273/1000000 | Episode: 2070 | Epsilon: 0.050 | FPS: 54
Step: 371974/1000000 | Episode: 2080 | Epsilon: 0.050 | FPS: 54
Step: 373726/1000000 | Episode: 2090 | Epsilon: 0.050 | FPS: 54
Step: 375331/1000000 | Episode: 2100 | Epsilon: 0.050 | FPS: 54
Step: 377289/1000000 | Episode: 2110 | Epsilon: 0.050 | FPS: 53
Step: 379092/1000000 | Episode: 2120 | Epsilon: 0.050 | FPS: 53
Step: 381071/1000000 | Episode: 2130 | Epsilon: 0.050 | FPS: 53
Step: 382861/1000000 | Episode: 2140 | Epsilon: 0.050 | FPS: 53
Step: 384628/1000000 | Episode: 2150 | Epsilon: 0.050 | FPS: 53
Step: 386910/1000000 | Episode: 2160 | Epsilon: 0.050 | FPS: 53
Step: 388783/1000000 | Episode: 2170 | Epsilon: 0.050 | FPS: 53
Step: 390477/1000000 | Episode: 2180 | Epsilon: 0.050 | FPS: 53
Step: 392276/1000000 | Episode: 2190 | Epsilon: 0.050 | FPS: 53
Step: 394056/1000000 | Episode: 2200 | Epsilon: 0.050 | FPS: 53
Step: 396382/1000000 | Episode: 2210 | Epsilon: 0.050 | FPS: 53
Step: 398226/1000000 | Episode: 2220 | Epsilon: 0.050 | FPS: 53

============================================================
Evaluating at step 400000/1000000 (40.0%)
Elapsed: 2h 4m 37s | ETA: 3h 6m 56s | Speed: 53.5 steps/s
Eval - Mean Reward: 4.25 ± 1.11, Mean Length: 189
Achievements unlocked: 10/22
============================================================

[CHECKPOINT] Saved to logdir_extended_exploration/enhanced-dqn-extended/2/checkpoint_400000.pt
[CHECKPOINT] Total elapsed: 2h 5m 23s | Since last checkpoint: 33m 50s
Step: 400116/1000000 | Episode: 2230 | Epsilon: 0.050 | FPS: 53
Step: 401972/1000000 | Episode: 2240 | Epsilon: 0.050 | FPS: 53
Step: 403945/1000000 | Episode: 2250 | Epsilon: 0.050 | FPS: 53
Step: 406194/1000000 | Episode: 2260 | Epsilon: 0.050 | FPS: 53
Step: 407998/1000000 | Episode: 2270 | Epsilon: 0.050 | FPS: 53
Step: 409725/1000000 | Episode: 2280 | Epsilon: 0.050 | FPS: 53
Step: 411403/1000000 | Episode: 2290 | Epsilon: 0.050 | FPS: 53
Step: 413254/1000000 | Episode: 2300 | Epsilon: 0.050 | FPS: 53
Step: 415326/1000000 | Episode: 2310 | Epsilon: 0.050 | FPS: 53
Step: 417145/1000000 | Episode: 2320 | Epsilon: 0.050 | FPS: 53
Step: 419012/1000000 | Episode: 2330 | Epsilon: 0.050 | FPS: 53
Step: 420914/1000000 | Episode: 2340 | Epsilon: 0.050 | FPS: 53
Step: 422732/1000000 | Episode: 2350 | Epsilon: 0.050 | FPS: 53
Step: 424592/1000000 | Episode: 2360 | Epsilon: 0.050 | FPS: 53
Step: 426390/1000000 | Episode: 2370 | Epsilon: 0.050 | FPS: 53
Step: 428432/1000000 | Episode: 2380 | Epsilon: 0.050 | FPS: 53
Step: 430475/1000000 | Episode: 2390 | Epsilon: 0.050 | FPS: 54
Step: 432467/1000000 | Episode: 2400 | Epsilon: 0.050 | FPS: 54
Step: 434392/1000000 | Episode: 2410 | Epsilon: 0.050 | FPS: 53
Step: 436023/1000000 | Episode: 2420 | Epsilon: 0.050 | FPS: 54
Step: 437608/1000000 | Episode: 2430 | Epsilon: 0.050 | FPS: 53
Step: 439613/1000000 | Episode: 2440 | Epsilon: 0.050 | FPS: 53
Step: 441396/1000000 | Episode: 2450 | Epsilon: 0.050 | FPS: 53
Step: 443056/1000000 | Episode: 2460 | Epsilon: 0.050 | FPS: 53
Step: 444643/1000000 | Episode: 2470 | Epsilon: 0.050 | FPS: 53
Step: 446395/1000000 | Episode: 2480 | Epsilon: 0.050 | FPS: 53
Step: 448496/1000000 | Episode: 2490 | Epsilon: 0.050 | FPS: 53

============================================================
Evaluating at step 450000/1000000 (45.0%)
Elapsed: 2h 20m 33s | ETA: 2h 51m 48s | Speed: 53.4 steps/s
Eval - Mean Reward: 4.00 ± 1.41, Mean Length: 186
Achievements unlocked: 9/22
============================================================

Step: 450275/1000000 | Episode: 2500 | Epsilon: 0.050 | FPS: 53
Step: 452569/1000000 | Episode: 2510 | Epsilon: 0.050 | FPS: 53
Step: 454362/1000000 | Episode: 2520 | Epsilon: 0.050 | FPS: 53
Step: 456234/1000000 | Episode: 2530 | Epsilon: 0.050 | FPS: 53
Step: 458251/1000000 | Episode: 2540 | Epsilon: 0.050 | FPS: 53
Step: 460103/1000000 | Episode: 2550 | Epsilon: 0.050 | FPS: 53
Step: 461873/1000000 | Episode: 2560 | Epsilon: 0.050 | FPS: 53
Step: 463727/1000000 | Episode: 2570 | Epsilon: 0.050 | FPS: 53
Step: 465686/1000000 | Episode: 2580 | Epsilon: 0.050 | FPS: 53
Step: 467655/1000000 | Episode: 2590 | Epsilon: 0.050 | FPS: 53
Step: 469463/1000000 | Episode: 2600 | Epsilon: 0.050 | FPS: 53
Step: 471170/1000000 | Episode: 2610 | Epsilon: 0.050 | FPS: 53
Step: 472965/1000000 | Episode: 2620 | Epsilon: 0.050 | FPS: 53
Step: 474860/1000000 | Episode: 2630 | Epsilon: 0.050 | FPS: 53
Step: 477070/1000000 | Episode: 2640 | Epsilon: 0.050 | FPS: 53
Step: 478844/1000000 | Episode: 2650 | Epsilon: 0.050 | FPS: 53
Step: 480705/1000000 | Episode: 2660 | Epsilon: 0.050 | FPS: 53
Step: 482537/1000000 | Episode: 2670 | Epsilon: 0.050 | FPS: 53
Step: 484508/1000000 | Episode: 2680 | Epsilon: 0.050 | FPS: 53
Step: 486304/1000000 | Episode: 2690 | Epsilon: 0.050 | FPS: 53
Step: 488187/1000000 | Episode: 2700 | Epsilon: 0.050 | FPS: 53
Step: 490019/1000000 | Episode: 2710 | Epsilon: 0.050 | FPS: 53
Step: 491778/1000000 | Episode: 2720 | Epsilon: 0.050 | FPS: 53
Step: 493797/1000000 | Episode: 2730 | Epsilon: 0.050 | FPS: 53
Step: 495611/1000000 | Episode: 2740 | Epsilon: 0.050 | FPS: 53
Step: 497557/1000000 | Episode: 2750 | Epsilon: 0.050 | FPS: 53
Step: 499604/1000000 | Episode: 2760 | Epsilon: 0.050 | FPS: 53

============================================================
Evaluating at step 500000/1000000 (50.0%)
Elapsed: 2h 36m 55s | ETA: 2h 36m 55s | Speed: 53.1 steps/s
Eval - Mean Reward: 4.00 ± 1.18, Mean Length: 164
Achievements unlocked: 8/22
============================================================

[CHECKPOINT] Saved to logdir_extended_exploration/enhanced-dqn-extended/2/checkpoint_500000.pt
[CHECKPOINT] Total elapsed: 2h 37m 50s | Since last checkpoint: 32m 26s
Step: 501655/1000000 | Episode: 2770 | Epsilon: 0.050 | FPS: 53
Step: 503392/1000000 | Episode: 2780 | Epsilon: 0.050 | FPS: 53
Step: 505377/1000000 | Episode: 2790 | Epsilon: 0.050 | FPS: 53
Step: 507314/1000000 | Episode: 2800 | Epsilon: 0.050 | FPS: 53
Step: 509201/1000000 | Episode: 2810 | Epsilon: 0.050 | FPS: 53
Step: 510940/1000000 | Episode: 2820 | Epsilon: 0.050 | FPS: 53
Step: 512820/1000000 | Episode: 2830 | Epsilon: 0.050 | FPS: 53
Step: 514814/1000000 | Episode: 2840 | Epsilon: 0.050 | FPS: 53
Step: 516351/1000000 | Episode: 2850 | Epsilon: 0.050 | FPS: 53
Step: 517987/1000000 | Episode: 2860 | Epsilon: 0.050 | FPS: 53
Step: 519979/1000000 | Episode: 2870 | Epsilon: 0.050 | FPS: 53
Step: 521821/1000000 | Episode: 2880 | Epsilon: 0.050 | FPS: 53
Step: 523520/1000000 | Episode: 2890 | Epsilon: 0.050 | FPS: 53
Step: 525264/1000000 | Episode: 2900 | Epsilon: 0.050 | FPS: 53
Step: 526793/1000000 | Episode: 2910 | Epsilon: 0.050 | FPS: 53
Step: 528514/1000000 | Episode: 2920 | Epsilon: 0.050 | FPS: 53
Step: 530282/1000000 | Episode: 2930 | Epsilon: 0.050 | FPS: 53
Step: 532020/1000000 | Episode: 2940 | Epsilon: 0.050 | FPS: 53
Step: 533923/1000000 | Episode: 2950 | Epsilon: 0.050 | FPS: 53
Step: 535858/1000000 | Episode: 2960 | Epsilon: 0.050 | FPS: 53
Step: 537577/1000000 | Episode: 2970 | Epsilon: 0.050 | FPS: 53
Step: 539363/1000000 | Episode: 2980 | Epsilon: 0.050 | FPS: 53
Step: 541320/1000000 | Episode: 2990 | Epsilon: 0.050 | FPS: 53
Step: 543293/1000000 | Episode: 3000 | Epsilon: 0.050 | FPS: 53
Step: 545047/1000000 | Episode: 3010 | Epsilon: 0.050 | FPS: 53
Step: 546804/1000000 | Episode: 3020 | Epsilon: 0.050 | FPS: 53
Step: 548550/1000000 | Episode: 3030 | Epsilon: 0.050 | FPS: 53

============================================================
Evaluating at step 550000/1000000 (55.0%)
Elapsed: 2h 52m 22s | ETA: 2h 21m 2s | Speed: 53.2 steps/s
Eval - Mean Reward: 4.10 ± 1.22, Mean Length: 181
Achievements unlocked: 9/22
============================================================

Step: 550770/1000000 | Episode: 3040 | Epsilon: 0.050 | FPS: 53
Step: 552711/1000000 | Episode: 3050 | Epsilon: 0.050 | FPS: 53
Step: 554586/1000000 | Episode: 3060 | Epsilon: 0.050 | FPS: 53
Step: 556541/1000000 | Episode: 3070 | Epsilon: 0.050 | FPS: 53
Step: 558458/1000000 | Episode: 3080 | Epsilon: 0.050 | FPS: 53
Step: 560472/1000000 | Episode: 3090 | Epsilon: 0.050 | FPS: 53
Step: 562324/1000000 | Episode: 3100 | Epsilon: 0.050 | FPS: 53
Step: 563970/1000000 | Episode: 3110 | Epsilon: 0.050 | FPS: 53
Step: 565740/1000000 | Episode: 3120 | Epsilon: 0.050 | FPS: 53
Step: 567340/1000000 | Episode: 3130 | Epsilon: 0.050 | FPS: 53
Step: 569329/1000000 | Episode: 3140 | Epsilon: 0.050 | FPS: 53
Step: 571147/1000000 | Episode: 3150 | Epsilon: 0.050 | FPS: 53
Step: 572899/1000000 | Episode: 3160 | Epsilon: 0.050 | FPS: 53
Step: 574813/1000000 | Episode: 3170 | Epsilon: 0.050 | FPS: 53
Step: 576617/1000000 | Episode: 3180 | Epsilon: 0.050 | FPS: 53
Step: 578617/1000000 | Episode: 3190 | Epsilon: 0.050 | FPS: 53
Step: 580410/1000000 | Episode: 3200 | Epsilon: 0.050 | FPS: 54
Step: 582489/1000000 | Episode: 3210 | Epsilon: 0.050 | FPS: 54
Step: 584433/1000000 | Episode: 3220 | Epsilon: 0.050 | FPS: 53
Step: 586253/1000000 | Episode: 3230 | Epsilon: 0.050 | FPS: 53
Step: 588030/1000000 | Episode: 3240 | Epsilon: 0.050 | FPS: 53
Step: 589893/1000000 | Episode: 3250 | Epsilon: 0.050 | FPS: 53
Step: 591828/1000000 | Episode: 3260 | Epsilon: 0.050 | FPS: 53
Step: 593711/1000000 | Episode: 3270 | Epsilon: 0.050 | FPS: 53
Step: 595367/1000000 | Episode: 3280 | Epsilon: 0.050 | FPS: 53
Step: 597102/1000000 | Episode: 3290 | Epsilon: 0.050 | FPS: 53
Step: 599020/1000000 | Episode: 3300 | Epsilon: 0.050 | FPS: 53

============================================================
Evaluating at step 600000/1000000 (60.0%)
Elapsed: 3h 7m 10s | ETA: 2h 4m 47s | Speed: 53.4 steps/s
Eval - Mean Reward: 3.90 ± 1.44, Mean Length: 179
Achievements unlocked: 9/22
============================================================

[CHECKPOINT] Saved to logdir_extended_exploration/enhanced-dqn-extended/2/checkpoint_600000.pt
[CHECKPOINT] Total elapsed: 3h 7m 55s | Since last checkpoint: 30m 5s
Step: 600823/1000000 | Episode: 3310 | Epsilon: 0.050 | FPS: 53
Step: 602756/1000000 | Episode: 3320 | Epsilon: 0.050 | FPS: 53
Step: 604507/1000000 | Episode: 3330 | Epsilon: 0.050 | FPS: 53
Step: 606647/1000000 | Episode: 3340 | Epsilon: 0.050 | FPS: 53
Step: 608478/1000000 | Episode: 3350 | Epsilon: 0.050 | FPS: 53
Step: 610267/1000000 | Episode: 3360 | Epsilon: 0.050 | FPS: 53
Step: 612414/1000000 | Episode: 3370 | Epsilon: 0.050 | FPS: 53
Step: 614580/1000000 | Episode: 3380 | Epsilon: 0.050 | FPS: 53
Step: 616080/1000000 | Episode: 3390 | Epsilon: 0.050 | FPS: 53
Step: 617856/1000000 | Episode: 3400 | Epsilon: 0.050 | FPS: 53
Step: 620013/1000000 | Episode: 3410 | Epsilon: 0.050 | FPS: 54
Step: 621815/1000000 | Episode: 3420 | Epsilon: 0.050 | FPS: 54
Step: 623627/1000000 | Episode: 3430 | Epsilon: 0.050 | FPS: 54
Step: 625564/1000000 | Episode: 3440 | Epsilon: 0.050 | FPS: 54
Step: 627386/1000000 | Episode: 3450 | Epsilon: 0.050 | FPS: 54
Step: 629121/1000000 | Episode: 3460 | Epsilon: 0.050 | FPS: 54
Step: 631256/1000000 | Episode: 3470 | Epsilon: 0.050 | FPS: 54
Step: 633014/1000000 | Episode: 3480 | Epsilon: 0.050 | FPS: 54
Step: 634816/1000000 | Episode: 3490 | Epsilon: 0.050 | FPS: 54
Step: 636932/1000000 | Episode: 3500 | Epsilon: 0.050 | FPS: 54
Step: 638889/1000000 | Episode: 3510 | Epsilon: 0.050 | FPS: 54
Step: 640968/1000000 | Episode: 3520 | Epsilon: 0.050 | FPS: 54
Step: 642855/1000000 | Episode: 3530 | Epsilon: 0.050 | FPS: 54
Step: 644922/1000000 | Episode: 3540 | Epsilon: 0.050 | FPS: 54
Step: 646706/1000000 | Episode: 3550 | Epsilon: 0.050 | FPS: 54
Step: 648794/1000000 | Episode: 3560 | Epsilon: 0.050 | FPS: 54

============================================================
Evaluating at step 650000/1000000 (65.0%)
Elapsed: 3h 20m 43s | ETA: 1h 48m 5s | Speed: 54.0 steps/s
Eval - Mean Reward: 4.70 ± 1.07, Mean Length: 175
Achievements unlocked: 9/22
============================================================

Step: 651054/1000000 | Episode: 3570 | Epsilon: 0.050 | FPS: 54
Step: 652912/1000000 | Episode: 3580 | Epsilon: 0.050 | FPS: 54
Step: 654654/1000000 | Episode: 3590 | Epsilon: 0.050 | FPS: 54
Step: 656761/1000000 | Episode: 3600 | Epsilon: 0.050 | FPS: 54
Step: 658708/1000000 | Episode: 3610 | Epsilon: 0.050 | FPS: 54
Step: 660560/1000000 | Episode: 3620 | Epsilon: 0.050 | FPS: 54
Step: 662446/1000000 | Episode: 3630 | Epsilon: 0.050 | FPS: 54
Step: 663980/1000000 | Episode: 3640 | Epsilon: 0.050 | FPS: 54
Step: 665927/1000000 | Episode: 3650 | Epsilon: 0.050 | FPS: 54
Step: 667577/1000000 | Episode: 3660 | Epsilon: 0.050 | FPS: 54
Step: 669426/1000000 | Episode: 3670 | Epsilon: 0.050 | FPS: 54
Step: 671248/1000000 | Episode: 3680 | Epsilon: 0.050 | FPS: 54
Step: 673064/1000000 | Episode: 3690 | Epsilon: 0.050 | FPS: 54
Step: 674850/1000000 | Episode: 3700 | Epsilon: 0.050 | FPS: 54
Step: 676466/1000000 | Episode: 3710 | Epsilon: 0.050 | FPS: 54
Step: 678294/1000000 | Episode: 3720 | Epsilon: 0.050 | FPS: 54
Step: 680351/1000000 | Episode: 3730 | Epsilon: 0.050 | FPS: 54
Step: 682293/1000000 | Episode: 3740 | Epsilon: 0.050 | FPS: 54
Step: 684117/1000000 | Episode: 3750 | Epsilon: 0.050 | FPS: 54
Step: 685961/1000000 | Episode: 3760 | Epsilon: 0.050 | FPS: 54
Step: 687911/1000000 | Episode: 3770 | Epsilon: 0.050 | FPS: 54
Step: 689858/1000000 | Episode: 3780 | Epsilon: 0.050 | FPS: 54
Step: 691949/1000000 | Episode: 3790 | Epsilon: 0.050 | FPS: 54
Step: 693675/1000000 | Episode: 3800 | Epsilon: 0.050 | FPS: 54
Step: 695637/1000000 | Episode: 3810 | Epsilon: 0.050 | FPS: 54
Step: 697355/1000000 | Episode: 3820 | Epsilon: 0.050 | FPS: 54
Step: 699142/1000000 | Episode: 3830 | Epsilon: 0.050 | FPS: 54

============================================================
Evaluating at step 700000/1000000 (70.0%)
Elapsed: 3h 36m 13s | ETA: 1h 32m 40s | Speed: 54.0 steps/s
Eval - Mean Reward: 4.30 ± 0.93, Mean Length: 185
Achievements unlocked: 8/22
============================================================

[CHECKPOINT] Saved to logdir_extended_exploration/enhanced-dqn-extended/2/checkpoint_700000.pt
[CHECKPOINT] Total elapsed: 3h 36m 59s | Since last checkpoint: 29m 4s
Step: 700907/1000000 | Episode: 3840 | Epsilon: 0.050 | FPS: 54
Step: 702730/1000000 | Episode: 3850 | Epsilon: 0.050 | FPS: 54
Step: 704680/1000000 | Episode: 3860 | Epsilon: 0.050 | FPS: 54
Step: 706563/1000000 | Episode: 3870 | Epsilon: 0.050 | FPS: 54
Step: 708541/1000000 | Episode: 3880 | Epsilon: 0.050 | FPS: 54
Step: 710306/1000000 | Episode: 3890 | Epsilon: 0.050 | FPS: 54
Step: 712102/1000000 | Episode: 3900 | Epsilon: 0.050 | FPS: 54
Step: 713793/1000000 | Episode: 3910 | Epsilon: 0.050 | FPS: 54
Step: 715626/1000000 | Episode: 3920 | Epsilon: 0.050 | FPS: 54
Step: 717449/1000000 | Episode: 3930 | Epsilon: 0.050 | FPS: 54
Step: 719338/1000000 | Episode: 3940 | Epsilon: 0.050 | FPS: 54
Step: 721133/1000000 | Episode: 3950 | Epsilon: 0.050 | FPS: 54
Step: 722683/1000000 | Episode: 3960 | Epsilon: 0.050 | FPS: 54
Step: 724376/1000000 | Episode: 3970 | Epsilon: 0.050 | FPS: 54
Step: 726600/1000000 | Episode: 3980 | Epsilon: 0.050 | FPS: 54
Step: 728542/1000000 | Episode: 3990 | Epsilon: 0.050 | FPS: 54
Step: 730740/1000000 | Episode: 4000 | Epsilon: 0.050 | FPS: 54
Step: 732621/1000000 | Episode: 4010 | Epsilon: 0.050 | FPS: 54
Step: 734689/1000000 | Episode: 4020 | Epsilon: 0.050 | FPS: 54
Step: 736335/1000000 | Episode: 4030 | Epsilon: 0.050 | FPS: 54
Step: 737966/1000000 | Episode: 4040 | Epsilon: 0.050 | FPS: 54
Step: 740003/1000000 | Episode: 4050 | Epsilon: 0.050 | FPS: 54
Step: 741982/1000000 | Episode: 4060 | Epsilon: 0.050 | FPS: 54
Step: 743713/1000000 | Episode: 4070 | Epsilon: 0.050 | FPS: 54
Step: 745601/1000000 | Episode: 4080 | Epsilon: 0.050 | FPS: 54
Step: 747324/1000000 | Episode: 4090 | Epsilon: 0.050 | FPS: 54
Step: 749181/1000000 | Episode: 4100 | Epsilon: 0.050 | FPS: 54

============================================================
Evaluating at step 750000/1000000 (75.0%)
Elapsed: 3h 50m 51s | ETA: 1h 16m 57s | Speed: 54.1 steps/s
Eval - Mean Reward: 4.60 ± 0.97, Mean Length: 176
Achievements unlocked: 9/22
============================================================

Step: 750819/1000000 | Episode: 4110 | Epsilon: 0.050 | FPS: 54
Step: 752526/1000000 | Episode: 4120 | Epsilon: 0.050 | FPS: 54
Step: 754280/1000000 | Episode: 4130 | Epsilon: 0.050 | FPS: 54
Step: 756190/1000000 | Episode: 4140 | Epsilon: 0.050 | FPS: 54
Step: 757959/1000000 | Episode: 4150 | Epsilon: 0.050 | FPS: 54
Step: 760176/1000000 | Episode: 4160 | Epsilon: 0.050 | FPS: 54
Step: 762008/1000000 | Episode: 4170 | Epsilon: 0.050 | FPS: 54
Step: 763796/1000000 | Episode: 4180 | Epsilon: 0.050 | FPS: 54
Step: 765464/1000000 | Episode: 4190 | Epsilon: 0.050 | FPS: 54
Step: 767114/1000000 | Episode: 4200 | Epsilon: 0.050 | FPS: 54
Step: 768803/1000000 | Episode: 4210 | Epsilon: 0.050 | FPS: 54
Step: 770487/1000000 | Episode: 4220 | Epsilon: 0.050 | FPS: 54
Step: 772213/1000000 | Episode: 4230 | Epsilon: 0.050 | FPS: 54
Step: 774266/1000000 | Episode: 4240 | Epsilon: 0.050 | FPS: 54
Step: 776238/1000000 | Episode: 4250 | Epsilon: 0.050 | FPS: 54
Step: 778116/1000000 | Episode: 4260 | Epsilon: 0.050 | FPS: 54
Step: 780118/1000000 | Episode: 4270 | Epsilon: 0.050 | FPS: 54
Step: 781792/1000000 | Episode: 4280 | Epsilon: 0.050 | FPS: 54
Step: 783731/1000000 | Episode: 4290 | Epsilon: 0.050 | FPS: 54
Step: 785496/1000000 | Episode: 4300 | Epsilon: 0.050 | FPS: 54
Step: 787433/1000000 | Episode: 4310 | Epsilon: 0.050 | FPS: 54
Step: 789307/1000000 | Episode: 4320 | Epsilon: 0.050 | FPS: 54
Step: 791132/1000000 | Episode: 4330 | Epsilon: 0.050 | FPS: 54
Step: 792810/1000000 | Episode: 4340 | Epsilon: 0.050 | FPS: 54
Step: 794451/1000000 | Episode: 4350 | Epsilon: 0.050 | FPS: 54
Step: 796328/1000000 | Episode: 4360 | Epsilon: 0.050 | FPS: 54
Step: 798208/1000000 | Episode: 4370 | Epsilon: 0.050 | FPS: 54

============================================================
Evaluating at step 800000/1000000 (80.0%)
Elapsed: 4h 5m 53s | ETA: 1h 1m 28s | Speed: 54.2 steps/s
Eval - Mean Reward: 4.60 ± 1.16, Mean Length: 180
Achievements unlocked: 10/22
============================================================

[CHECKPOINT] Saved to logdir_extended_exploration/enhanced-dqn-extended/2/checkpoint_800000.pt
[CHECKPOINT] Total elapsed: 4h 6m 38s | Since last checkpoint: 29m 38s
Step: 800137/1000000 | Episode: 4380 | Epsilon: 0.050 | FPS: 54
Step: 801823/1000000 | Episode: 4390 | Epsilon: 0.050 | FPS: 54
Step: 803653/1000000 | Episode: 4400 | Epsilon: 0.050 | FPS: 54
Step: 805421/1000000 | Episode: 4410 | Epsilon: 0.050 | FPS: 54
Step: 807221/1000000 | Episode: 4420 | Epsilon: 0.050 | FPS: 54
Step: 809111/1000000 | Episode: 4430 | Epsilon: 0.050 | FPS: 54
Step: 811310/1000000 | Episode: 4440 | Epsilon: 0.050 | FPS: 54
Step: 812988/1000000 | Episode: 4450 | Epsilon: 0.050 | FPS: 54
Step: 814826/1000000 | Episode: 4460 | Epsilon: 0.050 | FPS: 54
Step: 816631/1000000 | Episode: 4470 | Epsilon: 0.050 | FPS: 54
Step: 818866/1000000 | Episode: 4480 | Epsilon: 0.050 | FPS: 54
Step: 821078/1000000 | Episode: 4490 | Epsilon: 0.050 | FPS: 54
Step: 822764/1000000 | Episode: 4500 | Epsilon: 0.050 | FPS: 54
Step: 824817/1000000 | Episode: 4510 | Epsilon: 0.050 | FPS: 54
Step: 826775/1000000 | Episode: 4520 | Epsilon: 0.050 | FPS: 54
Step: 828580/1000000 | Episode: 4530 | Epsilon: 0.050 | FPS: 54
Step: 830171/1000000 | Episode: 4540 | Epsilon: 0.050 | FPS: 54
Step: 831921/1000000 | Episode: 4550 | Epsilon: 0.050 | FPS: 54
Step: 833592/1000000 | Episode: 4560 | Epsilon: 0.050 | FPS: 54
Step: 835547/1000000 | Episode: 4570 | Epsilon: 0.050 | FPS: 54
Step: 837526/1000000 | Episode: 4580 | Epsilon: 0.050 | FPS: 54
Step: 839373/1000000 | Episode: 4590 | Epsilon: 0.050 | FPS: 54
Step: 841451/1000000 | Episode: 4600 | Epsilon: 0.050 | FPS: 54
Step: 842893/1000000 | Episode: 4610 | Epsilon: 0.050 | FPS: 54
Step: 844427/1000000 | Episode: 4620 | Epsilon: 0.050 | FPS: 54
Step: 846330/1000000 | Episode: 4630 | Epsilon: 0.050 | FPS: 54
Step: 848051/1000000 | Episode: 4640 | Epsilon: 0.050 | FPS: 54
Step: 849800/1000000 | Episode: 4650 | Epsilon: 0.050 | FPS: 54

============================================================
Evaluating at step 850000/1000000 (85.0%)
Elapsed: 4h 22m 5s | ETA: 46m 15s | Speed: 54.1 steps/s
Eval - Mean Reward: 4.05 ± 0.97, Mean Length: 179
Achievements unlocked: 8/22
============================================================

Step: 851610/1000000 | Episode: 4660 | Epsilon: 0.050 | FPS: 54
Step: 853524/1000000 | Episode: 4670 | Epsilon: 0.050 | FPS: 54
Step: 855290/1000000 | Episode: 4680 | Epsilon: 0.050 | FPS: 54
Step: 857239/1000000 | Episode: 4690 | Epsilon: 0.050 | FPS: 54
Step: 859009/1000000 | Episode: 4700 | Epsilon: 0.050 | FPS: 54
Step: 860755/1000000 | Episode: 4710 | Epsilon: 0.050 | FPS: 54
Step: 862681/1000000 | Episode: 4720 | Epsilon: 0.050 | FPS: 54
Step: 864482/1000000 | Episode: 4730 | Epsilon: 0.050 | FPS: 54
Step: 866491/1000000 | Episode: 4740 | Epsilon: 0.050 | FPS: 54
Step: 868597/1000000 | Episode: 4750 | Epsilon: 0.050 | FPS: 54
Step: 870254/1000000 | Episode: 4760 | Epsilon: 0.050 | FPS: 54
Step: 872124/1000000 | Episode: 4770 | Epsilon: 0.050 | FPS: 54
Step: 873690/1000000 | Episode: 4780 | Epsilon: 0.050 | FPS: 54
Step: 875463/1000000 | Episode: 4790 | Epsilon: 0.050 | FPS: 54
Step: 877412/1000000 | Episode: 4800 | Epsilon: 0.050 | FPS: 54
Step: 879273/1000000 | Episode: 4810 | Epsilon: 0.050 | FPS: 54
Step: 881155/1000000 | Episode: 4820 | Epsilon: 0.050 | FPS: 54
Step: 883021/1000000 | Episode: 4830 | Epsilon: 0.050 | FPS: 54
Step: 884776/1000000 | Episode: 4840 | Epsilon: 0.050 | FPS: 54
Step: 886508/1000000 | Episode: 4850 | Epsilon: 0.050 | FPS: 54
Step: 888261/1000000 | Episode: 4860 | Epsilon: 0.050 | FPS: 54
Step: 890011/1000000 | Episode: 4870 | Epsilon: 0.050 | FPS: 54
Step: 891858/1000000 | Episode: 4880 | Epsilon: 0.050 | FPS: 54
Step: 893630/1000000 | Episode: 4890 | Epsilon: 0.050 | FPS: 54
Step: 895513/1000000 | Episode: 4900 | Epsilon: 0.050 | FPS: 54
Step: 897554/1000000 | Episode: 4910 | Epsilon: 0.050 | FPS: 54
Step: 899071/1000000 | Episode: 4920 | Epsilon: 0.050 | FPS: 54

============================================================
Evaluating at step 900000/1000000 (90.0%)
Elapsed: 4h 37m 0s | ETA: 30m 46s | Speed: 54.1 steps/s
Eval - Mean Reward: 4.50 ± 1.07, Mean Length: 185
Achievements unlocked: 7/22
============================================================

[CHECKPOINT] Saved to logdir_extended_exploration/enhanced-dqn-extended/2/checkpoint_900000.pt
[CHECKPOINT] Total elapsed: 4h 37m 45s | Since last checkpoint: 31m 7s
Step: 900933/1000000 | Episode: 4930 | Epsilon: 0.050 | FPS: 54
Step: 902879/1000000 | Episode: 4940 | Epsilon: 0.050 | FPS: 54
Step: 904707/1000000 | Episode: 4950 | Epsilon: 0.050 | FPS: 54
Step: 906520/1000000 | Episode: 4960 | Epsilon: 0.050 | FPS: 54
Step: 908578/1000000 | Episode: 4970 | Epsilon: 0.050 | FPS: 54
Step: 910550/1000000 | Episode: 4980 | Epsilon: 0.050 | FPS: 54
Step: 912291/1000000 | Episode: 4990 | Epsilon: 0.050 | FPS: 54
Step: 914204/1000000 | Episode: 5000 | Epsilon: 0.050 | FPS: 54
Step: 916131/1000000 | Episode: 5010 | Epsilon: 0.050 | FPS: 54
Step: 918220/1000000 | Episode: 5020 | Epsilon: 0.050 | FPS: 54
Step: 919885/1000000 | Episode: 5030 | Epsilon: 0.050 | FPS: 54
Step: 921652/1000000 | Episode: 5040 | Epsilon: 0.050 | FPS: 54
Step: 923084/1000000 | Episode: 5050 | Epsilon: 0.050 | FPS: 54
Step: 924990/1000000 | Episode: 5060 | Epsilon: 0.050 | FPS: 54
Step: 926939/1000000 | Episode: 5070 | Epsilon: 0.050 | FPS: 54
Step: 929004/1000000 | Episode: 5080 | Epsilon: 0.050 | FPS: 54
Step: 930828/1000000 | Episode: 5090 | Epsilon: 0.050 | FPS: 54
Step: 932581/1000000 | Episode: 5100 | Epsilon: 0.050 | FPS: 54
Step: 934469/1000000 | Episode: 5110 | Epsilon: 0.050 | FPS: 54
Step: 936570/1000000 | Episode: 5120 | Epsilon: 0.050 | FPS: 54
Step: 938346/1000000 | Episode: 5130 | Epsilon: 0.050 | FPS: 54
Step: 940294/1000000 | Episode: 5140 | Epsilon: 0.050 | FPS: 54
Step: 942493/1000000 | Episode: 5150 | Epsilon: 0.050 | FPS: 54
Step: 944621/1000000 | Episode: 5160 | Epsilon: 0.050 | FPS: 54
Step: 946539/1000000 | Episode: 5170 | Epsilon: 0.050 | FPS: 54
Step: 948470/1000000 | Episode: 5180 | Epsilon: 0.050 | FPS: 54

============================================================
Evaluating at step 950000/1000000 (95.0%)
Elapsed: 4h 51m 50s | ETA: 15m 21s | Speed: 54.3 steps/s
Eval - Mean Reward: 4.00 ± 1.58, Mean Length: 163
Achievements unlocked: 9/22
============================================================

Step: 950210/1000000 | Episode: 5190 | Epsilon: 0.050 | FPS: 54
Step: 952094/1000000 | Episode: 5200 | Epsilon: 0.050 | FPS: 54
Step: 954204/1000000 | Episode: 5210 | Epsilon: 0.050 | FPS: 54
Step: 956011/1000000 | Episode: 5220 | Epsilon: 0.050 | FPS: 54
Step: 958112/1000000 | Episode: 5230 | Epsilon: 0.050 | FPS: 54
Step: 960182/1000000 | Episode: 5240 | Epsilon: 0.050 | FPS: 54
Step: 962348/1000000 | Episode: 5250 | Epsilon: 0.050 | FPS: 54
Step: 964051/1000000 | Episode: 5260 | Epsilon: 0.050 | FPS: 54
Step: 965763/1000000 | Episode: 5270 | Epsilon: 0.050 | FPS: 54
Step: 967532/1000000 | Episode: 5280 | Epsilon: 0.050 | FPS: 54
Step: 969613/1000000 | Episode: 5290 | Epsilon: 0.050 | FPS: 54
Step: 971397/1000000 | Episode: 5300 | Epsilon: 0.050 | FPS: 54
Step: 973156/1000000 | Episode: 5310 | Epsilon: 0.050 | FPS: 54
Step: 975110/1000000 | Episode: 5320 | Epsilon: 0.050 | FPS: 54
Step: 976969/1000000 | Episode: 5330 | Epsilon: 0.050 | FPS: 54
Step: 978914/1000000 | Episode: 5340 | Epsilon: 0.050 | FPS: 54
Step: 980427/1000000 | Episode: 5350 | Epsilon: 0.050 | FPS: 54
Step: 982336/1000000 | Episode: 5360 | Epsilon: 0.050 | FPS: 54
Step: 984207/1000000 | Episode: 5370 | Epsilon: 0.050 | FPS: 54
Step: 986451/1000000 | Episode: 5380 | Epsilon: 0.050 | FPS: 54
Step: 988224/1000000 | Episode: 5390 | Epsilon: 0.050 | FPS: 54
Step: 990003/1000000 | Episode: 5400 | Epsilon: 0.050 | FPS: 54
Step: 991566/1000000 | Episode: 5410 | Epsilon: 0.050 | FPS: 54
Step: 993286/1000000 | Episode: 5420 | Epsilon: 0.050 | FPS: 54
Step: 995244/1000000 | Episode: 5430 | Epsilon: 0.050 | FPS: 54
Step: 997004/1000000 | Episode: 5440 | Epsilon: 0.050 | FPS: 54
Step: 998823/1000000 | Episode: 5450 | Epsilon: 0.050 | FPS: 54

============================================================
Evaluating at step 1000000/1000000 (100.0%)
Elapsed: 5h 7m 30s | ETA: 0s | Speed: 54.2 steps/s
Eval - Mean Reward: 4.15 ± 1.43, Mean Length: 196
Achievements unlocked: 9/22
============================================================

[CHECKPOINT] Saved to logdir_extended_exploration/enhanced-dqn-extended/2/checkpoint_1000000.pt
[CHECKPOINT] Total elapsed: 5h 8m 18s | Since last checkpoint: 30m 32s

============================================================
FINAL EVALUATION
Total training time: 5h 8m 20s
============================================================
Final Mean Reward: 4.40 ± 1.23
Final Achievements: 8/22

Final Achievement Success Rates:
  wake_up: 90.0%
  collect_wood: 90.0%
  collect_sapling: 85.0%
  place_plant: 80.0%
  place_table: 80.0%
  collect_drink: 55.0%
  eat_cow: 45.0%
  defeat_zombie: 5.0%

Saved final model to logdir_extended_exploration/enhanced-dqn-extended/2/final_model.pt
Metrics saved to logdir_extended_exploration/enhanced-dqn-extended/2/metrics.json
Metadata saved to logdir_extended_exploration/enhanced-dqn-extended/2/metadata.json
============================================================
TRAINING COMPLETE!
============================================================

Final Training Statistics:
  Training Time: 5h 8m 20s
  Final Eval Reward: 4.15 ± 1.43
  Best Eval Reward: 4.70
  Total Episodes: 5457
  Final Loss: 0.0531
  Final Epsilon: 0.0500
============================================================
